LCS,match,total_match
คำสร้อยพิทยาสรรค์,419,2274
นิโรธเลขาวิป,136,2274
ข้าวเปลือกความชื้นข้าวเปลือกหอมมะลิ,44,2274
รร.คำสร้อยพิทยาสรรค์site,32,2274
ตมสินธพกรมราชทัณฑ์อนุกรรมการสามัญกรมราชทัณฑ์ผิดวินัยเสื่อมเสีย,32,2274
วนาลท์กรุ๊ป,30,2274
คำสร้อยพิทยาสรรค์คำสร้อย,29,2274
สังเวียนษี.จ,25,2274
ผักชีผักชีผักชี,21,2274
รร.คำสร้อยพิทยาสรรค์,19,2274
"ข้าวเปลือกหอมมะลิ10,864.234,135.77ข้าวเปลือกหอมมะลิ10,407.753,595.25",19,2274
คําสร้อยพิทยาสรรค์,19,2274
นิโรธเลขาวิปนิโรธ,18,2274
กรมการค้าภายในข้าวเหนียวตลาดนัดข้าวเปลือก,15,2274
แผ่ระยะแรกลมแรงรักษาสุขภาพหนาวเย็นชายฝั่งควรระวังลมแรง,15,2274
พญ.สุมสินธุ์,14,2274
พิทยาสรรค์คำสร้อย,14,2274
ประกันภัยPrimeMinisterInsurance,14,2274
รอบด้านตำรวจจราจรเบนซ์ผิดทางการปล่อยปละละเลยกฎหมายอาญาโยกย้าย,13,2274
นิโรธเลขาพรรคร่วมรัฐบาลวิป,13,2274
กรมราชทัณฑ์ความซื่อสัตย์ยึดถือราชทัณฑ์พอเพียงพอประมาณทัณฑสถานปล่อยปละละเลย,12,2274
คำสร้อยคำสร้อยพิทยา,12,2274
การประสานงานสมาชิกรัฐสภานิติบัญญัติราบรื่น,11,2274
คำสร้อยพิทยาสรรค์กอกคำสร้อย,11,2274
ศาสตราจารย์วิทยาธรมหาวิทยาลัยสุโขทัยธรรมาธิราชสํารวจนําคุณลักษณะคุณลักษณะนํา,10,2274
"ข้าวเปลือก10,000ข้าวเปลือกเหนียว12,000ยุ้งฉาง",10,2274
SustainabilityInvestmentTHSI,10,2274
อนุกรรมการข้าวเปลือกความชื้นข้าวเปลือกหอมมะลิ,9,2274
คำสร้อยพิทยาสรรค์เปิดเรียน,9,2274
ตมสินธพกรมราชทัณฑ์,9,2274
แอบอ้างรับสายมีสติคำกล่าวอ้างโทษหนักประมวลกฎหมายอาญา209ผู้ใด,9,2274
ข้าวเปลือกความชื้นข้าวเปลือก,9,2274
"กลุ่มตัวอย่างจํานวน12,3506,82055.225,53044.78ผลการวิเคราะห์",9,2274
CREDITPHOTO],9,2274
วิปนิโรธเลขา,8,2274
ตำแหน่งหน้าที่หาประโยชน์รู้เห็นเป็นใจผู้ต้องขังรับประโยชน์ตอบแทนประพฤติชั่ว,8,2274
แผ่ระยะแรกลมแรงรักษาสุขภาพหนาวเย็นชายฝั่ง,7,2274
ผู้ต้องขังการอำนวยความสะดวกผู้ต้องขังตอบแทนต้องห้ามยาเส้นผู้ต้องขังค่าตอบแทน,7,2274
ตามเงื่อนไขดุลยภาพได้สัดส่วนชั้นนี้เห็นสมควรเพิกถอนปล่อยชั่วคราวเห็นสมควร,7,2274
ผู้ต้องขังไปนอกการสวมเครื่องแบบเดินผ่านทุจริตต่อหน้าที่รับประโยชน์ผู้ต้องขัง,7,2274
ต้องห้ามยาเส้นผู้ต้องขังค่าตอบแทนตำแหน่งหน้าที่หาประโยชน์รู้เห็นเป็นใจผู้ต้องขัง,7,2274
วนาลท์กรุ๊ปเบนซ์,7,2274
พิชญ์อังคณาจรูญโรจน์,7,2274
พืชผลผักชีผักชีพืชผักสวนครัวประกอบอาหาร,7,2274
ประมาทเลินเล่อผู้ต้องขังไปนอกการสวมเครื่องแบบเดินผ่านทุจริตต่อหน้าที่รับประโยชน์,6,2274
น.พ.วนาลท์กรุ๊ป,6,2274
แมนเชสเตอร์ดารบี้แมนฯยูVs,6,2274
หนาวเย็นลมแรงแผ่ระยะแรกลมแรงรักษาสุขภาพหนาวเย็นชายฝั่ง,6,2274
ม่อนปิ่นฝาง,6,2274
"ข้าวเปลือก9,947.871,052.13ข้าวเปลือก8,065.381,934.62ข้าวเปลือกเหนียว",6,2274
โอภาสการย์สร้างเสริม,6,2274
"ประมวลกฎหมายอาญา209ผู้ใดความมุ่งหมายชอบด้วยกฎหมายอั้งยี่ระวางโทษ140,000",6,2274
ระเบียบแบบแผนการประสานงานสมาชิกรัฐสภานิติบัญญัติราบรื่น,5,2274
233(ศปต้นสังกัดกังวาล,5,2274
"อนุกรรมการข้าวเปลือกความชื้นข้าวเปลือกหอมมะลิ10,864.234,135.77ข้าวเปลือก",5,2274
อาคมพิทยาไพสิฐประกันภัย,5,2274
ราชทัณฑ์ไล่ออกปลดออกผู้คุม,5,2274
"8,1487,415113605",5,2274
ความชื้นข้าวเปลือกหอมมะลิ,5,2274
คำสร้อยคำสร้อยพิทยาสรรค์,5,2274
ร.ร.คำสร้อยพิทยาสรรค์,5,2274
ธ.ก.ส.ชาวนาข้าวเปลือก,5,2274
รร.คําสร้อยพิทยาสรรค์,5,2274
ชาวนาข้าวเปลือกความชื้นข้าวเปลือก,5,2274
"ข้าวเปลือก10,000ข้าวเปลือกเหนียว12,000",5,2274
แน่นหน้าอกแน่นหน้าอกเรอเปรี้ยวแสบกรดควรจะเป็นแน่นหน้าอก,5,2274
เสี่ยโจ้เสี่ยโจ้,5,2274
คำปรารภผักชีผักชีผักชีการตัดตอนเจตนารมณ์พี้ที่ว่าง,5,2274
PattayaMusicFestival,5,2274
ข้าวเปลือกความชื้นข้าวเปลือกหอมมะลิข้าวเปลือก,5,2274
หยิบมือกำเริบเหิมเกริมกระทำการจาบจ้วง,4,2274
บทบัญญัติพระมหากษัตริย์พระมหากษัตริย์ประมวลกฎหมายอาญา112116,4,2274
อ้นภู่แพร,4,2274
มหาวิทยาลัยสุโขทัยธรรมาธิราชสํารวจนําคุณลักษณะคุณลักษณะนําดําํารวจ,4,2274
"54.72ตํารวจพิศุทธ์เตมียเวส58.74%),54.13มล",4,2274
ตำรวจจราจรขบวนรถVIP,4,2274
เขียงพระพุทธเจ้าเกจิครูบาอาจารย์ทำใจบอลลูนยาชาเลือดอุ่น,4,2274
นิโรธเลขาพรรคร่วมรัฐบาล,4,2274
สักหน่อยพักฟื้นสักหน่อยก็ดีภูเขาสักนิดโง่สูด,4,2274
ป๋อจางเกา,4,2274
"8,1487,543605",4,2274
"ธ.ก.ส.ชาวนาข้าวเปลือกความชื้นข้าวเปลือกหอมมะลิข้าวเปลือก10,000",4,2274
หัวใจวายเฉียบพลันวันใดวันหนึ่งระเบิดเวลาเลิกคบเขียงพระพุทธเจ้าเกจิ,4,2274
"ดําํารวจกลุ่มตัวอย่างจํานวน12,3506,82055.225,530",4,2274
03.00แคมป์สถานศึกษาค่ายทหารแคมป์,4,2274
Mobileลดราคาพรรคฝ่ายค้านความไม่พอใจกระทู้ละเลยการชี้แจงกระทู้,4,2274
"1,934.62ข้าวเปลือกเหนียว",4,2274
THONGLORPOLICEรถติด061ผู้ขับขี่ตำรวจจราจรสังเวียนษี,4,2274
เบนซ์วนาลท์กรุ๊ป,4,2274
ข้าราชการการเมืองส.ว.เป็นคุณเป็นโทษเจ้าหน้าที่ของรัฐตำแหน่งหน้าที่กระทำการเป็นคุณ,4,2274
"4,135.77ข้าวเปลือกหอมมะลิ",4,2274
"7,415113605",4,2274
น.พ.วนาลท์กรุ๊ปเบนซ์,4,2274
เสื่อมเสียไต่สวนโจทก์จำเลยพิเคราะห์ประกอบการปล่อยชั่วคราวโดยอาศัยอำนาจ,3,2274
วิปนิโรธติดตลก,3,2274
ผลบุญตอนเที่ยงลืมตา,3,2274
"ทองรูปพรรณ27,742.8028,850",3,2274
คำสร้อยคำสร้อยเจ้าที่คำสร้อยพิทยาสรรค์กอกคำสร้อย,3,2274
เสี่ยโจ้เสี่ยโจ้หนังสือเดินทางกบดานห้วยขวาง,3,2274
คอลเซ็นเตอร์ฟอกเงินจำนงค์”จำนงค์”แอบอ้างรับสาย,3,2274
ราชทัณฑ์ไล่ออกปลดออกผู้คุมราชทัณฑ์Nextตมสินธพ,3,2274
แรบบิทลีโอสเตเดียมสายฟ้าแรบบิทไต่สายฟ้าร้อนแรง,3,2274
อำไพอัมพุเมอร์เซเดสเบนซ์2541ผ่อนส่งอำไพอำไพ,3,2274
อินโดฯตัดไม้ปธน.ตัดไม้2030,3,2274
จํานงค์คอลเซ็นเตอร์ฟอกเงินจำนงค์”จำนงค์”แอบอ้าง,3,2274
"กพช.วิกฤตการณ์น้ำมันเชื้อเพลิง2567น้ำมันเชื้อเพลิงน้ำมันเชื้อเพลิง40,000น้ำมันเชื้อเพลิง",3,2274
คำร้องขอเพิกถอน287คดีอาญายื่นคำร้องเพิกถอนคำสั่งปล่อยชั่วคราว,3,2274
กพช.น้ำมันเบนซินฮอลน้ำมันก๊าดน้ำมันดีเซลหมุนเร็วหมุนน้ำมันเตา0.005,3,2274
น้ำมันเชื้อเพลิงน้ำมันเชื้อเพลิงน้ำมันเชื้อเพลิง,3,2274
287คดีอาญายื่นคำร้องเพิกถอนคำสั่งปล่อยชั่วคราว,3,2274
กลาสว์สกอตแลนด์,3,2274
อรรณพปากต่อปากแพทณปหยอดเอ๊ะคบรึเปล่า,3,2274
ผักชีพืชผักสวนครัวประกอบอาหารพืชผัก,3,2274
คุณลักษณะรอบรู้รอบคอบการผลักดันสําเร็จ,3,2274
อนุกรรมการทางเทคนิคธ.ก.ส.สำนักงบประมาณธ.ก.ส.กรมการค้าภายใน,3,2274
การนัดปส.ศาลฎีกาผู้ก่อความไม่สงบ14.30มวลชนสเปรย์จุดไฟ,3,2274
ข่มขืนใจกระทำการกระทำการ,3,2274
ตลาดนัดกระบือแงศีขรวัวควายตลาดนัดปิดตายวัวควาย,3,2274
สมประสงค์นิลทหารเรือ,3,2274
2992534182นิโรธเลขามีระเบียบแบบแผนการประสานงาน,3,2274
CREDITPHOTO]_,3,2274
HR-VeHEVรับประกันอายุการใช้งานแบตเตอรี่ไฮบริดรับประกัน,3,2274
คำปรารภผักชีผักชีผักชีการตัดตอนเจตนารมณ์,3,2274
ธิเบศรอดุลยเดชบพิตร,3,2274
นิโรธวิปล่ม,3,2274
"ท่าอากาศยานสุวรรณภูมิ9,210ท่าอากาศยาน4,005ท่าอากาศยานสมุย",3,2274
นิโรธวิปนิโรธ,3,2274
นิโรธองค์ประชุมล่ม,3,2274
ตกต่ำชุกค่าเงินบาทอ่อนตัวข้าวเปลือกเป็นลำดับธ.ก.ส.ชาวนา,3,2274
วิปหนักใจวิรัช,3,2274
รอบด้านตำรวจจราจรเบนซ์ผิดทางการปล่อยปละละเลยกฎหมายอาญาโยกย้ายขึ้นอยู่,3,2274
เปิดเรียนOnSite,3,2274
สร้างเสริมประสิทธิผลห้องปฏิบัติการ,3,2274
.จ233(ศปต้นสังกัดกังวาลขออภัยความไม่สะดวก,3,2274
"60.12%),57.96มลําพิน16.34ผลสรุป",3,2274
เสี่ยโจ้ฟอกเงินเสี่ยโจ้,3,2274
สหเจียรเสี่ยโจ้,3,2274
"คุณลักษณะนําผลสรุปคุณลักษณะนํา54.2452.99%),",3,2274
ข้าวเปลือกเหนียวความชื้น,3,2274
เปิดเทอมรร.มัธยมนร.,3,2274
WhizdomForestiasPetopiaคอนโดมิเนียมสซ์ดอมฟอสเทียส์,3,2274
หลักสำคัญคุณูปการศิลปวัฒนธรรมขนบธรรมเนียมประเพณีจารีตดีงามหลักชัยยึดเหนี่ยว,3,2274
"97,3002,118461",3,2274
SETตลาดหลักทรัพย์วารสาร,3,2274
ชาวนาโอดตกต่ำ,3,2274
สหเจียรเสี่ยโจ้ฟอกเงิน,3,2274
ลุมพินีWBCมวยไทย,3,2274
โยกย้ายเบนซ์วนาลท์กรุ๊ปที่ยอมรับเบนซ์,3,2274
ชาวนาข้าวเหนียวกข.,3,2274
ประจำตำบลพระนอนแรกเริ่มประจำตำบลพระนอน,3,2274
วุฒิชัยมวยแชมป์โลกทองแดง,3,2274
MEAการไฟฟ้านครหลวงมหานคร,2,2274
ผักชีพืชผักสวนครัวประกอบอาหาร,2,2274
สังเวียนษี.จ233(ศปต้นสังกัดกังวาลขออภัย,2,2274
อนุสาวรีย์16292495,2,2274
ผักชีผักชีพืชผักสวนครัว,2,2274
คุมขังหมายศาลกำไล,2,2274
112หมุดสนามหลวง,2,2274
อัษฎาWhizdomForestiasPetopiaหาไม่การอยู่อาศัยสิ่งอำนวยความสะดวกครบครัน,2,2274
เพิกถอนหมุดสนามหลวง,2,2274
แมกเลียควอตี้เวล็อปเม้นคอร์ปอเรชั่นMQDC,2,2274
โอบล้อมขับถ่ายล็อบบี้รอยขีดข่วนสองชั้นdrop-offรับฝากPet,2,2274
ตำรวจจราจรการอำนวยความสะดวกเหตุฉุกเฉินเฉพาะรายเดินรถทางเดียววันเวย์,2,2274
นิโรธองค์ประชุมล่มนิโรธเฟิร์มระเบียบวาระการประชุมอายุขัย,2,2274
กรดจากกันเถอะปล่อยทิ้งหัวใจวายเฉียบพลันวันใดวันหนึ่งระเบิดเวลา,2,2274
พระมหากษัตริย์หลักสำคัญคุณูปการก่อเกิดศิลปวัฒนธรรมขนบธรรมเนียมจารีตประเพณีดีงาม,2,2274
เสี่ยโจ้คำพิพากษาเสี่ยโจ้,2,2274
อุดมสมบูรณ์ใจกลาง1.6ลอยฟ้าทอดตัวผืนป่าทางเดินเท้าร่มรื่น,2,2274
ที่อาบน้ำFloordrainชั้นในการกรองอยู่ร่วมคอนโดมิเนียมสซ์,2,2274
ปนัสรุ้งจาดไต่สวนโจทก์จำเลยจำเลยปราศรัย,2,2274
วิปนิโรธวิปวิป,2,2274
เสี่ยโจ้ห้วยขวางเสี่ยโจ้,2,2274
ฟอกเงินเสี่ยโจ้เสี่ยโจ้,2,2274
"พุทธะผู้คัดค้าน112116222,928หลีกอุทัยเวียน",2,2274
นําคุณลักษณะนําเฉพาะตัวเด่นชัดคุณลักษณะเด่นชัดผลการวิเคราะห์,2,2274
รอบด้านตำรวจจราจรเบนซ์ผิดทางการปล่อยปละละเลยกฎหมายอาญาโยกย้ายพลตำรวจตรี,2,2274
เสื้อยืดนุ่งกางเกง,2,2274
ยาบ้าเหล้าขาวหลอนคลุ้มคลั่งอาละวาดทำครัววิ่งไล่คลั่ง,2,2274
เกลี้ยกล่อมหลานชายคลั่งปากคอคลั่งโกรธแค้นระงับอารมณ์ประชาทัณฑ์,2,2274
ขาดสติหลอนคลุ้มคลั่งอาละวาดทางจิตคำรับสารภาพทางจิตประชาทัณฑ์,2,2274
ยาบ้าดื่มเหล้ามันสำปะหลังหลอนขาดสติน่าสงสารสาหตุคลุ้มคลั่ง,2,2274
ตม์ฯกรมราชทัณฑ์ความซื่อสัตย์ยึดถือราชทัณฑ์พอเพียงพอประมาณ,2,2274
ไล่ออกปลดออกผู้คุม,2,2274
สายพานกราฟจุกเสียดแน่นหน้าอกตีบตีบไช่กรด,2,2274
ศาลฎีกาคดีอาญาผู้ดำรงตำแหน่งทางการเมือง,2,2274
วิปล่มนิโรธ,2,2274
เบนซ์น.พ.วนาลท์กรุ๊ป,2,2274
ประกันภัยPrimeMinisterInsuranceประกันภัยคปภ.,2,2274
ใช้หนี้ทำนาทำนา,2,2274
แน่นหน้าอกออกแรงหรือว่าActivityแน่นหน้าอกร้าวรักแร้อัลตราซาวด์,2,2274
เสี่ยโจ้เสี่ยโจ้เสี่ยโจ้หนังสือเดินทางกบดาน,2,2274
ลีโอพุฒตีบ,2,2274
ผลบุญตอนเที่ยงลืมตาสุพรรณ,2,2274
รร.คำสร้อยพิทยาสรรค์siteนร.รร.,2,2274
อนุกรรมการอนุกรรมการอนุกรรมการ,2,2274
ร.ต.พงศธรสาคร,2,2274
ผักชีค่ายทหารคำปรารภผักชีผักชีผักชีการตัดตอนเจตนารมณ์,2,2274
ขบวนรถวีไอพีเบนซ์,2,2274
คำสร้อยคำสร้อยพิทยาคำสร้อย,2,2274
ทหารพรานกองร้อยทหารพราน,2,2274
โอภาสการย์การแถลงข่าวสร้างเสริมคุ้น,2,2274
คำสร้อยพิทยาสรรค์ดีเยี่ยม,2,2274
ชาวนาเคียบคูเมืองจ้างแรงงานกะละมังลอยคอเกี่ยวข้าวเอ่อ,2,2274
"ระบาดวิทยาคำสร้อย1,106สุ่มเปิดเรียนถูกวิธีปนเปื้อน",2,2274
เงินบาท33.2033.45,2,2274
กระทำชำเราผู้สืบสันดานข่มขืนใจกระทำการกระทำการอนาจารใช้อุบายใช้กำลัง,2,2274
อนุกรรมการสร้างเสริมประสิทธิผลห้องปฏิบัติการเขตเมือง(สปคมีประสิทธิผลน่าพอใจ,2,2274
มีจำกัดประสิทธิผลเป็นไข้ลดน้อยลงไข้หวัดใหญ่พร้อมๆ กันความสมัครใจดุลยพินิจ,2,2274
ข้าวเปลือกข้าวเปลือกข้าวเปลือก,2,2274
ตรวจราชการคำสร้อยพิทยาสรรค์แล็บ,2,2274
จางเกามีเพศสัมพันธ์,2,2274
ซีอีโอควงกระทิงโปรเจกต์FlexTalkFlex104.5,2,2274
คุณลักษณะนําเฉพาะตัวเด่นชัดคุณลักษณะเด่นชัดผลการสำรวจกอบกู้,2,2274
AISPLAYUชิงแชมป์,2,2274
โอภาสการย์คำสร้อย,2,2274
COPกลาสว์สกอตแลนด์,2,2274
ก๊าซธรรมชาติเหลวLNG,2,2274
สังวาลนาเกลือละมุงกระโจมเปลือยศศิประภาเพื่อนร่วมห้อง,2,2274
ปลุกระดมมวลชนเฟคนิวส์พระมหากษัตริย์ลิดรอน,2,2274
"8,23897,3002,118461",2,2274
กำลังผลิตเมกะวัตต์,2,2274
ภาควิชากุมารเวชศาสตร์แพทยศาสตร์,2,2274
วิปพรรคฝ่ายค้านไว้วางใจ152ทางแก้ไขจริงใจพรรคฝ่ายค้าน152,2,2274
"ข้าวเปลือกหอมมะลิ10,864.234,135.77ข้าวเปลือกหอมมะลิ10,407.75",2,2274
"4,337.47ธ.ก.ส.ธ.ก.ส.",2,2274
ธ.ก.ส.สำนักงบประมาณธ.ก.ส.กรมการค้าภายใน,2,2274
หุ้นกู้หุ้นกู้หุ้นกู้ระบุชื่อด้อยผู้ถือหุ้น,2,2274
ประกันภัยคปภ.อาคมพิทยาไพสิฐ,2,2274
กนง.อัตราดอกเบี้ย0.50มีจำกัดหน้าเป็นลดน้อยลงความไม่แน่นอนกนง.,2,2274
กนง.อัตราดอกเบี้ย0.5เงินเฟ้อเงินเฟ้อเงินเฟ้อกนง.1.0,2,2274
สายไฟฟ้าสายไฟฟ้าใต้ดิน,2,2274
