LCS,match,total_match
เอ่ยถึงตลับเสื้อยืดกางเกงหลวมตัวโคร่งครองเมืองไอดอล,1,1695
ชีวิตจริงยิ่งกว่ากรักว่ายากเลิกกันยิ่งกว่าผิดที่ผิดที่,1,1695
บุ๋มปนัดดาบุ๋มอั๋นภูวนาทหนักหน่วงหรือว่า,1,1695
ผู้รับเหมาเบี่ยงกฎระเบียบแต่ไกลไถลตรงดิ่งเบรคหลับใน,1,1695
ช่องทางเดินรถแยกตัวคะนองสัญญาณไฟเบี่ยงซูซูกิขก8730,1,1695
ยามาฮ่ากฐ140น็อคเต็มใบห้องเช่าพหลโยธินสายไหม,1,1695
เคมิคอลลล์เซเว่นอีเลฟเว่นเซเว่นเวอการผลักดันใช้แล้ว,1,1695
ลอยกระทงดีงามลอยกระทง,1,1695
พละสัตหีบสัตหีบปิ่นสัตหีบจิตต์สัตหีบสัตหีบ,1,1695
ศาลรัฐธรรมนูญไอติมเบ็ดเสร็จเกรงกลัวไอติมรากเหง้าต้นตอการกดทับ,1,1695
การปลอมเงินตรามูลฐานฟอกเงินปปง.ฟอกเงินแบงค์ดอล,1,1695
"ธนบัตรดอลล่าร์แบงค์ดอลล่าร์10,00030,000,000ทลายโรงพิมพ์",1,1695
ธัญวัจน์กมลศาลรัฐธรรมนูญ,1,1695
บทบัญญัติศักดิ์ศรีความเป็นมนุษย์ศักดิ์ศรีความเป็นมนุษย์จำเพาะเจาะจง,1,1695
ค้าปลีกค้าส่งค้าปลีก,1,1695
ไอติมสมาชิกรัฐสภาเสียงส่วนใหญ่คว่ำ477206ความคาดหมายคิดดู,1,1695
1247ToyotaCross2669ธนบัตรกระเป๋าสตางค์ATMพระเครื่อง,1,1695
กสบทบัญญัติพุทธศักราชเว้นแต่เท่าที่จำเป็นกติกาICCPRแทรกแซง,1,1695
318เคหสถานทำอันตรายกีดกั้นผู้คุ้มครองเช่นว่าจำนงการพา,1,1695
"154,0383.2789,14457.87ออกเดือน28.831,365,98422.89",1,1695
พระราชบัญญัติประกอบรัฐธรรมนูญ(พ.ร่างรัฐธรรมนูญ,1,1695
พ.ขั้นต้นเขตเลือกตั้ง,1,1695
์ตอาหารสัตว์ผู้ส่งออกGAPยางพาราปาล์มมันสำปะหลังกฎระเบียบ,1,1695
ภญ.สุธีเตชคุณวุฒิคณะเภสัชศาสตร์,1,1695
เกี่ยวเนื่องเปือยฉินารายณ์ใบอนุญาตขับขี่ความยินยอมสารเสพติดปัสสาวะ,1,1695
ฟิลิปปินส์ติมอร์เลสเต,1,1695
ตะไลโคมลอยโคมไฟโคม,1,1695
ประจุไฟฟ้าEVChargingStationQTCจัดจำหน่ายหม้อแปลงประจุไฟฟ้า,1,1695
โอ่งพระรามสวนสาธารณะ,1,1695
โคมคล้ายคลึงลอยกระทง,1,1695
SMEBankขานรับขยายวงเอสเอ็มอีSEsMEsMEs,1,1695
SMEBankLINEOfficialAccountSMEDevelopmentBank,1,1695
โกลบอลUACQTCโปรเจกต์ประจุไฟฟ้าEVChargingStation,1,1695
"ยานยนต์25732568ยาน1,055,000402,000257818.41",1,1695
ฬเทวีเทวีตักบาตรตระพังลอยกระทงตักบาตรอาหารแห้ง,1,1695
287คดีอาญายื่นคำร้องเพิกถอนคำสั่ง,1,1695
ทัยรัตนากรธนาคารออมสินSmartMoneyเซ็นทรัลพลาซาอัตราดอกเบี้ยอัตราดอกเบี้ย,1,1695
ลอยกระทงลอยกระทงทรงคุณค่าลอยกระทงลอยกระทงโคมลอย,1,1695
รำคาญดอกไม้เพลิงโคมลอยแอบแฝงประทุษร้ายลอยกระทง,1,1695
ไต่สวนเพิกถอนคำสั่งคดีดำ287คดีอาญา,1,1695
ปนัสรุ้งวิบูลแอมททบลู,1,1695
รุ้งปนัสทัณฑสถานจาดไต่สวน,1,1695
กระทรวงยุติธรรมกู้ยืมค้างชำระบอกเลิกกู้ยืมคำร้องขอไกล่เกลี่ยข้อพิพาท,1,1695
ไกล่เกลี่ยข้อพิพาทลูกหนี้กู้ยืมไกล่เกลี่ยข้อพิพาทความยินยอมเป็นสำคัญ,1,1695
มหกรรมไกล่เกลี่ยข้อพิพาทลูกหนี้,1,1695
คริสโตเฟอร์ห์ดี้ChristopherRohde,1,1695
"1321,494100,588ประดู่กระชอนทุลักทุเลที่นา",1,1695
นักโทษน่าสงสัยผู้ต้องขัง,1,1695
02.00อุทัยผู้ต้องขัง,1,1695
พระบรมราชานุสาวรีย์บ่อน้ำหยดน้ำพระทัย,1,1695
ธิเบศรอดุลยเดชบพิตรพระราชปณิธานสมเด็จพระนางเจ้าราชินีพระราชหฤทัยธิเบศร,1,1695
กลุ่มชาติพันธุ์ชาวเลตื่นตัวหน่วยเลือกตั้งแกนกู่กลุ่มชาติพันธุ์ศก,1,1695
SecretServiceปลอมแปลงธนบัตร,1,1695
กองทัพอากาศAT-กองทัพอากาศอธิปไตยความคุ้มค่าเป็นสำคัญ,1,1695
ลูกหนี้กู้ยืม(กย,1,1695
QueQQRCode,1,1695
พลายซิงฤา,1,1695
พล.ต.โฆสิตวลัญช์กำลังสำรองเลื่อนยศ,1,1695
BanchamekGymBuakawBanchamekเมฆ,1,1695
ธุรกรรมตามเงื่อนไขส่อผู้ต้องสงสัยนายหน้าค่าตอบแทน,1,1695
ผูกพัน2568AT-TextronAviationDefenseLLC,1,1695
รื่นวดีตลาดหลักทรัพย์ก.ล.ต.,1,1695
กึ่งหนึ่ง362723,1,1695
เครนผู้ต้องขังสวทช.มหกรรม,1,1695
สัตหีบลามกอนาจารหาประโยชน์ขู่เข็ญชักจูงยุยงกระทำการลามกอนาจาร,1,1695
"40,000ให้เงิน70,000",1,1695
กัญชากัญชาพัสดุ,1,1695
2.842พัสดุกัญชา,1,1695
พัสดุกัญชากัญชา,1,1695
เทือกเขาบรรทัดพื้นที่รับน้ำท้องฟ้ามืดครึ้ม,1,1695
บึกประมงน้ำจืดกระจานบึกบึก,1,1695
งมประสบอุบัติเหตุณัฐพลผาดทวนสุริยะนายหน้า,1,1695
บึกกระจานกระจานประมงน้ำจืด,1,1695
ประมงน้ำจืดกระจานบึกบึก,1,1695
เผิงฉ่วยเผิงฉ่วย,1,1695
ข้อบัญญัติระเบียบการเป็นการสมควรข้อบัญญัติระเบียบการยานยนตร์อํา,1,1695
ข้อบัญญัติถัดจากข้อบัญญัติระเบียบการยานยนตร์2536ข้อบัญญัติ,1,1695
นักประดาน้ำสายธารแสงสว่าง,1,1695
ททท.พฤติธุรกรรมธุรกรรมตามเงื่อนไขส่อผู้ต้องสงสัยนายหน้า,1,1695
จรุงภุม2501ศาสนศาสตรบัณฑิตนายร้อยนิติศาสตรบัณฑิต,1,1695
วันเพ็ญเย็นใจRiverFestival,1,1695
โลหิตโลหิตรับบริจาค,1,1695
SmartFarmingปตท.,1,1695
โตเกียวทาวน์อาคารสำนักงานรฟท.คลังพัสดุกซ์,1,1695
"กฎระเบียบในขั้นต้นกองทัพบก3,700ยานยนต์พลขับกองทัพบก",1,1695
ลอยกระทงลอยกระทงกระทงลอยกระทง,1,1695
กระทงประดิษฐ์กระทง,1,1695
โลหิตโลหิตโลหิต,1,1695
ระบอบประชาธิปไตยพระมหากษัตริย์ประมุข,1,1695
RiverFestivalสายน้ำ,1,1695
กนิษฐาสมเด็จพระเทพรัตนราชสุดากุมารี,1,1695
"ษฐ์สินธุโซลูชั่น135,247",1,1695
ก้าวหน้าษฐ์สินธุ,1,1695
ปิยก้าวหน้าษฐ์สินธุ,1,1695
203ส.ว.249,1,1695
224ออกเสียงส.ว.,1,1695
สถานีรถไฟลำโพงสถานีรถไฟ105,1,1695
สถานีรถไฟลำโพงสถานีรถไฟลำโพง,1,1695
คาสเซิ่ลเบรนท์,1,1695
เพลย์ธานกองหลังรุ่งเดนมาร์ก,1,1695
ศักดิ์ศรีความเป็นมนุษย์ความเสมอภาคกฎหมายสูงสุด,1,1695
ลอนสติลอน,1,1695
CollegeScholasticAbilityCSAT,1,1695
เอาแต่ร่ำรวยอู้ฟู่เมืองนอกบื้อโง่รังแต่มีสติปัญญา,1,1695
พิศุทธ์ขนส่งสินค้าหาไม่แอบแฝงการหากินหรอหัวคิวแดก,1,1695
มือดีบิดเบือนโบกมือผู้นำประเทศ,1,1695
วันเพ็ญสิบสองนองลอยกระทงลอยกระทงลอยกระทงลอยกระทงรำวง,1,1695
เละเทะติดตาอั๋นภูวนาท,1,1695
น้ำทะเลน้ำทะเลหนังสือรับรองน้ำทะเลค่ารักษาพยาบาลเครื่องอุปโภคบริโภคเครื่องครัวดัดแปลง,1,1695
ลอยกระทงลอยกระทงข้อห้ามลอยกระทง,1,1695
ลอยกระทงกระทงลอยกระทงลอยกระทง,1,1695
ปาดฉอดเหมือนว่าบอกเลิกปล่อยโฮแต่ละครั้งอึดอัดเป้าสายตา,1,1695
ก้านมะยมเด็กน้อยมอเตอร์ไซค์,1,1695
บุ๋มปนัดดาแซะกลิ่นตัวโฟน,1,1695
