LCS,match,total_match
การตรวจวัดรถตู้การสลับ,1,1695
กวดขันอนุบาลขุ่น,1,1695
IGlekteeradetchbowmaylada,1,1695
"""เปซ""อ้าแขนบัปเป้หมดสัญญา",1,1695
สมรสชอบด้วยกฎหมายความเท่าเทียม,1,1695
เนลซี่เนียสต้า,1,1695
เปาฑีธิเซ่นฉาว,1,1695
นักโทษแหกคุกนักโทษ,1,1695
ก๋วยเตี๋ยวทำท่าซอลต์เบ”ล้อเลียนรมต.,1,1695
จรุงภุมวุฒิสภาวุฒิสภาจรุงส.ว.วุฒิสภาส.ว.,1,1695
ระวางโทษประหารชีวิตตลอดชีวิต,1,1695
สาดสอดส่องเเลถ้ำนาคาถ้ำพญานาคผนัง,1,1695
ท้าโจโฉฟอก,1,1695
"หนังโป๊ถูกกฎหมายโปรดักชั่นข้อมือไกลๆ)""",1,1695
ปุ๊บปั๊บเกลี้ยงถาดแครกเกอร์เนยกล้วยหอมวิป,1,1695
บูลเด็กบ้านนอกเอเอฟห่วยรูปร่างหน้าตาสิวคางผด,1,1695
น้อยใจๆๆๆๆๆๆๆๆๆๆๆไล้เออวะดูใจหรอกระบาย,1,1695
นักโทษนักโทษนักโทษ,1,1695
ไล่ล่านักโทษนักโทษ,1,1695
ทรุดถ่างโรยตัว,1,1695
ถ้ำนาคีถ้ำนาคาเพิงลวดลายเกล็ดพญานาค,1,1695
อั๋นภูวนาทคุผลินขยี้,1,1695
กระจานประมงน้ำจืดกระจานบึกบึกพรานบึก,1,1695
pea1129PEAContact,1,1695
ความเกี่ยวข้องสหเจียรเสี่ยโจ้,1,1695
แกะรอยปัญหาครอบครัวแยกทางตัดผมแยกทางคบปริญญาทหารเกณฑ์,1,1695
นักข่าวกิ๊กกิ๊กเงียบๆเป็นตัวเป็นตนกิ๊กชีวิตคู่เข็ด,1,1695
สหเสี่ยโจ้,1,1695
นักขัตฤกษ์พักกลางวันมหานครExpressServiceBMAQครั้งก่อน,1,1695
จุฬาฯChulaCovลองใน,1,1695
จำนนจับภาพหนำใจเสียชะโนดตู้เซฟแน่นหนาค้อน,1,1695
ณุอุณหพิสุทธิ์ครรชิตหงษ์263วางเพลิงเผาทรัพย์,1,1695
แหล่งน้ำส.ป.ก.โตนดโครงข่ายแสร์น้ำดิบEECสทนช.,1,1695
ศาลปกครองศาลปกครองศาลปกครอง,1,1695
มั่งคั่งอิสมั่งคั่ง,1,1695
ยาเสพติดให้โทษเมทแอมเฟตามีน,1,1695
สำนักงานประกันสังคมผู้ประกันตนผู้ประกันตน,1,1695
ส.ลงคะแนนแนะนำตัวคะแนนเสียงศีขรขี่ม้าแนะนำตัวสโลแกน,1,1695
ความในใจหวั่นไหวไม่เชิงหวั่นไหวแพทอารมณ์ดีหยอกแพท,1,1695
เขินอายม้วนคาใจแพทคบแพทเวลาทำงานแพท,1,1695
รับคำท้า..!!นามปากกาฉานนักเขียนเลื่องชื่อตะกอน,1,1695
AT-TextronAviationDefenseLLCความประหยัดซ่อมบำรุงอะไหล่,1,1695
"ทลายโรงพิมพ์PCTผู้ลักลอบธนบัตรUSDธนบัตร36,000",1,1695
"แท่นปั๊มธนบัตรUSD10,000ทูตข้อสังเกตธนบัตร",1,1695
ศาลปกครองให้เช่ากรมธนารักษ์ผู้ชนะEASTWATERสัมปทาน2567ยื่นฟ้อง,1,1695
กรมธนารักษ์ยื่นข้อเสนอบริษัทเอกชนดำเนินกิจการกรมธนารักษ์อิสวอเตอร์ยื่นฟ้อง,1,1695
ประภาเอียดกรมธนารักษ์ศาลปกครอง,1,1695
กรุงไทยเอสเอ็มอีอัตราดอกเบี้ยSMEกรุงไทยเอสเอ็มอีอัตราดอกเบี้ยสภาพคล่อง,1,1695
AISaisvaccineTruevaccinetrueidnetTrue,1,1695
ธิเบศรอดุลยเดชบพิตร,1,1695
พิรุธเหตุจูงใจไอซ์เขียนจดหมายเข็มฉีดยาไอซ์หอพักไอซ์,1,1695
การผ่าชันสูตรพลิกศพต้นสนการผ่าสถาบันนิติเวชศรีนครินทร์แพทย์ศาสตร์มหาวิทยาลัยขอนแก่น,1,1695
บ่อน้ำหยดน้ำพระทัย,1,1695
ลอยกระทงทางวัฒนธรรมมหาธาตุวรมหาวิหารพระพุทธชินราชขอพรสิริมงคล,1,1695
ปาดเหมือนว่าบอกเลิกปล่อยโฮแต่ละครั้งอึดอัดเป้าสายตาไม่เท่าไหร่,1,1695
กันทรมหาสารคามผูกคอตายกันทรมหาสารคามลำคอของมีคมบาด,1,1695
การออกอากาศแล้วด้วยเป็นผู้ใหญ่รอบคอบอยู่ดีๆนั่นแหละขี้เล่นตรงๆ,1,1695
โบว์ครับผมนิดหน่อยเอ็มวีตรงๆตรงๆใจเย็นรีบร้อน,1,1695
พ.ย.)พิศุทธ์เตมียเวส,1,1695
พิศุทธ์พลทหารยุทโธปกรณ์,1,1695
หลักเขตท้วงติงเจ้าภาพกฐินทอดยอดเงินกฐินคืนให้,1,1695
ศูนย์อำนวยการรักษาผลประโยชน์เรือประมงรุกล้ำการประมงอาณาเขตพลเรือโททัพเรือ,1,1695
"อัพเดตเป็นลมซื่อสัตย์ให้เงินสินน้ำใจ150,000",1,1695
แต่ละวันออเดอร์ออเดอร์ออเดอร์ผิดสังเกตออเดอร์990ออเดอร์,1,1695
สิรพฤกษชาติสำโรงเหนือ2550สวมรอยAccountประโยชน์ส่วนตัวตัดหน้า,1,1695
น็อตวิศรุตหิมะ,1,1695
ชมพู่น็อตวิศรุต,1,1695
ผู้มีอิทธิพลหาประโยชน์พวกพ้องคอรัปชั่นหรือว่า….สถานีรถไฟลำโพง,1,1695
(พ.ย.รักษาระดับ(ณเงินอุดหนุนเงินอุดหนุน,1,1695
สร.รฟทสาธารณูปโภคขั้นพื้นฐานเป็นต่อรดํารงส่วนภูมิภาคใจกลาง,1,1695
ข้อแนะนำธนบัตรธนบัตรกระดาษธนบัตรของจริงกระดาษธนบัตร,1,1695
โคมล้านนาผาง,1,1695
ล้านนาโคมล้านนา,1,1695
โคมล้านนาโคม,1,1695
"องค์ประชุมวิปษฐ์สินธุ135,247ผูกโยงผู้เสนอ",1,1695
ภัสร์เทคโนโลยีสารสนเทศ(ศปPCTคริสโตเฟอร์ห์ดี้MrChristopher,1,1695
"แบงก์10,00030,000,000ทลายโรงพิมพ์PCTผู้ลักลอบธนบัตร",1,1695
มีไข้แอดไข้ชักอัลตซาวสัญชาตญาณตัวร้อน,1,1695
มหาสมุทรUNOceanDecadeKickoffConferenceWesternPacific,1,1695
ผู้ก่อตั้งเม็ททอล2506ประภาสจารุเสถียรผู้บัญชาการทหารบก2511,1,1695
151รถถังรถถังรถถัง113เกราะข้อต่อสายพาน,1,1695
พระราชาจิกภูฏานเกราะคุณภาพดีประจำการภูฏานประจำการ,1,1695
เป็นผู้ใหญ่รอบคอบนั่นแหละขี้เล่นตรงๆ?)สเปกแนวโน้ม,1,1695
LOFTER(ลอฟท์์)LegendFood,1,1695
มีสีสันนิดนึงบอยทำสัญญาสงบศึก,1,1695
ลอยกระทงเป็งลอยกระทง,1,1695
ณัฐกิตติ์แข็งแกร่งCompleteTourismEcosystemspringboardQปูพรม,1,1695
สุเทพฟลุ๊คฟลุ๊ค,1,1695
ศาลรัฐธรรมนูญศักดิ์ศรีความเป็นมนุษย์,1,1695
บทบัญญัติจริงอยู่วรรคเท่าเทียมกัน,1,1695
ศักดิ์ศรีความเป็นมนุษย์จำเพาะเจาะจง,1,1695
ลอยกระทงพระรามโอ่ง,1,1695
ยิงปืนลอยกระทงประทุษร้ายดอกไม้เพลิงพลัดตกน้ำพลัด,1,1695
ธัญนิตย์ผู้ว่าการธปท.ลูกหนี้ลูกหนี้ชำระหนี้ค่างวด,1,1695
ผู้คุมทุบตีช็อตความหวาดกลัวผู้คุมพกอาวุธโฆษณาชวนเชื่อสถานทูต,1,1695
จัดฉากเสี่ยโจ้ทางพิเศษมหานครขาเข้า,1,1695
สถาปนิกช่างฝีมือMasterpieceUnmetNeedYoungAffluentUrban,1,1695
ทางพิเศษมหานครขาเข้าผิวถนนกรวยกฎระเบียบ,1,1695
เสี่ยโจ้รัชดาภิเษกสหเจียรเสี่ยโจ้,1,1695
นิติเวชประสบอุบัติเหตุจัดฉากเสี่ยโจ้,1,1695
กู้เงินค้ำประกันขายทอดตลาดเป็นสุข,1,1695
หมุดFully-IntegratedMixed-UseDevelopmentทำเลBigImpactCultural,1,1695
"CompleteHeritageCityเชิดชูความภูมิใจกซ์ที่รวม68,000",1,1695
ฯ”สวทช.FoodInnopolisInnovationContestแฟคเตอร์ในเครือ,1,1695
ร่วมมือร่วมใจโอภาสการย์เชิงปฏิบัติการข้อเสนอแนะ,1,1695
1448การออกกฎหมายการออกกฎหมายธัญวัจน์,1,1695
GovernmentPlatformPDPAComplianceGPPCระดับชาติ2580,1,1695
ยื่นคำร้องเพิกถอนคำสั่งปนัสรุ้ง,1,1695
แอมททบลูจำเลยดูหมิ่น,1,1695
ครูใหญ่พรหมศรธรรมจารี,1,1695
จำเลยการเพิกถอนเป็นอันไต่สวนเพิกถอนปล่อยชั่วคราว,1,1695
"ปาด?""ฉอดเหมือนว่าบอกเลิกปล่อยโฮแต่ละครั้งอึดอัด",1,1695
เหมือนว่าบอกเลิกปล่อยโฮแต่ละครั้งอึดอัดเป้าสายตา,1,1695
บอร์ดVideoConferenceอาคมพิทยาไพสิฐผู้ทรงคุณวุฒิยอดจาก,1,1695
ต้นฉบับของจริงNFTสินทรัพย์เฉพาะตัวงานศิลปะCryptoArt,1,1695
บริษัทข้ามชาติGovernmentPlatformPDPAComplianceGPPCระดับชาติ2580,1,1695
!!!!ถ้ำนาคีถ้ำนาคานำทางเอ้ย!!!!,1,1695
ช่างภาพลังกาถ้ำนาคานาคีถ้ำนาคาถ้ำ,1,1695
!!!!ถ้ำนาคีถ้ำนาคานำทางเอ้ย,1,1695
เจ้าภาพเจ้าภาพกฐินหลวงตาเจ้าภาพ,1,1695
กฐินศาลาวัดการโต้เถียงรัมย์ลูกศิษย์วัด,1,1695
EPไคลแมกซ์เจี๊ยบกาญจนาสุดที่รักรำกรีนอัษฎาพร),1,1695
ความเจริญโดยส่วนตัวE-SportsE-SportsE-Sportsซีเกมส์เอเชียนเกมส์โอลิมปิก,1,1695
ราชมงคลรัตนโกสินทร์พุทธมณฑล,1,1695
101431กระทุ่มสามพราน,1,1695
กรมการขนส่งทางบกเพิกถอนกรมการขนส่งทางบกเพิกถอนใบอนุญาตขับรถพฤติรถโดยสารใบอนุญาตขับรถ,1,1695
ย้อย(ผเสี่ยโจ้สหเจียรสารบบการปล่อยตัว,1,1695
โจ้ปลอมแปลงเอกสารราชการการปลอมดวงตราคนเข้าเมืองขั้นต้นคำพิพากษา,1,1695
อายุความเสี่ยโจ้,1,1695
ปตท.ค้าปลีกOR,1,1695
ตมธำรงช.ภ.ผะชิตช.ภ.,1,1695
สามพรานตมธำรงช.ภ.,1,1695
จำนงช.สตม.เขมหัส,1,1695
ทดลองใช้AZD7442พรูเวนPROVENTผู้ป่วยนอกแท็คเคิล,1,1695
เม็ดเลือดรพรูฟเวนPROVENTAZD7442การประเมินผล,1,1695
ออกฤทธิ์AZD7442ขออนุมัติพรูเวนPROVENTแท็คเคิล,1,1695
กระดูกอ่อนจ้ะซึมเศร้าแย้แย้,1,1695
ปั้นจั่นMishimaRisa,1,1695
เป็นรองเป็นรองรวิชญ์สนธิสัญญาการต่างประเทศวัทนารี,1,1695
มีนัยการอธิบายศักดิ์ศรีความเป็นมนุษย์,1,1695
ศักดิ์ศรีความเป็นมนุษย์จำเพาะเจาะจงบทบัญญัติ,1,1695
อัลฟ่าเดลต้าChulaCov,1,1695
ลอยกระทงแออัดมหรสพ,1,1695
206ส.ว.เนาวรัตน์มณเฑียรพิศาลณวเนาวรัตน์พิศาล,1,1695
พนิตวิกิเศรษฐ์ศิลัมพรรคพลเมืองไทยส.ว.วิชิตวุฒิสภา,1,1695
สมประสงค์นิลผบ.ทร.พล.อ.อ.ธูปะเตมีย์ผบ.ทอ.ญจนวิโรจน์,1,1695
ษฐ์สินธุผู้ก่อตั้งก้าวหน้า,1,1695
สิ้นหวังตลอดกาลทรงอำนาจสถาปนาลุกขึ้นปิย,1,1695
249ส.ว.224ออกเสียงส.ว.,1,1695
ผู้ประสานงานญาณก.ล.ต.สินทรัพย์,1,1695
เป็นอดีตผ่านๆรื้อรับปากเป็นอดีตเป็นครั้งคราวกันเอา,1,1695
ก.ล.ต.ผู้ประสานงานญาณก.ล.ต.,1,1695
เอเปกเอเปกเป็นเจ้าภาพเป็นเจ้าภาพ,1,1695
สายการบินสายการบินสายการบิน,1,1695
TrueVitaminWaterวิตามินแร่ธาตุ,1,1695
"6,7571442,015,262",1,1695
"09.2628,75028,850ทองรูปพรรณ",1,1695
ก้าวหน้าปิยก้าวหน้า,1,1695
เสี่ยโจ้สารบบ,1,1695
"ทองรูปพรรณ28,227.9229,350",1,1695
CenturyUUมังกรLiFude(หฝูเต๋อ),1,1695
ปตท.SmartFarming,1,1695
IoTInternetThings,1,1695
โรยกลีบกุหลาบ,1,1695
MRTAirportRailLink,1,1695
LiveโรคเบาหวานWDDวันดี,1,1695
เต๋อทวิชช์,1,1695
แฟล็กชิปสโตร์,1,1695
เสี่ยโจ้ฟอกเงินห้วยขวาง,1,1695
ขะหุตผู้ก่อตั้งเรท,1,1695
อาคมE-MailchangarcomthFacebookchangarcomhttpsARCOM-CHANG-Thairath-Online-,1,1695
จดหมายจดหมายตอบกลับอนุโมทนาลงชื่อความใส่ใจ,1,1695
ส.อ.กองพันทหารปืนใหญ่อากาศยานมวยสากล,1,1695
"ยอดเงินกฐิน10,008,846.72",1,1695
ต้องโทษกำไลข้อเท้าวันข้างหน้าประสบอุบัติเหตุ,1,1695
"28,850ทองรูปพรรณ29,350",1,1695
หลับในปรี่สนั่นหวั่นไหวนมะหิงษ์รัชดาภิเษกสหเจียร,1,1695
ณัฐวุฒิทุมธัญวัจน์กมล,1,1695
132135สามแยกวิเชียรวิเชียรวิเชียรKawasakiSerpico,1,1695
ไต่สวนคำร้องขอเพิกถอน,1,1695
เพิกถอนรุ้งแอม,1,1695
ปล่อยชั่วคราวปนัสรุ้ง,1,1695
ปนัสรุ้งจาดวิบูลย์แอมททบลู112,1,1695
"ขนส่งสินค้า15.5การท่าเรือแห่งประเทศไทยเทียบท่าแหลมฉบัง13,840111.6306.9",1,1695
"เทียบท่า4,1709.11.4380.2แหลมฉบังเทียบท่า1.0",1,1695
"คำพิพากษา4,000ลดโทษกึ่งหนึ่งโทษปรับต้องโทษโทษจำลงอาญา",1,1695
คดีดำ287คดีอาญายื่นคำร้องเพิกถอนคำสั่ง,1,1695
ยอดเงินกฐินคืนให้คาใจเจ้าภาพกฐินกฐินรวมทั้งหมด,1,1695
GetsunovaThreeManDownfeat,1,1695
ฉานท้าโจโฉ,1,1695
"คาใจตอบกลับ""รถค้าบที่จอดรถ",1,1695
อนุกรรมการสุรสีห์(สทนช.)ยันต์สงรองเลขาธิการสทนช.ห้วงเวลา,1,1695
งานวิชาการผลงานวิจัยสักขีพยานจอมเกล้าทองเปลวเป็นเกียรติจอมเกล้าการลงนาม,1,1695
หมุดสนามหลวงจำเลยปล่อยชั่วคราว,1,1695
ฟลุ๊คดีกรีนักวิทยาศาสตร์,1,1695
เสี่ยโจ้00.30ผกากมลทางพิเศษมหานครขาเข้า,1,1695
ข.ช.ธาดาข.ช.,1,1695
นมะหิงษ์รัชดาภิเษกสหเจียรเสี่ยโจ้น้ำมันเชื้อเพลิง,1,1695
นักโทษนักโทษกรรสาครโกรกกริชโกรกบรรพต,1,1695
นักโทษนักโทษกรรสาคร,1,1695
มะลิพุทธรักษาธิปอุทัย,1,1695
เจ้าพนักงานข.ช.คมกริช,1,1695
ตอนเช้าเสี่ยงภัยมวลอากาศตอนเช้าความชื้นตอนเช้าตอนเช้าตอนเช้า,1,1695
ผู้ขับขี่ซ้อนท้ายผู้สนับสนุนรวมทั้งหมด103สารเสพติดสารเสพติด,1,1695
"เป็นลมซื่อสัตย์ให้เงินสินน้ำใจ150,000",1,1695
ประกันภัยธัญนิตย์ผู้ว่าการธปท.ธนาคารพาณิชย์ประกันภัยธปท.,1,1695
ปริญญาคุณวุฒิปริญญาตรีประกาศนียบัตรบัณฑิตปริญญาโทปริญญาเอกคุรุสภา,1,1695
วรรควรรควรรค,1,1695
ประมวลกฎหมายแพ่งและพาณิชย์1448การสมรส,1,1695
รถตู้รถตู้กวดขันอนุบาลขุ่นรถตู้การตรวจวัดรถตู้,1,1695
"เป็นลมซื่อสัตย์ให้เงินสินน้ำใจ150,000ความซื่อสัตย์",1,1695
เจ้าภาพกฐินความบริสุทธิ์ใจกวัดความเจริญ,1,1695
"2,116ทวิชนาวาIFECตลาดหลักทรัพย์กรมบังคับคดีการขายทอดตลาดเทวี",1,1695
หลานสาวพละมิหนำซ้ำเปลือยกายประจานสำเร็จความใคร่ให้หาทำแทน,1,1695
โคมลอยใบรับรองเครื่องหมายผช.อัมพรยุทธภูมิโคมลอยสมอ.,1,1695
กระทงพืชผักลอยกระทง,1,1695
กะเหรี่ยงเดชากะเหรี่ยงกะเหรี่ยงเป็นปรกติบุคคลภายนอกไปมาหาสู่แมส,1,1695
พลเรือตรีประยูรศูนย์อำนวยการ,1,1695
แผนงานสุภโพธิมหาสารคาม495อินทรีย์ได้ราคาต่อรองราคา,1,1695
เมล็ดพันธุ์เมล็ดพันธุ์เสมอมาเมล็ดพันธุ์ไข่แดงเมล็ดพันธุ์เมล็ดพันธุ์เมล็ดข้าว,1,1695
"บรรจงกรีฑาสำนักงานมาตรฐานผลิตภัณฑ์อุตสาหกรรมสมอ.ใช้แล้ว1,35518,270โคมลอย",1,1695
สุภาเพ่งพิศมหาวิทยาลัยมหิดลสืบทอดอ่อนแอการทำร้ายการทำร้ายร่างกายการทำร้าย,1,1695
ภูริพุฒิกระพือพิณ.ปอสรัลพิเนต.ปอ,1,1695
เปิดเรียนภาคเรียนOn,1,1695
"นีตี้TNITYกำไรสุทธิ173.74กำไรสุทธิ0.832,547เปรียบกับ",1,1695
ธัญนิตย์ผู้ว่าการธปท.ธนาคารพาณิชย์ประกันภัยธปท.ธรรมาภิบาล,1,1695
พิศุทธ์เตมียเวสลดราคา,1,1695
พาดพิงคดีอาญาCarigalipttepiOperatingCompanySdnBhd,1,1695
CarigalipttepiOperatingCompanySdnBhdCPOCนิติบุคคล,1,1695
รอยแผลเหวอะหวะเขี้ยวลำคอแหว่ง,1,1695
ลอยกระทงเซ็ตติ้งCOVIDFreeครอบจักรวาลUniversalPrevention,1,1695
ถูกวิธีอรรฆกรมการแพทย์,1,1695
จรัลด้วงแป้น,1,1695
สฤษดิ์ธนะรัชตจอมพลถนอม,1,1695
มะลิพุทธรักษาธิปอุทัยไล่ล่านักโทษ,1,1695
เกี่ยวข้าวเกี่ยวข้าวเกี่ยวข้าว,1,1695
เทาขช.1720ชักลากเก๋งทวนชันสูตรพลิกศพ,1,1695
เนินเขานบตำ,1,1695
นบตำงา,1,1695
(นรข.)ธิปพล.ร.ต.ถนอม,1,1695
ผู้จัดงานผู้ร่วมงานยึดหลักลอยกระทงเซ็ตติ้งCOVIDFree,1,1695
