LCS,match,total_match
จุดยืน112ในนามของพรรคร่วมรัฐบาล112ยึดหลักพระมหากษัตริย์,1,2274
วิรัชพรรคร่วมรัฐบาลวิป,1,2274
"Baiya1,309การอุดมศึกษา",1,2274
ห้องปฏิบัติการห้องปฏิบัติการคำสร้อยพิทยา,1,2274
รอยสักป๊อกภัสสร,1,2274
ป๊อกภัสสรจิราธิวัฒน์,1,2274
รจนาขอนสวรรค์ฉัดระบบประสาทคนไข้สวรรค์ระบบประสาท,1,2274
บังอรภู่แพรน้องสาวประจำตำบลพระนอนแรกเริ่มประจำตำบล,1,2274
มวยไทยระดับนานาชาติสนามมวยลุมพินีมวย,1,2274
ลูกไม้หล่นไม่ไกลต้นคัมภีร์ภีร์”หวงติ่งตัวยงแจมGUESS,1,2274
KIMJAEJOONGASIATOURCONCERTINBANGKOK,1,2274
เบนซ์วีไอพีส่ออาญา,1,2274
"อินเตอร์แข้งตัวหลักเต้""",1,2274
ศรีสุวรรณจรรยายื่นคำร้องนายกองค์การบริหารส่วนตำบลส.พระนอนเกรียงไกรชอบด้วยกฎหมาย,1,2274
ผู้บริหารท้องถิ่นไต่สวนอำนาจหน้าที่ชักช้าเที่ยงธรรมผู้บริหารท้องถิ่นบัญญัติข้าราชการการเมือง,1,2274
บี้บาร์เซโลน่าวีก,1,2274
พิทยาระบาดวิทยา(ส,1,2274
คุณครูรร.คำสร้อยพิทยาสรรค์siteนร.รร.,1,2274
นิโรธองค์ประชุมล่มนิโรธเฟิร์มระเบียบวาระการประชุมอายุขัยสักครู่,1,2274
กรมการค้าภายในศักย์กรมการค้าภายในอนุกรรมการอนุกรรมการอนุกรรมการบรรลุอนุกรรมการ,1,2274
นิโรธวิปนิโรธมั้งวิปนิโรธวิปวิป,1,2274
ร.ต.พงศธรสาครข้อกฎหมายพ.ย.)มธุรสสาขาวิชาคณะครุศาสตร์,1,2274
ถมเจ้าของที่ดินการถม,1,2274
ไต้หวันแผ่นดินใหญ่แบ่งแยกเอกราชไต้หวัน,1,2274
วิป299ระเบียบแบบแผนการประสานงานสมาชิกรัฐสภานิติบัญญัติราบรื่นราบรื่น,1,2274
ของหลวงกราบบังคมทูลขอพระราชทานวัดหลวงเสด็จพระราชดำเนิน,1,2274
"สินธุ์8,1487,528",1,2274
“สมหัดอวดเก่งวิปพรรคฝ่ายค้านไว้วางใจ152ทางแก้ไข,1,2274
สีดาขามสะแกแสงเหลื่อมแก้งประทายคิ้วขาม,1,2274
กนง.กนง.อัตราดอกเบี้ย0.50มีจำกัดหน้าเป็นลดน้อยลงความไม่แน่นอน,1,2274
"ChulaCov-แพทยศาสตร์กลั่นกรอง2,316.8ใบยาBaiyaSARS-CoV-VAX",1,2274
ประมาณการบทวิเคราะห์บริษัทหลักทรัพย์,1,2274
"6051,922,7098,238",1,2274
เทียะศาลากลางห้องปฏิบัติการ,1,2274
"1,922,7098,2381,807,30497,480",1,2274
"8,1487,4151136051,922,709",1,2274
หน่วยเฉพาะกิจทหารม้าวางมาตรการลาดตระเวนพล.ต.นฤทธิ์หน่วยเฉพาะกิจ,1,2274
ร.ท.ลาภกองร้อยทหารม้าหน่วยเฉพาะกิจทหารม้าลาดตระเวนม่อน,1,2274
กปภ.กปภ.ผู้ว่าการ,1,2274
"28,350รูปพรรณ28,850",1,2274
"6051,922,7091,951,572",1,2274
พึงประสงค์955เนก้าพบ163ไข้ปวดศีรษะคลื่นไส้อาเจียน,1,2274
ธนาคารกลางเฟดอัตราดอกเบี้ย,1,2274
"ดิเรกChulaCov2,316Baiya1,309การอุดมศึกษา(อว.)พระราชกำหนด",1,2274
พิทยาสรรค์โอภาสการย์,1,2274
คำสร้อยพิทยาสรรค์โอภาส,1,2274
เรียนจบคณะนิติศาสตร์อัสสัมชัญขี้น้อยใจบังเอิญทั้ง ๆ ที่เก๊ก,1,2274
ไฮบริดอาคมพิทยาไพสิฐ,1,2274
เซเว่นอีเลฟเว่นTechAICreativeAICampAI,1,2274
"8,2388,1487,543605",1,2274
สปีดGBสงวนสิทธิ์ตามเงื่อนไขผู้จัดงานSirirajEducationExpo,1,2274
ของรางวัลiPadAir10.9GBHuaweiYP,1,2274
น้อง ๆHealthcareทุนการศึกษาชิคSirirajEducationExpoศิริราช,1,2274
ลิงก์bitly,1,2274
โรงเรียนมัธยมคำสร้อยพนักงานเจ้าหน้าที่,1,2274
คำสร้อยแต้คำสร้อย,1,2274
สหเจียรเสี่ยโจ้ฟอกเงินห้วยขวาง,1,2274
ติดพันชื่อเล่นคิงภูมิลำเนาสถานีรถไฟคิงต้องโทษ,1,2274
เสี่ยโจ้อัยการสูงสุด.ปอมูลฐานฟอกเงินเสี่ยโจ้,1,2274
กรมชลเต็มกำลังเดโชพลกรมชล(ปยาบค้อนสิงหนาท,1,2274
NGOsสมาชิกวุฒิสภาเข้าพบสนองตอบข้อราชการ,1,2274
นอนคว่ำโชกของแข็งลำตัวแผลฉกรรจ์,1,2274
คำสร้อยพิทยาสรรค์ข้าวของเครื่องใช้เป็นมา,1,2274
คำสร้อยคำสร้อยพิทยาสรรค์คำสร้อย,1,2274
วัตถุมงคลรับบริจาคคัดแยกรายรับอายัด.ปปคนใกล้ชิด.ปป,1,2274
หมดสตินิมนต์ความไม่พอใจสานุศิษย์ความเคารพนิมนต์สังขาร.ปป,1,2274
ด้วนถอดถอนราชเลขาธิการสำนักพระราชวังฆราวาสน่าไว้วางใจนิมนต์ศาสนกิจ,1,2274
เดชาวิริยะกะปิMEAการไฟฟ้านครหลวงMEAกระแสไฟฟ้าMEA,1,2274
19.00ข้าวของเครื่องใช้คำสร้อยพิทยาสรรค์,1,2274
ภัสร์เทคโนโลยีสารสนเทศ(ศป,1,2274
MrAlexKuprecht,1,2274
ก้าวหน้าษเปซเข้าชื่อเจตจำนง112ลงชื่อ112.org,1,2274
ก้าวหน้าProgressiveMovementลงชื่อ112หมดเวลา112ลงชื่อ,1,2274
ทั้งคืนอ่อนเพลียให้ทานพาราให้ทานโจ๊กเกลือแร่อาเจียน,1,2274
สมาคมการค้ามหกรรมTIEFA,1,2274
พิชญ์อังคณาจรูญโรจน์โศกเศร้าตั้งตัวลางบอกเหตุ,1,2274
ให้ทานโจ๊กเกลือแร่อาเจียนให้ทานท้องเสียอาเจียน,1,2274
bitlyjXMXPhOfficialTrailerwatchvW,1,2274
ท่าเทียบเรือฐานทัพเรือสัตหีบสัตหีบ,1,2274
ล้อมกระทำชำเราผู้สืบสันดานข่มขืนใจกระทำการกระทำการอนาจารใช้อุบาย,1,2274
ยธฤตรวจราชการตรวจราชการคำสร้อยพิทยาสรรค์แล็บ,1,2274
ลอยกระทงผู้ควบคุมแออัด,1,2274
ปฏิทินวันสำคัญลอยกระทง,1,2274
เวศรองเลขาธิการกสทช.กระจายเสียงโทรทัศน์คณะผู้แทนHSASAKI,1,2274
กสทช.เป็นเจ้าภาพทวิภาคีกสทช.MinistryInternalAffairsCommunications,1,2274
"โอภาสPfizer2,493,95755.4606,94213.54,500,000ขั้นสูงสุด",1,2274
"โอภาสการย์ขั้นพื้นฐาน(สพฐ.)เปิดเรียนOn-site12,000เปิดเรียน",1,2274
"รร.คำสร้อยทยาสรรค์1,200",1,2274
"มนูญ""ชัวร์รีบด่วน",1,2274
SUVฟุตพาท,1,2274
คู่รักจูงมือวิวาห์,1,2274
เณย์คำสร้อยพิทยาสรรค์,1,2274
ตรวจราชการคำสร้อยพิทยาสรรค์,1,2274
สุรทินพิจารณ์พรรคประชาธิปไตยใหม่,1,2274
อนุกรรมการสร้างเสริมโอภาสการย์อนุกรรมการสร้างเสริม,1,2274
"1,951,57219,5428,238",1,2274
เสียค่าธรรมเนียมเสียค่าธรรมเนียมบิดาถูกต้องตามกฎหมายบิดาผู้ต้องขังสถานเอกอัครราชทูตสถานกงสุล,1,2274
ราชทัณฑ์ฝากเงินโอกาสดีพสุกระทรวงยุติธรรมบัญชีเงินฝากผู้ต้องขังธนาคารพาณิชย์,1,2274
เป็นอันการลามนเม็กฉินารายณ์ฆ้องชัย(ธ),1,2274
สหัสพระอุโบสถปาฏิโมกข์วันพระธรรมยุตษีสหัสปาฏิโมกข์,1,2274
ญาณญาโณ)มส.ธรรมยุตตราตั้งสี่แยกม่นตัวอักษร,1,2274
ขายสดจ้างแรงงานค่าแรงตกต่ำข้าวเปลือกความชื้นหอมมะลิความชื้น,1,2274
340ตลิ่งชันขาเข้า,1,2274
มานฝายเม่น,1,2274
กอบกำเม่นชกต่อยมานฝายเม่นจั๊วะ,1,2274
06.30เดินรถทางเดียวอุทัยตัดถนนอุทัยตำรวจจราจร,1,2274
เรือประมงหมึกอนันตอับปาง,1,2274
แพนเค้กเขมนิจ,1,2274
ตำรวจจราจรการอำนวยความสะดวกเหตุฉุกเฉินเฉพาะรายเดินรถทางเดียววันเวย์โทษทางวินัย,1,2274
ProcessAutomationRPA,1,2274
"09.2928,25028,350ทองรูปพรรณ27,742.8028,850",1,2274
เลี้ยงข้าวควักผ,1,2274
อนุกรรมการอัจฉริยะอัจฉริยะผู้พัฒนาอัจฉริยะสามย่านอัจฉริยะอัจฉริยะ,1,2274
112ปราศรัยอนุสาวรีย์16292495ปล่อยชั่วคราวจำเลยคุมขัง,1,2274
SmartCityWeekSmartCityAmbassadorsอัจฉริยะASEAN,1,2274
แผนงานอัจฉริยะความซ้ำซ้อนอัจฉริยะความทันสมัยอัจฉริยะกำลังคน4.0,1,2274
ทางลงสุไหงลกสนามกีฬาLSOCCER,1,2274
สุไหงลกสนามกีฬาLSOCCERปราศรัยวิรัช,1,2274
ส่งกลิ่นเหม็นทำกับข้าว,1,2274
ฟลุคแอปเปิ้ลสีสะเหงียน,1,2274
โทนสตัฟฟ์โทนโทน,1,2274
ช่วยด้วยปล้นนอนหลับflukeappleanniversary,1,2274
ตำรวจจราจรขบวนรถVIPจังหน้าสติกเกอร์THONGLORPOLICEรถติด,1,2274
monthlaterafterTalaywasbornแขม่วท้องจ่ะ,1,2274
การซื้อขายเอ็นเตอร์ไพรส์เดลต้าเลคนิค,1,2274
"""พนิโรธเลขา",1,2274
03.00เข้03.00แคมป์สถานศึกษาค่ายทหารแคมป์,1,2274
โฉมงามเจ้าชายอสูรเล่าเรื่องดั่งเทพนิยาย,1,2274
สินธุ์คำสร้อยพิทยาสรรค์,1,2274
ป๊อกrunepนะจ๊ะ,1,2274
ป๊อกภัสสรจิราธิวัฒน์ราศรี,1,2274
04.00ขั้นพื้นฐาน(สพฐ.)สถานศึกษาซักซ้อมผู้เรียนเป็นสำคัญสถานศึกษา,1,2274
คำสร้อยพิทยาสรรค์เทียะ,1,2274
กุ้งกุ้งตลอดทั้งกุ้งพอกับอุปทานกุ้งกุ้ง,1,2274
กุ้งตรวจโรคกุ้งกุ้งแหล่งที่มากุ้งห้องเย็นกุ้ง,1,2274
กุ้งกุ้งกุ้งห้องเย็นกุ้งตระหนักถึงพยุงกุ้ง,1,2274
ทรูฟี่แฟลกชิพสโตร์เซ็นเตอร์พอยท์สยามสแควร์,1,2274
"1,864Sandboxกักกัน134",1,2274
ละเอียดยิบเบิกเงินผัว,1,2274
ก็ดียอดเงินกฐินสาธุชนกฐินญาติโยมกรุงไทยขะ,1,2274
กฤษฎางค์นุต,1,2274
ไต่สวนมีเหตุผลเพิกถอนหมุดท้องสนามหลวงการปล่อยตัวโจทก์เสื่อมเสีย,1,2274
วิปนิโรธติดตลกมั้ง,1,2274
นิติบัญญัติตราบใดที่คอร์รัปชันนิโรธ,1,2274
นิโรธติดตลกมั้ง,1,2274
แข็งขันเอกภาพประสานกัน,1,2274
นิโรธเลขาวิปวิป,1,2274
จับสลากใช้ทุนแพทยสภา,1,2274
สายพานกราฟจุกเสียดแน่นหน้าอกตีบตีบกรดจากกัน,1,2274
"เกือบจะสัมฤทธิ์เกือบจะ1321,494100,588",1,2274
กรรกำเนิดโหน,1,2274
หยิบมือเหิมเกริมพุทธะบทบัญญัติพระมหากษัตริย์พระมหากษัตริย์ประมวลอาญา,1,2274
นิวส์พระมหากษัตริย์ลิดรอนพระมหากษัตริย์ความจงรักภักดีผู้คัดค้านการยับยั้งบทบัญญัติ,1,2274
พุทธะบทบัญญัติพระมหากษัตริย์พระมหากษัตริย์ประมวลอาญา112ผู้คัดค้าน,1,2274
อัษฎาอัษฎาWhizdomForestiasPetopiaหาไม่การอยู่อาศัยสิ่งอำนวยความสะดวก,1,2274
แนวความคิดกฐินอาตมาอาตมาสะดุดตาญาติโยมคล้ายๆป้ายหาเสียง,1,2274
ผสานPre-saleWhizdomForestiasPetopiaสิทธิพิเศษ1265bit,1,2274
ตูดรอยสักป่าน,1,2274
ป่านอภิญญารอยสัก,1,2274
จุกป่านตูด,1,2274
นิ่งนอนใจชาวนาตกต่ำกึ่งธนาคารเพื่อการเกษตรและสหกรณ์การเกษตรธ.ก.ส.ชาวนาตกต่ำ,1,2274
ทางไปรษณีย์ออกคำสั่ง1528เพิกถอนต้องห้าม17098เทียบเคียง,1,2274
"กลุ่มตัวอย่างจํานวน12,3506,82055.225,53044.78",1,2274
คุณลักษณะควบคุําทางการทหารตํารวจ,1,2274
คุณลักษณะคุณลักษณะรอบรู้รอบคอบการผลักดันสําเร็จ,1,2274
อาตมาญาติโยมทอดกฐิน,1,2274
ทอดกฐินการเผยป้ายหาเสียงดูดีป้ายหาเสียงขะทอดกฐินอาตมา,1,2274
ทอดกฐินลูกวัดญาติโยมญาติโยมวันพระลูกวัดป้ายโฆษณา900,1,2274
ลอยกระทงใช้การลอยกระทง,1,2274
กิตติ์ธาราพรรคไทยศรีวิไลย์,1,2274
แทบจะเป็นไปไม่ได้จางเกา,1,2274
นร.รร.คําสร้อยพิทยาสรรค์,1,2274
องค์ประชุมนิโรธเลขาวิปนิโรธนิโรธรับน้องฝ่ายรัฐบาล,1,2274
วหาธนาคารเพื่อการเกษตรและสหกรณ์การเกษตรธ.ก.ส.ตกต่ำธ.ก.ส.ตกต่ำธ.ก.ส.ข้าวเปลือก,1,2274
อับHondaLaneWatchรีโมทWalkAwayAutoLock,1,2274
วิปวิรัชวิป,1,2274
โปรคอร์ปPROENสัญญาจ้างสายไฟฟ้าสายไฟฟ้าใต้ดินมหานคร,1,2274
เข็มขัดนิรภัยเบาะคล่องตัวการขับขี่พวงมาลัยเพาเวอร์เกียร์แปรผัน,1,2274
ทุเรียนกอกดูแลเอาใจใส่ลูกบ้านแบ่งกลุ่มลูกบ้านบ้านใกล้เรือนเคียงส่งข้าวส่งน้ำ,1,2274
กอกลูกบ้านบ้านใกล้เรือนเคียงทำครัวให้ความร่วมมือพืชผักสวนครัวประกอบอาหารเกื้อกูล,1,2274
โพรงจมูกผู้ต้องขังกรับราชทัณฑ์ผู้ต้องขัง187เอ็กซ์เรย์ฮุ,1,2274
ผู้ต้องขังทัณฑสถานคิ้วไข้น้ำมูกข่ายคิ้วคลา,1,2274
การกีฬาชุนอารี(สWebConferenceZOOMระเบียบวาระ,1,2274
อาคมE-MailchangarcomthFacebookchangarcomhttpsARCOM-CHANG-Thairath-Online-,1,2274
ไฮบริดทุกรุ่น,1,2274
คปภ.งานพิธีประกันภัยPrimeMinisterInsurance,1,2274
ประกันภัยPrimeMinisterInsuranceไฮบริด,1,2274
ประกันภัยคปภ.ประกันภัย,1,2274
Virtual360°,1,2274
องค์ประชุมองค์ประชุมล่ม,1,2274
เชษฐ(“ASW”)ผู้พัฒนาอสังหาฯBestChoice,1,2274
HR-VeHEVRS,1,2274
กองร้อย227เขมตชด.กุลบุตรตชด.227ยนต์,1,2274
131แรงม้า253นิวตัน,1,2274
บังกลาเทศศรีลังกาแอฟริกาบีโอไอเครื่องนุ่งห่มสิ่งทอบรรจุภัณฑ์สิ่งพิมพ์,1,2274
บีโอไอTOISCแนวโน้มแอฟริกาซ่อนกลิ่นรองเลขาธิการบีโอไอบีโอไอ,1,2274
INVESTORYMobileExhibitionSchoolsวาร์ปยานกอบกู้,1,2274
วดีลดาวัลย์หัวหน้ากลุ่มตลาดหลักทรัพย์ตลาดหลักทรัพย์financialliteracyปลูกฝัง,1,2274
ผลการศึกษาตีพิมพ์วารสาร,1,2274
แปรผันAdaptiveCruiseControlwithLow-SpeedFollowACC,1,2274
ช่องทางเดินรถRoadDepartureMitigationSystemwithLaneDeparture,1,2274
HondaSENSINGตรวจจับคนเดินถนนฟังก์ชันการชนCollisionMitigation,1,2274
มสธ.โพลโพลวันข้างหน้าประชาธิปัตย์เวนจุดยืนระบอบประชาธิปไตย,1,2274
กรมธรรม์ก็ต่อเมื่อสมองตายสมองตายศิริราช,1,2274
เบี้ยผู้ว่าศิริราชศิริราชเป็นตายเท่ากัน,1,2274
ชาวนาตลาดนัดกระบือแงศีขร,1,2274
Shopee11.11BigSale,1,2274
วิปนิโรธวิป,1,2274
ประกันภัยคปภ.คปภ.,1,2274
Shopeeโค้ดโปรโมชั่นShopee,1,2274
721498427403375,1,2274
ยาฆ่าเชื้อคำสร้อยพิทยาสรรค์,1,2274
testkitสุ่มCDCUคำสร้อย,1,2274
StandardOperationProcedureSOP,1,2274
ชาวนาคูเมืองจ้างแรงงานกะละมังลอยคอเกี่ยวข้าวเอ่อเรื่อย,1,2274
แอบอ้างเครื่องแบบหลับนอนหลับนอนแอบอ้างผู้ใดเครื่องแบบระวางโทษ,1,2274
"6058,23897,3002,118461",1,2274
AllHondaHR-VeHEVNEWHR-Ve,1,2274
มอบอำนาจกิตติ์แอดมินพัชรรพีคินวลัญช์แอดมิน,1,2274
ความหลากหลายชีวภาพความหลากหลายชีวภาพ,1,2274
"290,603502,55431,493",1,2274
"824,650290,603502,55431,493",1,2274
"โรจน์เพาเวอร์UPAวิสามัญผู้ถือหุ้นทุนจดทะเบียน2,513,034,292.50ทุนจดทะเบียน",1,2274
ลเล็ตเข้าบัญชีค่าธรรมเนียมทำกำไรดอลลาร์สหรัฐเปิดบัญชีeFCDeFCD,1,2274
KrungthaiGoldWalletMTSGoldสุกเปิดบัญชีลเล็ต,1,2274
ผลการศึกษากวางไอโอวาเวสต์,1,2274
LOVEiSEntertainmentโปรเจกต์ฟลูแถวหน้าโปรเจกต์มิวสิกจี๊บ,1,2274
ฟ.กฤษฎาโปร่ง.รฟ.สถาพรมุสิก.ส.ร,1,2274
ไฟหน้าส่องสว่างการขับขี่เวลากลางวันLEDไฟท้ายLEDLight,1,2274
OutstandingInvestorRelations,1,2274
RisingStarSustainability,1,2274
LifeServiceProvider,1,2274
บุฟเฟต์ปิ้งข้าวปั้นสุกี้ชาบูMegaBuffetLover,1,2274
ชุหะวัณ,1,2274
กรมสุขภาพจิตสุขภาพจิตสุขภาพจิตวัดใจ,1,2274
เจ้าสัวเบญจรงค,1,2274
ลอยกระทงกรมอนามัยลอยกระทง,1,2274
วิไลกระทรวงการอุดมศึกษา วิทยาศาสตร์ วิจัยและนวัตกรรม(อว.),1,2274
แป๊ะฮูลูเบตงเบตงเบตงเบตงแป๊ะฮูลู,1,2274
ผู้เดินท่าอากาศยานสุวรรณภูมิ,1,2274
"1,493ให้ความร่วมมือ175การตักเตือนต้องตาม",1,2274
