LCS,match,total_match
พาร์คจองแล้วประวัติการผู้ชำนาญการประวัติการสั่งจองคนไข้ภูมิต้านทาน,1,2274
TENJOTOHKAIYAKINIKUบุฟเฟต์พรีเมียมบุฟเฟต์บุฟเฟต์ปิ้ง,1,2274
TENJOซูชิพรีเมี่ยมบุฟเฟต์ปลาดิบสดๆชั้นดีฟัวก,1,2274
On-yasaiShabuDeBearบุฟเฟต์ชาบูซูชิอั้น,1,2274
องค์ประชุมแล้วกันกระทู้ถาม,1,2274
ของแข็งลำตัวแผลฉกรรจ์,1,2274
สหประชาชาติCOPกลาสว์สกอตแลนด์,1,2274
องค์ประชุมทั้งวันทั้งคืนขอร้อง,1,2274
นาคาศัยรมต.การประสานงานวิป,1,2274
โอภาสการย์คำสร้อยพิทยาสรรค์,1,2274
คำสร้อยพิทยาสรรค์สุ่ม,1,2274
ร.ร.คำสร้อยพิทยาสรรค์ห้องปฏิบัติการPCR,1,2274
AISPLAYการพบกันAISPLAY,1,2274
ร้อยตรีกฤตอารี,1,2274
"""แอ๊วปราณีฉลุย",1,2274
นฤบดินทร์วัฒดม,1,2274
องค์ประชุมพรรคร่วมรัฐบาลวิป,1,2274
นิโรธเลขาวิปวิรัช,1,2274
สุขุมวิทอุมารถสองแถวพฤกษาสุขุมวิทธุระยานรถสองแถว,1,2274
นิโรธเลขานิโรธ,1,2274
MartinKuผู้จัดการทั่วไปDEVIALETDEVIALETDEVIALETExclusiveDistributor,1,2274
99.1กษัตริย์112คะแนนเสียงแสวงหาผลประโยชน์ความแตกแยก,1,2274
Deco2000DEVIALETPremiumResellerStoresท้าเสียงเพลง,1,2274
เกษตรและสหกรณ์พืชผลผักชีผักชีพืชผักสวนครัวประกอบอาหารพืชผักในไม่ช้า,1,2274
อีสวอเตอร์เป็นผู้แทนบำบัดน้ำเสียประดิษฐ์คล้านิคมอุตสาหกรรม,1,2274
"สาระล่ำซำประกันชีวิตประกันชีวิตเบี้ยประกันภัย439,181.912.28",1,2274
"ตกต่ำฝันร้ายแทบจะหมดแรงนาปี6,000เมล็ดพันธุ์รถไถ",1,2274
ขาดทุนพ่อค้าคนกลางความชื้นสิ่งเจือปนนาปีปลอมปนพ่อค้าคนกลางกดราคา,1,2274
"เบี้ยประกันภัยตัวแทนประกันชีวิต217,4890.4749.52ประกันชีวิต183,1175.68",1,2274
ด้าLazada11.11OurBiggestOne-DaySale,1,2274
เลียสมุยบันอีซีเทรดเซ็นเตอร์ประตูน้ำ,1,2274
ชาติมหาอำนาจแทรกแซงเพาะเชื้อฮ่องกงอาหรับล้มล้างรู้เท่าทันอามิสสินจ้าง,1,2274
98.9ล้มล้างหวังดีบิดเบือนใส่ร้ายจาบจ้วง98.4ประมุข,1,2274
ผู้ช่วยศาสตราจารย์นพดลกรรณิกาโพลSUPERPOLLสถาบันวิจัยความเป็นผู้นำ,1,2274
อาพาธมรณภาพไพโรจน์กรมการแพทย์,1,2274
"8,1487,5436051,922,709",1,2274
"คำสร้อยพนักงานเจ้าหน้าที่1,200เจ้าที่คัดแยกแล็บห้องปฏิบัติการ",1,2274
"คำสร้อยพนักงานเจ้าหน้าที่1,200",1,2274
เมล็ดพันธุ์เมล็ดพันธุ์เมล็ดพันธุ์เมล็ดพันธุ์,1,2274
เมล็ดพันธุ์เมล็ดพันธุ์เมล็ดพันธุ์คุณภาพดี,1,2274
นิทรรศการTCEBสมาคมการค้ามหกรรมTIEFA,1,2274
กรุงศรีอยุธยาเงินบาทเช้านี้33.39แข็งค่า33.44ธนาคารกลางอัตราดอกเบี้ย,1,2274
สถานที่สำคัญสถานีรถไฟหอนาฬิกาสวนสาธารณะโผนกิ่งCicadaMarket,1,2274
อัจฉริยะทรูทรู,1,2274
Covid-ภาคอุตสาหกรรมความเข้มงวดความถี่Covid-กักกันOQี่อ,1,2274
Go196339142105,1,2274
AsianTelevisionฉอดBestEntertainmentPresenterHostClub,1,2274
ChiefExecutiveOfficer,1,2274
พีชโปสเตอร์ใจกลางไทม์สแควร์,1,2274
