LCS,match,total_match
โล่เชิดชูยล,48,1271
PattayaMusicFestival,21,1271
ผู้อพยพล่มช่องแคบ,21,1271
ขับไล่แอมเนสตี้,20,1271
เสกสกลอัต,15,1271
แอมเนสตี้อินเตอร์เนชั่นแนล,15,1271
ศูนย์รวม(ศปปส.,15,1271
ขับไล่แอมเนสตี้อินเตอร์เนชั่นแนล,12,1271
การประชุมสุดยอดSummitDemocracy,12,1271
USFDAประมาณการข้อบ่งชี้คอร์สบรรจุภัณฑ์มิลลิกรัมแคปซูล,10,1271
"""คิมติงปัด",10,1271
เสกสกลอัตแรมโบ้,10,1271
ลุมพินีช่างภาพอนาจาร,10,1271
หยุดยั้งเสื่อมถอยพังทลาย,9,1271
ร่อนพิบูลควนร่อนพิบูล,8,1271
ผลการศึกษา762ตามหลังให้ยาผลการศึกษาinterimresult์ลด,8,1271
ข้อบ่งชี้คอร์สบรรจุภัณฑ์มิลลิกรัมแคปซูลแคปซูลแคปซูลมิลลิกรัม,7,1271
2.6ไอโฟน111,7,1271
คลองห้าสังเกตการณ์ข่มขืนการกล่าวอ้างลึกซึ้งช่างภาพข่มขืนลวนลาม,7,1271
โอภาสการย์เด็บบราเฟิร์ทอินโดไชน่า,7,1271
AISaisvaccineTRUEUSSD707vaccinetrueid,7,1271
YGEntertainmentต้นสังกัดBLACKPINK,7,1271
ลงชื่อขับไล่แอมเนสตี้,6,1271
"อำลา""ล้ง1919",6,1271
"บุฟเฟ่ต์ประกาศรับล้างจานเหมาสนน90,000",6,1271
น้อยหรือโรคมะเร็งUSFDAประมาณการข้อบ่งชี้คอร์สบรรจุภัณฑ์,6,1271
TMAบัณฑิตบริหารธุรกิจศศินทร์,6,1271
ร่างสัญญาคอร์สการเจรจาต่อรองค่าขนส่ง์คคัมคอร์เรท,6,1271
Grooveออฟฟิศเศสเซ็นทรัลเวิลด์บานเลื่อนชั้นแสตมป์ข้อมือ,6,1271
ภูริภูมินทร์พุ่มพ.ต.เวทย์สงค์การก่อการร้ายพ.ต.ท,6,1271
ศฝสุ่มแน่นหน้าอกแสดงผล592561179แม่ครัว,6,1271
รจิตอรรฆกรมการแพทย์แมรฐสดีอุบัติภูมิต้านทาน,6,1271
ช่างภาพลวนลามเก็บตัวเขาใหญ่ต่อหน้าอับอายช่างภาพการถ่ายทำ,5,1271
งานเทศกาลPattayaMusicFestivalละมุงแมสก์,5,1271
CREDITPHOTO],5,1271
แชเปียชิพ,5,1271
PfizerModernaแต่ละวันAstraZenecaSinovac,5,1271
BLACKPINKษามโน,5,1271
ควนร่อนพิบูล,5,1271
อนุวัตรเนรมิตไพโรจน์รุจิ,5,1271
ของกองถูกกระทำช่างภาพเลิกงานถูกกระทำอนาจารหลีกณิ,5,1271
ปุ้ยปิศิก,5,1271
ภูริภูมินทร์พุ่ม,5,1271
YGEntertainmentต้นสังกัด,4,1271
PattayaMusicFestivalละมุงแมสก์,4,1271
AFFSUZUKICUP,4,1271
วันทำการใช้ใบทะเบียนรถพนักงานเจ้าหน้าที่ทะเบียนรถเคลือบทะเบียนรถการเคลือบ,4,1271
โต้แย้งราคาประเมินเจ้าพนักงานบังคับคดี,4,1271
การประชุมสุดยอดSummitDemocracyหยุดยั้งเสื่อมถอยพังทลาย,4,1271
ขายทอดตลาดเทวีเจ้าพนักงานบังคับคดี,4,1271
นางงามช่างภาพลวนลามเก็บตัวเขาใหญ่ต่อหน้าอับอายช่างภาพ,4,1271
นิด้านางงามผู้เข้าประกวด,4,1271
นายกองค์การบริหารส่วนตำบลควนร่อนพิบูล,4,1271
ช่างภาพก้นปลุกปล้ำลุมพินีเขาใหญ่ข่มขืนคลองห้าสมยอม,4,1271
"GPCผู้ออกแบบท่าเทียบเรือขนถ่ายขนถ่าย4,000,000อียูGPC",4,1271
"199,502331,80243,468",4,1271
งานเทศกาลPattayaMusicFestivalละมุง,4,1271
โครงข่ายทางเรือชายฝั่งคุณภาพสิ่งแวดล้อมจิตต์กัลฟ์เวลลอป,4,1271
ChinaHarbourEngineeringCompanyLimitedท่าเทียบเรือEHIAการผลักดัน,4,1271
สัดส่วนผสมไบโอดีเซลน้ำมันดีเซลหมุนเร็ว,4,1271
มือปืนนายกองค์การบริหารส่วนตำบลควนร่อนพิบูล,3,1271
กรมบังคับคดีขายทอดตลาดเทวี,3,1271
GPCจุดแข็งGULFแข็งแกร่งสาธารณูปโภคPTTTANKด้านการบริหาร,3,1271
กรมบังคับคดีมีระเบียบบทบัญญัติ331วรรคคำวินิจฉัยศาลฎีกาท้องตลาด,3,1271
เบรนร็อด์ส,3,1271
โอภาสการย์เด็บบราเฟิร์ทอินโดไชน่ายูนิต,3,1271
กรมการขนส่งทางบก(ขทะเบียนรถตัวอักษรตัวอักษรบอกชื่อซีดจาง,3,1271
แอบหนีการแอบติดต่อสื่อสารบุคคลภายนอกเห็นควร,3,1271
"เคลือบเสียค่าใช้จ่ายยื่นคำขอ7,200ลอกถูกวิธีค่าธรรมเนียมยืด",3,1271
เพนกวินไบร์ทพฤกษา,3,1271
น้อมรำลึกพระมหากรุณาธิคุณ,3,1271
มหาวิทยาลัยธรรมศาสตร์1122553โกหกพระมหากษัตริย์ประณามพระเจ้าแผ่นดินเสก,3,1271
ธนาคารกลางเฟดอัตราดอกเบี้ย,3,1271
ทะเบียนรถตัวอักษรตัวอักษรบอกชื่อซีดจางเคลือบเสียค่าใช้จ่าย,3,1271
ฝรั่งปลุกปั่นเกลียดชังล้มล้างพระมหากษัตริย์แฝงสอนพิเศษชักจูง,3,1271
VaccineExpertConsensusMeetingModernaVaccineScheduleองค์การเภสัชกรรม,3,1271
มวลอากาศลมแรงลมแรงรักษาสุขภาพชาวเรือเดินเรือ,3,1271
มวลอากาศลมแรงลมแรงรักษาสุขภาพชาวเรือเดินเรือตกในลมแรง,3,1271
ส.ก.เหรัญญิกนิมิตผู้ประสานงานฝั่งธนฯกนิษฐ์แห้วสันตติ,3,1271
น้ำมันดีเซลหมุนเร็วสัดส่วนผสมไบโอดีเซลน้ำมันดีเซลหมุนเร็วสัดส่วนผสมน้ำมันดีเซลหมุนเร็ว,3,1271
ษฐ์ชีวาเพนกวินไบร์ทพฤกษาณัฏฐธิดาพรหมศร,3,1271
04.45ครามประตูรั้วล้มทับสนามฟุตบอลรามอินทรากุ่มสนามฟุตบอล,3,1271
ธิเบศรอดุลยเดชบพิตร,3,1271
กระจกเงารับบริจาคกระจกเงาเขียนหนังสือสงจ่าหน้าสำนักเลขาธิการนายกรัฐมนตรี10300,3,1271
“คล็อปป์”เอาจริงตอบแทน,3,1271
.ปอท.ศูนย์รวม(ศปปส.นพดลภาษิตเลขาฯล่วงละเมิด,3,1271
รจิตผลการศึกษา762ตามหลังให้ยาผลการศึกษาinterimresult,3,1271
เสกสกลอัตแรมโบ้แอม,3,1271
"ดอลลาร์ไต้หวัน6,000ไต้หวัน",3,1271
มงกุฎMissUniverse,3,1271
ช่างภาพอนาจารนางงาม,3,1271
เข่าวีกส่อซูซูกิ,3,1271
ร่อนพิบูลร่อนพิบูล,3,1271
"80,6571,508363",3,1271
ยูฟ่าแชมเปี้ยนส์แบ่งกลุ่ม,3,1271
ถูกกระทำนิด้าช่างภาพก้นปลุกปล้ำลุมพินีเขาใหญ่ข่มขืน,3,1271
รันนิด้านางงามผู้เข้าประกวดเมธาลุมพินีช่างภาพอนาจาร,3,1271
ผู้เข้าประกวดเมธาลุมพินีช่างภาพอนาจาร,3,1271
พญ.อัมพรเบญจพลกรมสุขภาพจิต,3,1271
ลูกเสือลูกเสือเนตรนารี,3,1271
ประสิทธิวงศาผู้รับมอบอำนาจสินทรัพย์โกลบอลเจ้าหนี้บุริมสิทธิจำนองเทวี,3,1271
PfizerModernaแต่ละวันAstraZenecaSinovacPfizer,3,1271
อรัญอภัยโตเกียว,3,1271
นุ่งกางเกงยีนส์กีรติพลาซ่าสร้อยทองรูปพรรณทางได้,3,1271
ช่างภาพมือดีอนาจารนางงามMUTหื่นขืนใจ,3,1271
อาคมพิทยาไพสิฐ,3,1271
ช่างภาพหื่นข่มขืนนางงาม,3,1271
คลังแสงมหาสารคามวิปกระทู้,3,1271
คลังแสงมหาสารคามวิป,3,1271
มืดลาดพร้าวชีพจรพม.ยโสภัณฑ์เข้าเกณฑ์รปภ.,2,1271
พิเคราะห์โจทก์จำเลย,2,1271
การต่างประเทศวรรณกรรมอักษรศาสตร์พระราชนิพนธ์ร้อยแก้วร้อยกรองสมัญญา,2,1271
THCCBDดูแลรักษาคนไข้วงการแพทย์ก้าวหน้าCBDMedical,2,1271
ป้ายประกาศเบอร์โทรศัพท์ความบริสุทธิ์ใจ,2,1271
ไฟล์ซีรี่ส์Squid,2,1271
วดีตั้งเป้าหมายซฯSolutionProviderCBDกลั่นแต่ต้น,2,1271
ข้อคิดเห็นตรงกันข้อคิดเห็นข้อสรุปเฉพาะเจาะจง,2,1271
รับเชิญดาบสองคมคำเชิญ,2,1271
ไต้หวันผู้ต้องสงสัยหลิน,2,1271
เมล็ดพันธุ์เมล็ดพันธุ์เมล็ดพันธุ์,2,1271
กมกระทู้ถามกมกมประพฤติมิชอบกม,2,1271
อิทธิสำนักงานคดีอาญาสำนักงานอัยการสูงสุด,2,1271
ขับไล่แอมเนสตี้อินเตอร์เนชั่นแนลบานปลาย,2,1271
"7,2181,987,08980,6571,508363",2,1271
ชาวนาสนองความต้องการติดขัดบางประการพิษภัยเลขาชาวนาข้อสรุป,2,1271
YGEntertainmentต้นสังกัดBLACKPINKBLACKPINK,2,1271
แพร่หลายTHCกระบวนการผลิตCBDปลายน้ำบำบัดภายใต้การควบคุมกัญชา,2,1271
ORANGETHEWORLD,2,1271
ช่างภาพอนาจารนางงามเขาใหญ่ลุมพินีเก็บตัวนงนุชนิด้า,2,1271
"แข้งแมนฯยูค""",2,1271
ประมวลกฎหมายแพ่ง295วรรคให้อำนาจเจ้าพนักงานบังคับคดีราคาประเมินบริษัทเอกชน,2,1271
111กระจกเงารับบริจาค,2,1271
นิสสันนาวาบษ831,2,1271
การประชุมสุดยอดSummitDemocracyยุ่งยากประชุมสุดยอดสหประชาชาติประชาคมการกดดัน,2,1271
การขายทอดตลาดสินทรัพย์โกลบอลเจ้าหนี้บุริมสิทธิจำนองยื่นคำร้องเพิกถอนคำสั่ง,2,1271
เจ้าพนักงานบังคับคดีเจ้าหนี้โจทก์ลูกหนี้ได้ประโยชน์หน่วงเหนี่ยวลูกหนี้ถ่วงเวลา,2,1271
สินทรัพย์โกลบอลเจ้าหนี้บุริมสิทธิจำนองเทวี,2,1271
จำเลยลูกหนี้ตามคำพิพากษายื่นคำร้องเพิกถอนการขายทอดตลาดการขายทอดตลาดเจ้าพนักงานบังคับคดีขายทอดตลาด,2,1271
แอมเนสตี้แอมเนสตี้,2,1271
น้อมรำลึกถึงพระมหากรุณาธิคุณ,2,1271
Blackpinkต้นสังกัดYGentertainment,2,1271
PublicPrivatePartnership,2,1271
"29,050สัมปทานผันแปร",2,1271
หอพักห้องเช่าหอพัก,2,1271
ผู้เดินการยกเว้นค่าธรรมเนียมหนังสือรับรองสร้างเสริมe-VaccinePassportกรมการแพทย์,2,1271
ร่อนพิบูลเป็นอดีตควนควน,2,1271
"ล้างจานล้างจาน90,000",2,1271
นพดลสิตพสกนิกรเสกสกลอัต,2,1271
จักรวาลกัณพนักงานรักษาความปลอดภัย,2,1271
นิสสันมาร์ชขว572,2,1271
แอมเนสตี้อินเตอร์เนชั่นแนลNGOตั้งโต๊ะลงชื่อเสก,2,1271
"ล้างจาน90,000บุฟเฟ่ต์",2,1271
เสกสกลอัตแอมเนสตี้,2,1271
สถานพยาบาลสุขภาพจิต1323จตุพรปฐมวัยส่วนร่วมอนุสัญญาปรกติ,2,1271
ยืนหยัดเดิมพันความรักชาติพระมหากษัตริย์แอมเนสตี้อินเตอร์เนชั่นแนลขับไล่,2,1271
แอมเนสตี้เขียนจดหมายปนัสรุ้งแทรกแซงจงใจคำวินิจฉัย,2,1271
ไว้อาลัยสุขภาพจิตปฐมวัยเรื่องสำคัญผู้ดูแลเด็กปฐมวัยจุดสิ้นสุดนิทาน,2,1271
พวกคุณยุยงส่งเสริมเห็นดีพระมหากษัตริย์ทุนทรัพย์ฝรั่งปลุกปั่นเกลียดชัง,2,1271
สร้างเสริมธรรมการยาใจปฐมวัยบทสนทนานิทานความสูญเสียอุบัติ,2,1271
ง้อแพทณป,2,1271
เสกสกลอัตแอมเนสตี้อินเตอร์เนชั่นแนล,2,1271
"ปาล์มตรละภาษีสรรพสามิต5.99น้ำมันเชื้อเพลิง4,0001.99น้ำมันเชื้อเพลิง",2,1271
ลาดพร้าวยโสภัณฑ์หมดอายุไขกินกันคนสวนโชคร้าย,2,1271
ไล่ออกจงรักภักดีเสกสกลธุรกรรมชังกรมการปกครองแอม,2,1271
คลองห้าธัญบุรี747ข่มขืนกระทำชำเราขัดขืนคลองห้าคลองห้าสังเกตการณ์,2,1271
กลเครื่องสูบน้ำเขื่อนเพชรคลองระบายน้ำเท่าๆเขื่อนเพชรบ้านกุ่มแร้ง,2,1271
ปล้นติดหนี้การพนันเด็กเสิร์ฟปล้นกศน.แยกทาง,2,1271
"ไต้หวันเฮโรอีน1,172",2,1271
คิมเป็นรูปเป็นร่างงั้น,2,1271
"เฮโรอีน446.8ดอลลาร์ไต้หวัน6,000ไต้หวัน",2,1271
เสื้อยืดนุ่งกางเกงยีนส์กีรติพลาซ่าสร้อยทองรูปพรรณ,2,1271
มึนสกูตเตอร์ถนนใหญ่แช่,2,1271
VARเป็นจังหวะล้ำหน้า,2,1271
แหลมฉบังเรือโทยุทธนาการท่าเรือแห่งประเทศไทยรักษาการแทนการท่าเรือแห่งประเทศไทย,2,1271
ความเสมอภาคความหลากหลายLGBTQIA+),2,1271
ศฝ0022.2929รายงานสรุปศฝสะเดาแอบหนีการแอบ,2,1271
ชิลีเหยียบธงชาติไทย,2,1271
ช่างภาพอนาจารข่มขืน,2,1271
ช้างเผือกช้างเผือกอรัญอภัย,2,1271
"เหมาล้างจานบุฟเฟ่ต์90,000",2,1271
รับบริจาคเอ็มโอยูะหว่างกติกา,2,1271
ไต้หวันเฮโรอีน446.8,2,1271
คิชฌกูฏเฝ้าศพเพียงลำพังคิชฌกูฏ,2,1271
อีเมลแอปเปิ้ลไซเบอร์,2,1271
ลุมพินีช่างภาพอนาจารนางงามเขาใหญ่ลุมพินีเก็บตัวนงนุช,2,1271
รศ.ดร.ภวัค,2,1271
นัทข้าราชการประจำ111ยากไร้สำนักงานเลขาธิการนายกรัฐมนตรีกระจกเงารับบริจาคกระจกเงา,2,1271
นางงามช่างภาพอนาจาร,2,1271
ตั้งโต๊ะลงชื่อขับไล่แอมเนสตี้,2,1271
อวัยวะเพศชายมุก,2,1271
BLACKPINKให้ความร่วมมือระบาดวิทยา,2,1271
ประจันเสมอกันประจันเชาวน์วัศจำปานอนหงายกางเกง,2,1271
"เสียงานเหมา90,000",2,1271
GrooveGrooveออฟฟิศเศสเซ็นทรัลเวิลด์บานเลื่อนชั้นแสตมป์,2,1271
เศษอาหารล้างน้ำสิ่งสกปรกภาชนะ,2,1271
บำราศนราดูรศรีธัญญา,2,1271
BuriramCastleตากสินWalkIn,2,1271
RadioFreeAsia,2,1271
ช่างภาพอนาจารปุ้ย,2,1271
PfizerAISaisvaccineTRUEUSSD707vaccine,2,1271
การปราศรัยกรมทหารราบปลดอาวุธศักดินาทิปุระยื่นฟ้อง116,2,1271
เจิ้งเฟยMrRenZhengfeiผู้ก่อตั้งเว่ยเทคโนคารวะ,2,1271
นัทจัดซื้อจัดจ้างผู้จำหน่ายดิ้งครุภัณฑ์ปากท้องเพื่อประโยชน์ของราบรื่น,2,1271
สำนักเลขาธิการนายกรัฐมนตรีสลน.),2,1271
เมธาลุมพินีช่างภาพ,2,1271
เที่ยงคืนสนามฟุตบอลประตูรั้วประตูรั้วกราง,2,1271
ชาวเรือเดินเรือตกในลมแรงตอนเช้าลมแรงตอนเช้าลมแรง,2,1271
กรรรอยัลริเวอร์กรุงธนพลัดสัมนาส.ก.เหรัญญิก,2,1271
ครามประตูรั้วล้มทับ,2,1271
กบง.กบง.น้ำมันดีเซลหมุนเร็วสัดส่วนผสมไบโอดีเซลน้ำมันดีเซลหมุนเร็วสัด,2,1271
มหัศจรรย์กระท่อมกัญชา,2,1271
จำเลยจำเลยยื่นคำร้อง,2,1271
ลูกเสือเนตรนารีลูกเสือ,2,1271
"ทองรูปพรรณ27,697.3228,800",2,1271
universeสายสะพายแบ่งแยกถือสาเพียงแต่ว่าความภาคภูมิใจจักรวาลใครก็ตาม,1,1271
"ไขข้อข้องใจ6,0736,538",1,1271
ชุนเสี่ยวChunXiaoLi,1,1271
ส่งท้ายเลกบูรณ์ซุลต่อสัญญาฟูแท็คติกเต็มตัว,1,1271
เยิร์นนิคเวน,1,1271
แพทร่วมมือร่วมใจติดค้างนอกนั้นแพทซีนเนื้อเรื่องละมุน,1,1271
ออกผลเสียสิทธิหนวิจารณญาณอั้น,1,1271
รับบริจาคไอโฟน111นัทข้าราชการประจำ111ยากไร้สำนักงานเลขาธิการนายกรัฐมนตรี,1,1271
แน่ๆเจี๊ยบเจี๊ยบเมื่อกี้แพทเอ็มวีคิดได้เปรม,1,1271
บุ๋มบุ๋มบั่นทอนวันสำคัญบุ๋มบุ๋มนางงามความคาดหวัง,1,1271
ก่อนอื่นฟิลิปเลียปกรณ์บดินทร์แท็คติกนิดหน่อยแท็คติก,1,1271
รันนิด้านางงามผู้เข้าประกวด,1,1271
ร็อด์สเลสเต,1,1271
นิด้านางงามช่างภาพอนาจาร,1,1271
ผู้เข้าประกวดช่างภาพอนาจาร,1,1271
บุ๋มบุ๋มข่มขืนหมกบุ๋มบุ๋มผู้หลักผู้ใหญ่แวก,1,1271
สายการบิน17712706699PGLiveChatbit,1,1271
ผลวิจัยแวกน”,1,1271
โหนกรรกำเนิด,1,1271
เถอะสเต็ปการบำบัด,1,1271
อรรณพแพทณป,1,1271
แพทดินเนอร์กระดุมเปิดอกมั่นหลานสาว,1,1271
ตอนเช้าลมแรงตอนเช้าลมแรงตอนเช้าลมแรง,1,1271
มวลอากาศลมแรงลมแรงรักษาสุขภาพ,1,1271
"แข้งตัวหลักคุโนะ,เนเลี่ยมบราม่า",1,1271
ถึงที่ฝางเสียเวลาฝางเสียค่าใช้จ่าย,1,1271
รันนิด้าผู้เข้าประกวดนางงาม,1,1271
RealSizeBeautyบุ๋มแต่ไหนแต่ไรบุ๋มนางงามไซส์,1,1271
ศศลักษณ์ส่อซูซูกิ,1,1271
