LCS,match,total_match
อวัยวะซิลิโคนซี่โครงเมื่อไรอ่อนแอยื้อเนื้อเยื่อผิดรูป,1,1445
สันนิษฐานแย้แต่งหน้าคสอสกปรกแย้ตจว.,1,1445
เชษฐพาลพรรษมุนี,1,1445
ปล่อยทิ้งDNAประสบอุบัติเหตุ,1,1445
"วิดแนวโน้มผู้รักษาร่วมมือร่วมใจบลูมเบิร์ก(ณ1847,200",1,1445
บู๊เมฆหมัดเข่าศอกสมุนละครสัตว์ปิ่น,1,1445
ไฟแรงโลดกลมจุดไฟหวาดเสียวเซฟตี้การถ่ายทำปิ่น,1,1445
พลเรือโทกฤชมะลิเจ้ากรมอุทกศาสตร์น้ำทะเลน้ำทะเล1.30,1,1445
กลาสว์เจ้าภาพ,1,1445
กระสอบทรายน้ำทะเลฟันหลอ,1,1445
ศาลฎีกาคดีอาญาผู้ดำรงตำแหน่งทางการเมืองประทับ,1,1445
youtubeZcFtlkwMyoutubekoXWtDwp,1,1445
หรือว่าเลียนเมายายาแก้ไอหวัดน้ำมูกเถอะอดทน,1,1445
เอ้าป๋ากิ๊กดู๋ดูๆเงาเป็นเงาสะพาย,1,1445
ความยากแค้นทุกสิ่งทุกอย่างความต่ำความต่ำความต่ำความในใจกลบกลืน,1,1445
ทิพเสถียรกระดาษกระทุ่ม,1,1445
ความเสียใจสุดซึ้งโกร่งรามา,1,1445
กรีดยางพารานอนหงายกระเด็นถังน้ำ,1,1445
วิปนิโรธเลขา,1,1445
คำสร้อยพิทยารับบริจาค,1,1445
ครอบงำชี้นำพ.ถ้อยคำ,1,1445
คำพิพากษาตำแหน่งหน้าที่ต้องห้าม,1,1445
คำพิพากษาศาลฎีกาคดีอาญาผู้ดำรงตำแหน่งทางการเมืองพิพากษา,1,1445
ดื้ออินซูลินอินซูลิน,1,1445
น้ำทะเลกระลอกน้ำทะเล,1,1445
หยุดยั้งความเสื่อมโทรม2030,1,1445
แพทยสภาดั่นผู้นำเข้าบางกรณีหน่วยราชการสถานทูตผู้รับผิดชอบของจริง,1,1445
ทพ.อาคมคนไข้คนไข้สถานพยาบาลสถานพยาบาลขอยืมอะไรก็ตาม,1,1445
ทพ.อาคมประดิษฐสบส.สถานพยาบาลคนไข้ถูกต้องตามกฎหมาย,1,1445
จารุมอเตอร์ทอดผ้าไตรกฐินศาลาการเปรียญกรวดเหลือบ,1,1445
จักรพงษ์จุฑาธิบดิ์โกลบอลผู้บริหารระดับสูงพิสมัยลิขิตกมล,1,1445
เงินสนับสนุนผู้ชนะพารามปิกโตเกียวเกมส์เหรียญทองเหรียญเงิน,1,1445
พารามปิกเกมส์โตเกียวเหรียญรางวัลโตเกียวไอคอนฮีโร่,1,1445
ทอดกฐินแน่ๆขี้แกล้งขนลุกตั้งสติผ้าไตรกฐิน,1,1445
บัติกรมการแพทย์ลพิ,1,1445
แพกซ์วิด774แพกซ์วิดมิลลิกรัมมิลลิกรัม389,1,1445
775385377mgเม็ดเม็ดเม็ดเข้านอน,1,1445
บัติกรมการแพทย์ลพิแพกซ์วิด,1,1445
ความหลากหลายชีวภาพปฏิญญา,1,1445
ทุมเลียมอมแมมเป็นสาวจึ้งเลียปิ่นชริน,1,1445
คุณตาพินงวยนางรำรันผีปอบตับน่าคิด,1,1445
"45041,00924,007393198แผงลอยรกร้างคนซื้อ",1,1445
ผีปอบคนป่วยคนป่วยเฮือนไผเฮือนหอนโลด,1,1445
"สยองนิ่มนวล""เมี้ยกมีดพกสุพรรณเกื้อเอียดเกื้อ",1,1445
ชายโครงชายโครงมีดพร้า,1,1445
ตรวจราชการบรรยายสรุปที่พักผู้โดยสารท่าอากาศยานไสANDAMANOTOPSHOP,1,1445
หันหน้าทักท้วงแค่นั้นนั่นแหละโลดนิโรธวิปคนคุม,1,1445
วิปฝ่ายรัฐบาลวิปการปฏิรูปใจร้ายใจร้ายความปั่นป่วน,1,1445
นิ้วนางBabyallIneedisyou...”,1,1445
อาบคู่มือดัดแปลงการครอบครองเสียค่าปรับ,1,1445
ไม่เป็นไรที่ราบสูงไม่เป็นไรโง่ต่อปากต่อคำคนซื่อไม่เป็นไรตามนั้น,1,1445
นักหนาที่ราบสูงเวรกรรมแท้ๆน่าสงสารพวกผมเจ็บช้ำน้ำใจแล้วกัน,1,1445
นรเจ๊กพิรุณประโคนประโคนชนกนัดดาตุ้ม,1,1445
เปิดเรียนOnSite,1,1445
ขั้นสูงสุดUniversalPrevention,1,1445
เมืองหลวงก๊าตห่าCatLinh-HaDong,1,1445
แตะต้องนรล้มเลิกความจริงใจตลอดชีวิต240สาวิตรีเจ๊ก,1,1445
"เขน1,034โรงเรียนมัธยมนิเวศน์1,413เขนสาลี1,436",1,1445
เกรียงมัธยมศึกษาตอนต้นสามเสนเกรียงไกรนักการศึกษานักการศึกษาสามเสนมัธยมศึกษาตอนต้น,1,1445
นครชัยศรีสามพรานตูม,1,1445
น้ำทะเลฝั่งแม่น้ำน้ำทะเล,1,1445
"ยืดหยุ่นความเป็นผู้นำผลประกอบการ20,995กำไรสุทธิ5,332ผู้เช่าเช่นเคย",1,1445
แผ่แผ่คุระยะแรกลมแรงรักษาสุขภาพหนาวเย็นชายฝั่ง,1,1445
วาดกระสอบทรายกระสอบทรายน้ำทะเลฟันหลอขออภัยจัดเรียงกระสอบทราย,1,1445
หมัดส.ว.แนวโน้ม,1,1445
เสื้อยืดกางเกงวอร์ม,1,1445
ฉิ่งแป๊ะหมัด,1,1445
โกดังกะปิเข้าชุดปคเภสัชกรภัทผู้ทรงคุณวุฒิรองเลขาธิการ,1,1445
กลั่นแกล้งฝังใจโดยตั้งใจสวาทสุพรรณโผงผางสุพรรณคาใจ,1,1445
ผู้ลงมือสวาทนิ่มนวลห้องนอนเปื้อนแช่น้ำกะละมังมีดพร้า,1,1445
"98,42542,19356,2321,997441",1,1445
มะกอกควนขนุน,1,1445
เพ็ญน้ำอ้อย18.30ทางลงสุพรรณเกื้อเอียดเพ็ญ,1,1445
กลั่นแกล้งแต่ละวันกรีดปักใจติดยาเสพติดโหดเหี้ยมได้ขนาดเด็กวัยรุ่น,1,1445
ลูกเขยสุพรรณระแวงพ่อตาโหดเหี้ยมฆาตกรรมลูกเขยประหารชีวิต,1,1445
ล่มนิโรธล่มพรรคร่วมรัฐบาลองค์ประชุมระเบียบวาระวิปองค์ประชุม,1,1445
แฟมิลี่ป๊อกภัสสร,1,1445
กิโลเลขเด็ดหลานสาวหลักกิโลเมตร74102,1,1445
SETตลาดหลักทรัพย์วารสาร,1,1445
OutstandingInvestorRelations,1,1445
เอกภาพประกาศใช้ร่างกฎหมายวิสามัญร่างกฎหมายการชี้แจง112องค์ประชุม,1,1445
วิปวิปนอกรอบวิปวิปวิปร่างกฎหมายระเบียบวาระ,1,1445
SustainabilityInvestmentTHIS,1,1445
สินทรัพย์บล็อกเชน,1,1445
เหงาหวงหวง,1,1445
พลีสมุทรเจดีย์,1,1445
ทิศตะวันตกเเนวโน้ม,1,1445
ผู้รับผิดชอบโดยถูกกฎหมายโดยถูกกฎหมายบานปลายองอาจ,1,1445
องค์ประชุมแมสก์หายใจออกคาร์บอนไดออกไซด์แมสก์เครื่องกรองอากาศแต่ละวันถี่,1,1445
ผู้รับผิดชอบโดยถูกกฎหมายโดยถูกกฎหมายบานปลาย,1,1445
พลัดตกกันสาดอาการสาหัส119บ้านสวนคุณธรรมเพ็ชรชมพู,1,1445
ไกด์ประชดมดละแวกพระรามคลาดพ่อตาไกด์,1,1445
ศรัณย์เลี่ยมสถาบันวิจัยความเสมอภาคประเมินผลFormativeAssessmentฐานความรู้,1,1445
Gapห้องเรียนความเสมอภาคอนุกรรมการLearningLossถดถอยLearning,1,1445
ถดถอยเปิดเทอมความเสมอภาค(กสมหาวิทยาลัยขอนแก่นมหาวิทยาลัยสงขลานครินทร์สตาร์ฟิช,1,1445
นายกองค์การบริหารส่วนตำบลที่ว่าการอำเภอเขตเลือกตั้งที่แจ้งเจ้าบ้านSmartVoteโฟน,1,1445
"ฤดูแล้งเดโชพลอนุกรรมการแนวโน้มน้ำท่า2,036(ลกรมชล",1,1445
ดารณีhomeisolation,1,1445
เจ็บช้ำน้ำใจจริงใจลวนลามจับมือถือแขนมาเหนือเมฆ,1,1445
ประโคนประโคนชนกนัดดาตุ้ม,1,1445
บุตรหลานความสะอาดวัดอุณหภูมิชั้นเรียนสรวง,1,1445
"นรคืนเงิน2,800,0007,500,000เจ็บช้ำน้ำใจจริงใจลวนลามจับมือถือแขน",1,1445
ศอตช.กอ.รมน.สำนักงานคณะกรรมการป้องกันและปราบปรามการทุจริตแห่งชาติป.ป.ช.สำนักงานการตรวจเงินแผ่นดินสตง.ธรรมาภิบาล,1,1445
อนุกรรมการประพฤติมิชอบชี้แนะหน่วยงานรัฐพึงระวังธรรมาภิบาลรศ.ดร.จุรี,1,1445
เข้าทำงานไข้การตรวจวัดไข้,1,1445
องอาจคล้าแต่ละครั้งสุ่มหยุดยั้งผู้ลักลอบเกรงกลัวตลาดแรงงาน,1,1445
KKPResearchคินการเข้าสู่สูงอายุเผชิญหน้าความไม่แน่นอนภูมิรัฐศาสตร์,1,1445
เมล็ดพันธุ์เมล็ดพันธุ์แปลงนา,1,1445
กราฟิกChontichaPinijrob,1,1445
เชี่ยวตำรวจจราจรสูงอายุ,1,1445
เชี่ยวทางลงกรุงธน,1,1445
แก้มบุ๋มปรียา,1,1445
แขวนคอขื่อผ่อนแรงแขวนส่งเสียงหายใจไม่ออกมานพสุคนธ์,1,1445
นางฟ้าอสูรเปี๊ยกพิศาลเศรณี,1,1445
นางฟ้าอสูรนางฟ้าอสูร,1,1445
นิวส์เศกสิทธิ์โด่งองอาจลำพองโอห์ม,1,1445
ควงควงหาดทรายควงควงยามค่ำคืนครึกครื้นควง,1,1445
YouTubeZENSEEntertainment,1,1445
AppStoreGooglePlayStoreAppGallery,1,1445
เอ๋หยอกเครื่องสำอางตัวใหม่เวย์ใช้แล้วแต่งหน้าถ่ายแบบ,1,1445
จุดประกายแต่งหน้า(พญ.ชญา)รับปริญญางานพเวดดิ้ง,1,1445
ยูฟ่าณัฏตุ่นพีทวสุมีนณัฐกฤตปิง,1,1445
"80,499,612278,05976,492193,2578,310",1,1445
"สัญญาซื้อขายTFEXการซื้อขาย573,67615.5เดือนก่อนการซื้อขาย552,436",1,1445
เสนอขายIPOตลาดหลักทรัพย์,1,1445
ส.ป.ก.รองเลขาธิการส.ป.ก.ผู้พัฒนาส.ป.ก.ส่วนภูมิภาคผู้ปฏิบัติงานวิทยากร,1,1445
"40,000บราซิล479",1,1445
ปิยะสุทธกู้เงิน,1,1445
สถาพรวิลัยแพรรัชนีศิระเอาฤกษ์เอาชัยบวงสรวงพิฆเนศ,1,1445
ศาลแขวงผ่านหน้าผ่านหน้าตำหนักน้ำอ้อมน้ำทะเลวงเดือนพันธุ,1,1445
MARRYMEท้องฟ้าภัณฑินิ้วนาง,1,1445
"KBANKการซื้อขาย3,846.04149.002.00GUNKULการซื้อขาย3,591.82",1,1445
วิโรจน์โภบล.ฟินันเซียรัสอ่อนตัวแรงกดดันDELTA,1,1445
กรมคุมประพฤติสุธีกรมราชทัณฑ์การเดินเรือผู้ต้องขังการเดินเรือตำแหน่งงานผู้ต้องขัง,1,1445
เมล็ดพันธุ์เมล็ดพันธุ์เมล็ดพันธุ์คุณภาพดี,1,1445
ปากคำมดพม.)​รันทำทีแขวนคอตื่นตระหนก,1,1445
มดปากคำมด,1,1445
190วันทนาสังข์คานแตกร้าว,1,1445
การประปานครหลวงกปน.ประตูน้ำเส้นผ่านศูนย์กลางมิลลิเมตรกาญจนาภิเษก05.00,1,1445
พชรอนันตกรมศุลกากร,1,1445
กรมการแพทย์MerckCo์ค)กรมการแพทย์MerckCo์ค),1,1445
อุทกศาสตร์น้ำทะเลกรุงธน,1,1445
อุทกศาสตร์น้ำทะเล1.30,1,1445
แพกซ์วิดยับยั้งพันธุกรรมแพกซ์วิดยับยั้งเอนไซม์,1,1445
ดูถูกด้อยค่าไหน ๆหรือว่าเชื้อชาติความเสมอภาคเท่าเทียมกันด้อยค่า,1,1445
(กสวสันต์หลีกลี้(กสการแสดงความคิดเห็นคลับเฮ้าส์เหยียด,1,1445
เหิม750แต่ละวันหุงข้าวคคเข้าเวรหม้อ,1,1445
สมาชิกวุฒิสภาแตกกันเปลี่ยนตัววิปมั้งก็ดีเป็นปึกแผ่นเป็นเนื้อเดียวกัน,1,1445
สำนักงานส่งเสริมเศรษฐกิจดิจิทัลdepaTECHGoodดิฉันเว่ยSeedsFuture,1,1445
208มะกอกควนขนุน,1,1445
พู่กันตัวอักษรภาษาจีนไอซีชั้นเรียนเว่ยนิสิตนักศึกษาIoT,1,1445
จอมเกล้า(มจจอมเกล้า(สจมหาวิทยาลัยขอนแก่นมหาวิทยาลัยรังสิตโดยตลอดอุซเบกิสถาน,1,1445
เว่ยเทคโนSeedsFutureฝึกฝนไอซีนิสิตนักศึกษาภาคปฏิบัติ,1,1445
ประมาณการMolnupiravirFDAประมาณการไทม์แพกซ์วิดPAXLOVID,1,1445
ไทม์การสั่งซื้อMolnupiravirกรมการแพทย์MerckCo์ค)กรมการแพทย์,1,1445
กนง.อัตราดอกเบี้ยกนง.,1,1445
ทัยรัตนากรธนาคารออมสินภาวะเศรษฐกิจแหล่งเงินทุนธนาคารออมสินหอการค้าหอการค้า,1,1445
ทัยรัตนากรธนาคารออมสินสนั่นอังอุบลหอการค้าหอการค้า,1,1445
สมเด็จพระอริยวงศาคตญาณสมเด็จพระสังฆราชสกลมหาสังฆปริณายก,1,1445
เสนาสนะพระภิกษุสามเณร,1,1445
บางแคแขมสายไหมครุ,1,1445
ซีนนิยามมีจริตจารีตประเพณีสัญชาตญาณเซ็กส์ซีนเอาเป็นว่า,1,1445
โลภชั่วซีนซีนตูมตามตูมตามยิ่งกว่าตูมตาม,1,1445
นลินอ่องอำไพ,1,1445
มะลิเกศ132โพนจารุสุริยาเดื่อผู้ต้องสงสัย,1,1445
เปลเพิงครีมกางเกงขาสั้น163กอกกุศล565,1,1445
DualChamberแช่เย็นแช่แข็งKERRYCOOLพัสดุHub-and-Spoke,1,1445
อาคมพิทยาไพสิฐเข้าพบ,1,1445
เฮาส์ให้ร้ายกล่าวโทษอุดมสมบูรณ์มีน้ำใจมีวัฒนธรรมแบ่งแยก,1,1445
เมล็ดพันธุ์คุณภาพดีกรมการเมล็ดพันธุ์,1,1445
เมล็ดพันธุ์เมล็ดพันธุ์เมล็ดพันธุ์,1,1445
เงินบาทเช้านี้แข็งค่า,1,1445
มหกรรมShopee11.11BigSale,1,1445
พระมหากษัตริย์ดำรงอยู่ผู้ใด,1,1445
ผยงวณิชกรุงไทยกรุงไทยปตท.ปิโตรเลียมปตท.สผ.,1,1445
คำพิพากษาศาลฎีกาคดีอาญาผู้ดำรงตำแหน่งทางการเมืองพิพากษาประมวลกฎหมายอาญา157,1,1445
กฎหมายอาญา112116,1,1445
ระบอบพระมหากษัตริย์ประมุข,1,1445
112ศรีสุวรรณจรรยา,1,1445
"(สWebConferenceZOOMระเบียบวาระ30,64528,6411,769",1,1445
ยานอวกาศเสินโจว,1,1445
เร่มลบัวหลวงทางเข้าออกความลำบากที่ดอนธุระฝั่งแม่น้ำ,1,1445
33.18ชัชชาติ16.5914.096.74ก้าวหน้า5.995.91,1,1445
หวุดหวิดทหารเรือวัชนรข.น.ท.หน.เจียม,1,1445
อัมปาลผู้ว่าการการนิคมอุตสาหกรรมแห่งประเทศไทยกนอ.ChiefRepresentativeJapan,1,1445
พินิจบุตรชายแพรวมโนรมแพรวบุตรชาย,1,1445
ขากลับคลาดจีพีเอสนำทาง,1,1445
ยับยั้งซ้ำแล้วซ้ำเล่าเป็นต้นเหตุมิใช่เจ็บป่วยปะทุไม่ช้าก็เร็วสถานที่ทำงาน,1,1445
"แพทยศาสตร์336,7094,526250,592,7735,064,391ตุรกีเยอรมันแต่ละวัน",1,1445
"6113,5341,8151,7071,465,572",1,1445
เทรดดิ้งเก็งกำไรQmomentumLHSPALIBCPBEM,1,1445
ปัจจัยพื้นฐานแข็งแกร่งmomentumdomesticPlaysปัจจัยพื้นฐานBEMBDMS,1,1445
SETธนาคารกลางเงินเฟ้อลองเชิงยาเม็ดSentimentSET1630,1,1445
กลุ่มอาชีพผู้ขับรถแท็กซี่ผู้ประกันตน2533ผู้ขับรถแท็กซี่,1,1445
กลุ่มอาชีพผู้ขับรถแท็กซี่ผู้ประกันตน2533,1,1445
"ผู้ขับรถแท็กซี่10,000ผู้ขับรถแท็กซี่สมุทรสงคราม",1,1445
บรรลุผลสำเร็จดำเนินชีวิต,1,1445
สิตนกุลเริงDITPการผลักดันยางพารายางพาราสินค้าส่งออก,1,1445
ตลาดสดหาบเร่แผงลอยตลาดสดร้านเสริมสวยสปานวดหม่ำ,1,1445
คำพิพากษาบิดเบือนจำนำการแสวงหาประโยชน์มโหฬารปรากฏชัดคำพิพากษาบิดเบือน,1,1445
รัตนะเชวงตรงกันเดินเครื่องเป็นหลักประกันชาวนาขาดหายชาวนา,1,1445
หม้อทอดหม้อทอด,1,1445
ส.ว.เป็นกำลังส.ว.การรัฐประหาร,1,1445
รศ.ดร.ปัทวดี,1,1445
ยางพาราถ้วยมันสำปะหลังปาล์มข้าวโพดเลี้ยงสัตว์กระทรวงเกษตรฯ,1,1445
ความเสียใจรามาโหรดูดวงก็ช่างเยี่ยมเยียนคสช.,1,1445
ปี้มหกรรมShopee11.11BigSale,1,1445
ยุทธ์บำบัดรักษาผู้ติดยาเสพติดชนนี,1,1445
บำบัดรักษาผู้ติดยาเสพติดชนนี(สบยช.),1,1445
ป.ป.ส.ป.ป.ส.ต้นตอซองtiktokเซียลซองซอง,1,1445
นพหอพักอ่อนนุชสิ่งผิดกฎหมายนพคัดลอกโค้ดแอด,1,1445
กรมการเมล็ดพันธุ์เมล็ดพันธุ์,1,1445
เมล็ดพันธุ์มูลค่าเพิ่มเมล็ดพันธุ์,1,1445
twitterซองซองนพหอพักอ่อนนุชสิ่งผิดกฎหมายนพ,1,1445
กีรติกรมการค้าต่างประเทศกุ้งกุ้งกุ้งตกต่ำกุ้งปนเปื้อน,1,1445
"7,4957,5926,881711",1,1445
คลังแสงมหาสารคามวิป112112แปลกที่เรื่องสำคัญอ่อนไหว,1,1445
"09.2928,40028,500ทองรูปพรรณ27,894.4029,000",1,1445
ตกต่ำข้าวเปลือกหอมมะลิข้าวเปลือก,1,1445
ครอบจักรวาลUniversalPrevention,1,1445
ดาวเสาร์ดาวพฤหัสดวงดาวกลับบ้านเก่าถึงคราวตั้งใหม่เสียแล้วกระมัง,1,1445
