LCS,match,total_match
ข้าวเปลือกนาปีมูลค่าเพิ่มดูดซับตกต่ำธ.ก.ส.,2,2274
นิโรธเลขาวิปนิโรธนิโรธรับน้องฝ่ายรัฐบาลสมัยประชุม,2,2274
ตำรวจจราจรรอบด้านตำรวจจราจรเบนซ์ผิดทางการปล่อยปละละเลยกฎหมายอาญาโยกย้าย,2,2274
กระทิงเกริ่นทิงทัชกระทิงกระทิงศาสตร์ดีด,2,2274
"Baiya1,309การอุดมศึกษา(อว.)พระราชกำหนดกู้เงินChulaCov2,316",2,2274
การแถลงนารีไว้ใจไข้น้ำมูก,2,2274
วิรัชวิปวิป,2,2274
ห้องปฏิบัติการคำสร้อยพิทยา,2,2274
งอนฝางเลี่ยมม่อนปิ่นฝางผู้ลักลอบ,2,2274
"ChulaCov2,316Baiya1,309การอุดมศึกษา",2,2274
ยธฤตรวจราชการ,2,2274
ขั้นพื้นฐาน(สพฐ.)สถานศึกษาซักซ้อมผู้เรียนเป็นสำคัญสถานศึกษาสถานศึกษา,2,2274
"ได้ราคาข้าวเปลือกหอมมะลิ10,864.234,135.77ข้าวเปลือกหอมมะลิ10,407.75",2,2274
เปรสชั่นชุกข้าความชื้นโรงสีความชื้นความชื้น,2,2274
"ข้าวเปลือกความชื้นข้าวเปลือกหอมมะลิข้าวเปลือกหอมมะลิ14,000ข้าวเปลือก",2,2274
รอยสักกางเกงในเสียว,2,2274
HondaHR-VeHEV,2,2274
รอยสักป่านอภิญญา,2,2274
ปิดล้อมล่ามนายหน้ารถเครื่องนายหน้าเสียเงินแล้วด้วย,2,2274
ศาลแพ่งหมายบังคับคดีเจ้าพนักงานบังคับคดียึดทรัพย์อำไพอัมพุเป็นที่ตั้ง,2,2274
จงรักวัชรินทร์มหาวิทยาลัยเกษตรศาสตร์,2,2274
"28,25028,350ทองรูปพรรณ27,742.8028,850",2,2274
กลางปีดัดแปลงกลายพันธุ์,2,2274
"09.2928,25028,350",2,2274
พระบรมราชโองการโปรดเกล้าโปรดกระหม่อมสมาชิกวุฒิสภาอินทรพลเรือเอกขานทหารเรือพลอากาศเอก,2,2274
สเปรย์จุดไฟซุ้มประตูพานอนุสาวรีย์ผู้กระทำผิดวางเพลิงเผาทรัพย์(รถ,2,2274
"มีโทษ10,000ผิดที่ยอมความ",2,2274
เสนอขายIPOตลาดหลักทรัพย์,2,2274
กรมธรรม์ประกันชีวิตเบี้ยประกันภัย,2,2274
อ่อนแรงติดขัดอ่อนเพลียประคอง1669ตรวจร่างกายเป็นกรด,2,2274
โปรดเกล้าโปรดกระหม่อมสมาชิกวุฒิสภาที่ว่างพลเรือเอกสมประสงค์นิลทหารเรือพลอากาศเอก,2,2274
พืชผลผักชีผักชีพืชผักสวนครัวประกอบอาหารพืชผัก,2,2274
ดูดีป้ายหาเสียงขะทอดกฐินอาตมาสังข์ฺ,2,2274
ธ.ก.ส.ชาวนาตกต่ำชุกค่าเงินบาทอ่อนตัวข้าวเปลือกเป็นลำดับ,2,2274
ดิเรกปัจจัยหลักพืชผักโมบายพืชผลปัญหาเฉพาะหน้าพืชผล,2,2274
ข้าวเหนียวกข.กข.,2,2274
233(ศปต้นสังกัดกังวาลขออภัยความไม่สะดวก,2,2274
"ประเมินผลBaiyaใบยา1,30910,000เป้าหมายหลักผ่านการทดสอบน่าเชื่อ",2,2274
"แพทยศาสตร์กลั่นกรอง2,316.8ใบยาBaiyaSARS-CoV-VAXใบยา",2,2274
สหเจียรเสี่ยโจ้ฟอกเงินห้วยขวาง2555,2,2274
พรรคร่วมรัฐบาลวิปวิป,2,2274
ล่มนิโรธเลขา,2,2274
คำสร้อยพิทยาสรรค์คำสร้อยเปิดเรียน,2,2274
นาคาศัยรมต.,2,2274
เงินเฟ้อ0.81.2,2,2274
ตลาดนัดกระบือแงศีขร,2,2274
การวินิจฉัยข้อมูลทั่วไปดูแลรักษาRansomwareมัลแวร์ค่าไถ่ไฟล์ค่าไถ่,1,2274
Pfizer13.32ปวดท้องท้องเสียอาเจียน,1,2274
เงินก้อนแบงค์เซ็นสัญญาแบงค์โหโปรเจกต์เปลี่ยนคนคร่าวๆ,1,2274
HITAPhttpucbpnhsoสิทธิประโยชน์ขอบเขตสิทธิประโยชน์สิทธิประโยชน์,1,2274
นิดนึงเจ้าชู้แบงค์เจ้าชู้ครับผมเจ้าชู้ส่งสายตาแบงค์,1,2274
พีเคนอกใจความเจ็บเกร่ขี้เจ้าชู้แบงค์เจ้าชู้,1,2274
เสี่ยโจ้ฟอกเงิน,1,2274
ประจำตำบลพระนอนแรกเริ่มประจำตำบลพระนอนประจำตำบลพระนอนกายภาพบำบัด,1,2274
"เหรียญทองแดง25,000ดอลลาร์สหรัฐ824,000",1,2274
อัลตซาวเฉลย,1,2274
คำสร้อยพิทยาสรรค์กอกคำสร้อยภารโรง,1,2274
ปัสสาวะกลั้นปัสสาวะ,1,2274
กรมราชทัณฑ์ไล่ออกปลดออกผู้คุมตมสินธพกรมราชทัณฑ์อนุกรรมการ,1,2274
195เช้ามืดข้างๆคุณยายตอนเช้าคนแก่กลัวผีแบงค์,1,2274
เบลเกรดเซอร์เบียรองชนะเลิศชก,1,2274
2550เป็นความลับผู้ใดคนไข้บัญญัติคนไข้สิทธิส่วนบุคคลมีโทษ,1,2274
สเปรย์จุดไฟซุ้มประตูพานอนุสาวรีย์ผู้กระทำผิด,1,2274
สมมุติแพทชัวร์แพทคบแพททำคะแนนมั๊ย,1,2274
13.32ปวดท้องท้องเสียอาเจียนเป็นพิษอาเจียน,1,2274
แบงค์ยิงปืนขว้างน้อยหน่าตรงหน้ากระโดนแอคชั่นตามหลัง,1,2274
คงขาดการต่อเนื่องแช่มันสำปะหลังคลุ้มคลั่งโดยไม่รู้ตัวหลอนยาบ้า,1,2274
สท.บานการคุคลั่งเกลี้ยกล่อมหวาดระแวงล้อมปาด,1,2274
สังเวียนษี.จ233(ศปต้นสังกัด,1,2274
ขบวนรถวีไอพีย้อนศร,1,2274
DriverEp134,1,2274
หอพักสนามกีฬาMJUHospitechคณะพยาบาลศาสตร์โจ้จัดแบ่ง,1,2274
โอ๊ตปราโมทย์พิชญ์,1,2274
ศาลฎีกาคดีอาญาผู้ดำรงตำแหน่งทางการเมืองประทับ,1,2274
79.766.895.111.681.43เคหสถาน03.00เคหสถาน,1,2274
แยกจากฆ่าเชื้อโรงอาหารเทิดสนามกีฬาอินทนิลวอลเลย์บอล,1,2274
หอมมะลิทุ่งกุลาชาวนา,1,2274
ปาดแท้ๆสลดหดหู่ใจลงคอตัวประกันณุอุณห,1,2274
สหเจียรเสี่ยโจ้ฟอกเงินห้วยขวาง2555กอ.รมน.,1,2274
"โอภาสการย์ผลการศึกษาประสิทธิผล8,2388,148ช้าๆสถานศึกษา",1,2274
พ.ย.)นิโรธเลขา,1,2274
ตัวการต่อเรือบังหน้าปลอมแปลงประทับ2557,1,2274
วันหยุดราชการปีใหม่สงกรานต์,1,2274
จุฬาฯคิดค้นน้ำยาฆ่าเชื้อสิทธิบัตรระดับชาติ,1,2274
233(ศปต้นสังกัด,1,2274
"ปรับราคารูปพรรณ28,800",1,2274
ภูริสหเจียรเสี่ยโจ้ฟอกเงินห้วยขวาง,1,2274
วีไอพีปัดวันเวย์สนั่นไซเรนวีไอพีย้อนศรรถติด,1,2274
หัวใจวายเฉียบพลันแน่นหน้าอกแน่นหน้าอกเรอเปรี้ยวแสบกรด,1,2274
ห้องเรียนใช้การห้องเรียนชั้นเรียนผู้ใกล้ชิดผู้ใกล้ชิดโดยไม่จำเป็น,1,2274
แบงค์รับเชิญแบงค์หลายเท่าเฉียดล่ามแบงค์แอคชั่น,1,2274
"คิ้ม""ออกหมายเรียกหมายเรียก",1,2274
ปฏิภาณวาทีพิพิธสุทัศนเทพวราราม,1,2274
กรมสารนิเทศmfa2035000antifakenewscenterantifakenewscentertwitterAFNCThailandGCC,1,2274
thailandpassorgกรมสารนิเทศหน่วยงานรัฐPassของจริงCOEtp,1,2274
ขั้นพื้นฐาน(กพฐ.)ขั้นพื้นฐาน,1,2274
ฝ่ายรัฐบาลวิปหนักใจวิรัชวิปวิป,1,2274
ธวัฒโภคทรัพย์ศุกรีหัดเภทสวป.บดี,1,2274
เงินเฟ้อ0.81.2ค่ากลาง1.0การทบทวน,1,2274
พลตำรวจตรีตำรวจจราจรรอบด้านตำรวจจราจรเบนซ์ผิดทางการปล่อยปละละเลยกฎหมายอาญา,1,2274
นิโรธเลขาได้รับแต่งตั้งวิปฝ่ายรัฐบาลวิปหนักใจ,1,2274
เรณูเก้เกลื้อนบุญธรรมนิมนต์การอัญเชิญวิญญาณ,1,2274
ความแตกแยกพระมหากษัตริย์ยึดเหนี่ยว,1,2274
98.5กษัตริย์ส่วนสำคัญ,1,2274
ออกหมายเรียกยอมรับผิดคิ้มไม่เป็นไรสำนึกผิดใจจริงชดใช้ค่าเสียหาย,1,2274
ภู่หัวหน้าศูนย์เฉพาะทางภาควิชากุมารเวชศาสตร์แพทยศาสตร์ภูมิต้านทานภูมิต้านทาน,1,2274
คอมเม้นท์คอมเม้นท์คดีอาญามีโทษรอยัลลิสต์เก็ตเพลส,1,2274
ความสำนึกพระมหากรุณาธิคุณด่าทอเฟอร์คิ้มถ้อยคำหยาบคายดูถูก,1,2274
.จ233(ศปต้นสังกัด,1,2274
คำร้องขอผู้ส่งในกรณีนี้ขายทอดตลาดคำร้องขอกรรมสิทธิ์,1,2274
YoungRisingStarCEO,1,2274
เว่ยป๋อจางเกาล่วงละเมิด,1,2274
"""เผิงฉ่วย""นักเทนนิส",1,2274
นิโรธติดตลกมั้งวิปล่มนิโรธสมัยประชุมพรรคร่วมรัฐบาล,1,2274
วิปเตรียมงานวิปแข็งแกร่งวิปพรรคร่วมรัฐบาลน่าชื่นชมวิป,1,2274
สุเทพกิตติมศักดิ์ชาวนา,1,2274
เครื่องฟอกอากาศAC1215,1,2274
อกหักมีสติแพลนกีตาร์คลาสสิคชะงักCoverเสื้อยืด,1,2274
พระราชสาส์นตราตั้งอักษรสาส์นตราตั้ง,1,2274
ณัฎฐปัญญ์วิริยะอินเตอร์เนชั่นแนลคอร์ปอเรชั่นKTISKTISเอทานอลทิส,1,2274
อินเตอร์แบงค์โปรเจกต์ไทยใหญ่เชื้อสายคนจีนประหารชีวิตหาไม่,1,2274
ศักย์กรมการค้าภายในเปรสชั่นชุกข้าความชื้นโรงสี,1,2274
หลงรักรอยสักป่านอภิญญา,1,2274
"ไอโฟน1,699พาวเวอร์แบงค์",1,2274
พาวเวอร์แบงค์กระชาก,1,2274
ไอโฟนพาวเวอร์แบงค์,1,2274
เปลือยรีสอร์ตชายหนุ่มทอมพ.ย.)มุขบริบูรณ์รีสอร์ต,1,2274
"19,5428,2381,807,304",1,2274
"มัธยมสมัครใจ34,2873,17327,039เปลี่ยนใจ",1,2274
ปุ้มปุ้ยทิพา,1,2274
เจ้าท่าเจ้าท่ากองทัพเรือเรือตรวจการณ์การลากเรือบรรทุกสินค้าพระประแดงลากจูง,1,2274
ผิวน้ำนักประดาน้ำรอยแตกกาบเครื่องสูบน้ำขนานใหญ่ใช้เรือเครน,1,2274
เรือบรรทุกสินค้าเทรนเนอร์กลกาบศาลากลางเครนขนถ่ายเทรนเนอร์,1,2274
โอภาสการย์ระบาดวิทยา,1,2274
เพียรปัญจสถิตย์ปากคำรัมย์ต่อหน้าอัมพรก้ม,1,2274
เผยแผ่นิกายเถรวาทกระทบกระเทียบพระเถระชั้นผู้ใหญ่ลงท้ายการฟาดฟัน,1,2274
รัมย์บานทางจิตยาบ้าเหล้าขาวหลอนคลุ้มคลั่งอาละวาด,1,2274
เยาว์วัยยาบ้าดื่มเหล้ามันสำปะหลังหลอนขาดสติน่าสงสารสาหตุ,1,2274
ก้มอโหสิกรรมสิทธิประโยชน์ณุอุณหปากคำชดใช้กรรม,1,2274
ปู่ย่าแท้ๆข่มขืนปวีณาหงอดิข่มขืนตรวจร่างกาย,1,2274
แท้ๆอดิป่าละเมาะยาบ้าเม็ดลวนลามให้เงินสบโอกาส,1,2274
เขาสกประภาเชี่ยว,1,2274
ท้องถนนไฟป่าPMบพิธชานุผู้บริหารระดับสูงคุ้มค่าผลสำเร็จ,1,2274
การหุงต้มชาวนาผู้ประกอบการค้า,1,2274
ประกันภัยPrimeMinisterInsuranceประกันภัยคปภ.อาคมพิทยา,1,2274
Feed-inTariffFiTFiTVSPPกำลังผลิตเมกะวัตต์,1,2274
เชี่ยลจีวรห่อหุ้มเข้าฉากพยนต์ยนต์โก๊ะตี๋,1,2274
สึกสบู่ยาสีฟันหนังตลกรวยทำใจวันใดไตรจีวร,1,2274
โบกี้อ้อนจิ๋วยัวร์บอยบุรินทร์วิสุทธ์Maiyarap,1,2274
"CDCUคำสร้อย1,106ห้องปฏิบัติการฆ่าเชื้อคำสร้อยพิทยาสรรค์",1,2274
นร.รร.คำสร้อยพิทยาสรรค์site,1,2274
พุทธะ112116ปลุกระดมมวลชนล้มล้างพุทธะผู้คัดค้าน,1,2274
อ่อนแรงติดขัดอ่อนเพลียประคอง1669ตรวจร่างกายเป็นกรดICU,1,2274
เม่นด.ญ.มิ้น(ด.ญ.มิ้น(,1,2274
พ.ย.)โอภาสการย์,1,2274
ตำรวจจราจรนำหน้าสังเวียนษี.จ,1,2274
2555กอ.รมน.สหเสี่ยโจ้2000การซื้อขายส่วย,1,2274
ป้ายหาเสียงพรุฏีกาอาภาระย้าพรุพระพรหมระย้า,1,2274
อดิป่าดงพญาเขาใหญ่พลัดทอดทิ้งเขาใหญ่อนุบาล,1,2274
อดิวงศายุตเขาใหญ่เขาใหญ่จงรักวัชรินทร์มหาวิทยาลัยเกษตรศาสตร์,1,2274
เขาใหญ่พลัดอ้อมกอดเขาใหญ่ทอดทิ้งกำพร้าอนุบาลเขาใหญ่,1,2274
ลาดตระเวนกองร้อยทหารพราน1305โพธิสัตย์วัดอุณหภูมิอยู่ในเกณฑ์,1,2274
คำสร้อยพิทยาสรรค์พ.ย.),1,2274
โทษหนักจํานงค์คอลเซ็นเตอร์ฟอกเงินจำนงค์”จำนงค์”,1,2274
"คำสร้อยคำสร้อยพิทยาคำสร้อย1,202",1,2274
นิโรธวิปวิรัช,1,2274
แต้คำสร้อยเณย์คำสร้อยพิทยาสรรค์,1,2274
"เอสเอ็มอีความแข็งแรง394,621ผู้ประกันตน4,034,59036,311,310,000201,7301,210,380,000",1,2274
เบนซ์การกล่าวอ้างวีไอพีอุทัยธาราการจราจรติดขัดน.พ.วนา,1,2274
คนซื้อปิดล้อมล่ามนายหน้ารถเครื่องนายหน้าเสียเงินแล้วด้วย,1,2274
เรียนหนังสือการเตรียมพร้อมเปิดเรียน,1,2274
แต้คำสร้อยการแถลงนารีไว้ใจไข้น้ำมูก,1,2274
คำสร้อยพิทยาคำสร้อย,1,2274
"คำสร้อยพิทยาคำสร้อย1,202",1,2274
สมาชิกวุฒิสภารามาธิบดีหาวพระบรมราชโองการโปรดเกล้าโปรดกระหม่อมพระบรมราชโองการโปรดเกล้าโปรดกระหม่อมสมาชิกวุฒิสภา,1,2274
227การพนันคนเข้าเมือง119กระบอกกระสุนปืน322ส่วนควบ,1,2274
"ยาบ้า1,600เม็ดไอซ์1.64กรัมกัญชา616",1,2274
คำสร้อยพิทยาสรรค์คำสร้อยพิทยาสรรค์,1,2274
เรือนแพสะแกกรังวอดเรือดับเพลิงดับไฟไม้เป็น,1,2274
วิปอุ่นใจนิโรธนิติบัญญัติตราบใดที่คอรัปชั่นวิปนิโรธ,1,2274
บิดเบือนผักชีค่ายทหารคำปรารภผักชีผักชีผักชีการตัดตอน,1,2274
ศาสตร์การคำนวณผลรวมผลรวมมีความหมาย,1,2274
พิรุธเปิดไฟขอทางตามหลังบังเอิญเอ๊ะวันเวย์วีไอพี,1,2274
วาร์ปลญาร่างทรงออสการ์,1,2274
โย่งก้อยล้ำค่าอบเชย,1,2274
ไทม์ชาวนาchongkhoinbaac,1,2274
สนามวัดแต้คำสร้อย,1,2274
โอภาสการย์การแถลงข่าวสร้างเสริมคุ้นคัส,1,2274
ตำรวจจราจรขบวนรถVIPจังหน้าสติ๊กเกอร์THONGLORPOLICEรถติด,1,2274
เมอร์เซเดสเบนซ์2541ผ่อนส่งอำไพ,1,2274
กอดเทอมหรอคิดได้,1,2274
ขบวนรถวีไอพีเบนซ์วนาลท์กรุ๊ป,1,2274
CREDITPHOTO]],1,2274
โปรโมทIDOLEXCHANGEIDOLEXCHANGEยัดความไม่สบายใจไหนจะ,1,2274
"28,35028,250ทองรูปพรรณ",1,2274
ผลบุญตอนเที่ยงลืมตาสุพรรณหามไอซียูคับคั่งสาธุ,1,2274
บทบัญญัติข้าราชการการเมืองส.ว.เป็นคุณเป็นโทษเจ้าหน้าที่ของรัฐตำแหน่งหน้าที่กระทำการ,1,2274
อรรจน์อนุพันธ์สืบสายสมัครเล่นรวิชญ์341สมัครเล่น,1,2274
กอล์ฟสมัครเล่นเมเจอร์แชเปียชิพดูไบชต์,1,2274
ปิยสุภา.สปพ.,1,2274
"1,200คำสร้อยพิทยาสรรค์คำสร้อย",1,2274
แล็บห้องปฏิบัติการแต้คำสร้อย,1,2274
โหนกหลบแหล่งน้ำ,1,2274
คชสารชำพลู,1,2274
หมุดสนามหลวงกฤษฎางค์เพิกถอนหมุดวินิจมีเหตุผล,1,2274
กำไลกฤษฎางค์นุตคำร้องขอเสกไม้เท้าเสกคาถา,1,2274
พ.ย.)ตันตระวาณิชย์เหล่าทัพกอ.รมน.ศูนย์อำนวยการรักษาผลประโยชน์(ศรช,1,2274
สุไหงลกสนามกีฬาLSOCCER,1,2274
บ่มป้ายหาเสียงแนะนำตัวสะดุดตาแนะนำตัวชื่อเล่นจิ๋มแนะนำตัว,1,2274
ล่มนิโรธวิป,1,2274
"หม้อชำราบจับกลุ่มเล่นไพ่ตีไก่ดื่มเหล้า20,030",1,2274
กระบือใช้หนี้ทำนาทำนาไหนจะยาฆ่าแมลงพอกับใช้หนี้,1,2274
พรรณไม้ควรค่าดักจับPM,1,2274
ทำนาขาดทุนชาวนา,1,2274
ขายทอดตลาดเพชรเกษมศาลแพ่งหมายบังคับคดีเจ้าพนักงานบังคับคดียึดทรัพย์อำไพอัมพุ,1,2274
ปวดหัวข้างเดียวคลื่นไส้อาเจียน,1,2274
โรคเบาหวานกรดใจเต้นผิดจังหวะ,1,2274
เยี่ยงอย่างทางอาญาจนถึงที่สุด,1,2274
เล่กุนเป๊ปกวา,1,2274
เป๊ปกวาเป๊ป,1,2274
"วิดความลับโมเมนตัมผลการแข่งขันตัวหลักฝึกซ้อมๆ""เหมือนว่า",1,2274
2540ไสวระบุชื่ออำไพอัมพุทำสัญญาเช่าซื้อผ่อนชำระ,1,2274
