LCS,match,total_match
ลอยกระทงลอยกระทงลอยกระทง,82,1695
สหเจียรเสี่ยโจ้,27,1695
ลอยกระทงกระทงลอยกระทง,23,1695
ธัญนิตย์ผู้ว่าการธปท.,18,1695
การถ่ายภาพผู้นำประเทศเอเปคดานังcropบิดเบือนช่างภาพบิดเบือน,15,1695
592ICUเปิดเทอมรถโรงเรียน,15,1695
"6,423319144",13,1695
อั๋นภูวนาท,12,1695
พิศุทธ์เตมียเวสหยุดงานพิศุทธ์หยุดงานพิศุทธ์บรรทัดพาดหัวข่าว,12,1695
ประดิษฐ์74หลักเขต,12,1695
เบาะเข็มขัดนิรภัยเสื้อเชิ้ตวสีอักษรนุ่งกางเกงขายาวมือขวา,11,1695
น้ำมันเชื้อเพลิงดีเซลเสียภาษีพิธีการศุลกากรซ่อนเร้นจำนำน้ำมันเชื้อเพลิง,11,1695
ทิพานันสำนักเลขาธิการนายกรัฐมนตรี,10,1695
เสี่ยโจ้เก๋ง,10,1695
"ผู้ประกันตนsso10,...",9,1695
เผิงฉ่วยนักเทนนิส,9,1695
ลอยกระทงลอยกระทงกระทง,9,1695
ชั่งตวง2542น้ำมันเชื้อเพลิง2543ละเลยกฎกระทรวง2485,9,1695
เสี่ยงภัยมวลอากาศตอนเช้าความชื้นตอนเช้าตอนเช้าตอนเช้าสมุทรสงคราม,9,1695
ขก8730ล้มระเนระนาดฮีโน่1076พังยับเยินผู้ขับขี่เบาะ,8,1695
ที่บังคับประกันภัยตลาดหลักทรัพย์ก.ล.ต.ประกันภัยคปภ.ประกันภัยธนาคารพาณิชย์,8,1695
ธัญวัจน์กมล,8,1695
เลิกกันสาวน้อยมหัศจรรย์ตลับขนาดที่เกลียดทุกข์ใจปาด,7,1695
ธปท.ที่บังคับประกันภัยตลาดหลักทรัพย์ก.ล.ต.ประกันภัยคปภ.ประกันภัย,7,1695
พฤติรถโดยสารใบอนุญาตขับรถยนต์ใบอนุญาตขับรถยนต์สามล้อตุ๊กตุ๊ก,7,1695
ด้อยโอกาสสช.กสTeacherSchoolQualityProgramTSQP,7,1695
ลอยกระทงกระทงกระทง,7,1695
เสี่ยโจ้น้ำมันเชื้อเพลิงดีเซลเสียภาษีพิธีการศุลกากรซ่อนเร้น,7,1695
ฦานักโทษผู้ต้องขังนักโทษนักโทษไล่ล่านักโทษนักโทษ,6,1695
UNOceanDecadeKickoffConferenceWesternPacificIts,6,1695
น่าเชื่อถือโบกมือผู้นำประเทศมือดีบิดเบือนการถ่ายภาพผู้นำประเทศเอเปค,6,1695
สถานที่เกิดเหตุธนบัตรธนบัตรธนบัตรสอดคล้องกันPCTผู้ลักลอบธนบัตร,6,1695
ขออนุมัติเงินตรากษาปณ์ธนบัตรออกใช้ให้อำนาจออกใช้ตลอดชีวิต,6,1695
พิศุทธ์หยุดงานพิศุทธ์บรรทัดพาดหัวข่าวรังแต่,6,1695
ธปท.ธรรมาภิบาลเสนอขายประกันภัยธปท.ธปท.marketconduct,6,1695
แมกเลียควอตี้เวล็อปเม้นคอร์ปอเรชั่น,6,1695
ธปท.ที่บังคับประกันภัยธปท.ที่บังคับประกันภัยตลาดหลักทรัพย์ก.ล.ต.,6,1695
เกลาแมร์เคิล,6,1695
ร่ำไห้แค้นใจเยาะเย้ย,6,1695
ทิพานันสำนักเลขาธิการนายกรัฐมนตรีลูกหนี้กู้ยืมกยลูกหนี้ลูกหนี้,6,1695
เสี่ยโจ้ฟอกเงิน,6,1695
เรือประมงรุกล้ำน่านน้ำไทยเหิมเกริม,6,1695
ภาควิชาพาณิชยศาสตร์การบัญชี,6,1695
ครอบจักรวาลUniversalPrevention,6,1695
รถโดยสารใบอนุญาตขับรถยนต์ใบอนุญาตขับรถยนต์สามล้อตุ๊กตุ๊กใบอนุญาตขับรถ,5,1695
ตอนเช้าตอนเช้าสมุทรสงครามเมฆ,5,1695
เสี่ยงภัยมวลอากาศตอนเช้าความชื้น,5,1695
เสี่ยโจ้สห,5,1695
เสี่ยโจ้คำพิพากษา,5,1695
ธปท.marketconductค่าตอบแทนKPIเสนอขายค่าตอบแทนบิดเบือน,5,1695
อาคมพิทยาไพสิฐ,5,1695
บิดเบือนการหลอกเอาเปรียบธปท.ที่บังคับประกันภัยธปท.ที่บังคับ,5,1695
รัชดาภิเษกสหเจียรเสี่ยโจ้,5,1695
473206ออกเสียง,5,1695
ตมวิศาลกรมการขนส่งทางบก,5,1695
กระบวนการยุติธรรมยึดทรัพย์ขายทอดตลาดผู้ค้ำประกันครูผู้สอนรับภาระชำระหนี้ทับถม,5,1695
studentloanกย0164888แบกภาระหนีหายลูกหนี้กย,5,1695
MVTiktokโปรโมต,5,1695
เป็นเจ้าภาพUNOceanDecadeKickoffConferenceWesternPacific,5,1695
โบกมือดูเหมือนว่ามือขึ้นเดิร์นนิวซีแลนด์จัสตินทรูปูติน,5,1695
ข้อห้ามลอยกระทงโทษหนัก,5,1695
แย้งเสี่ยโจ้ฟอกเงินล่องหน,5,1695
กระทรวงยุติธรรมกยไกล่เกลี่ยข้อพิพาทฟ้องคดีปรับโครงสร้างคำร้องขอไกล่เกลี่ย,5,1695
ศธกสด้อยโอกาสด้อยโอกาสเลื่อมล้ำสำเร็จการศึกษาขั้นพื้นฐาน,5,1695
สช.กสสช.วิธีวัดทางอ้อมProxyMeansPMT,4,1695
เหมือนว่าบอกเลิกปล่อยโฮแต่ละครั้งอึดอัดเป้าสายตาไม่เท่าไหร่เลิกกัน,4,1695
ลอยกระทงข้อห้ามลอยกระทง,4,1695
ค่าตอบแทนKPIเสนอขายค่าตอบแทนบิดเบือนการหลอกเอาเปรียบธปท.,4,1695
กรมการขนส่งทางบกdltกรมการขนส่งทางบกPRDLTNewsPRDLT,4,1695
กู้ยืมวัยทำงานเป็นกำลังผ่อนชำระกระบวนการยุติธรรมยึดทรัพย์ขายทอดตลาดผู้ค้ำประกัน,4,1695
สำนักเลขาธิการนายกรัฐมนตรีลูกหนี้กู้ยืมกยลูกหนี้ลูกหนี้ผิดนัดชำระหนี้,4,1695
ไกล่เกลี่ยข้อพิพาทฟ้องคดี,4,1695
ลูกหนี้ผิดนัดชำระหนี้,4,1695
ผ่อนชำระ3.5ผิดนัด2.3ทิพานันลูกหนี้กย,4,1695
ลูกหนี้ลูกหนี้ผิดนัดชำระหนี้ชำระหนี้ลูกหนี้กยการกู้,4,1695
ทวนเจดีย์ทวน,4,1695
นายหน้าค่าตอบแทนตามเงื่อนไขกฎระเบียบดังกล่าวข้างต้นฝืนกฎหมาย,4,1695
ช่างพิมพ์ขออนุมัติแม็คพระรามแม็คผู้ควบคุมธนบัตรเครื่องพิมพ์,4,1695
เสี่ยโจ้เสี่ยโจ้,4,1695
"ดอล1,595,000พัสดุMoganMelissaแอพพลิเคชั่นโขนงคธ",4,1695
เฮียเกรียงคูคตน่าเชื่อแหล่งผลิตธนบัตรขออนุมัติหมายศาล,4,1695
รำคาญดอกไม้เพลิงโคมลอยแอบแฝงประทุษร้าย,4,1695
ความเป็นมนุษย์ศักดิ์ศรีความเป็นมนุษย์,4,1695
"WTA""เผิงฉ่วย""",4,1695
ตัดคะแนนตัดคะแนนรับคืนผ่านการทดสอบวันทำการนับแต่ได้คืนปีปฏิทิน,4,1695
ศักดิ์ศรีความเป็นมนุษย์ศักดิ์ศรีความเป็นมนุษย์,4,1695
ฦานักโทษผู้ต้องขังนักโทษนักโทษไล่ล่านักโทษ,4,1695
คู่ชีวิตวิปวิปทักท้วงส่งกลับ,4,1695
"301,736462,42955,154",4,1695
ริเวอร์โกดัง9.00เลิดแฟชั่นไอส์แลนด์,4,1695
เลิกกันเถียงอยู่ดีๆหย่าอัลบั้มทั้งเมืองอัลบั้มถล่มทลาย,4,1695
ณัฐพลผาดทวน,4,1695
ทินกรณัฏฐมั่งคั่งสารนิเทศ,4,1695
vaccinetrueidnet,4,1695
ทรูวิชั่นส์ทรู,4,1695
จตุพรบุรุษปลัดกระทรวงชายฝั่งทศวรรษDecadeCoordinationOffice,3,1695
ความดันโลหิตBetablockersวิตามินแข็งตัววิตามินสังกะสีไบโอติน,3,1695
ทอดกฐินยอดเงินกฐิน,3,1695
รจิตรายบุคคลPassใบรับรองผู้รับผิดชอบจุฬาภรณ์ApplicationOA,3,1695
ตระการตาลอยกระทงเปิดไฟ,3,1695
อรรฆกรมการแพทย์ผลัดผลัดผลัดผลัดขาดสารอาหารไทรอยด์,3,1695
ฮันผู้ประกาศข่าวสถานีโทรทัศน์ทีวีสีรับหน้าที่ผู้ดำเนินรายการoceandecadeiocwestpac,3,1695
วิตามินสังกะสีไบโอตินวิตามินมีส่วนช่วยผลัดวิตามินเฉพาะทาง,3,1695
มิ่งขวัญษฐโรคผิวหนังกรมการแพทย์เจ็บป่วยผลัดผลัดพราง,3,1695
วิปคู่ชีวิตประมวลกฎหมายแพ่งและพาณิชย์สมรสต่างหากประมวลกฎหมายแพ่งและพาณิชย์สมรสกฤษฎีกา,3,1695
OAบัตรประจำตัวประชาชนMOPHICแสดงผลcallcenterMOPH,3,1695
พฤติการณ์ลักษณะดังกล่าวข้างต้นนายหน้าค่าตอบแทนตามเงื่อนไขกฎระเบียบดังกล่าวข้างต้น,3,1695
นิทรรศการ(สสปน.,3,1695
ตัวอาคารพนมเปญดส.พลตำรวจเอกข้ามแดนรถตู้ทึบพนมเปญ,3,1695
หยุดงานปรามสหพันธ์ลดราคา,3,1695
เงินสนับสนุนอนุบาลปริญญาตรี,3,1695
ดิเรกอร่ามมหาสารคามนพนรมหาสารคามบดินทร์ต้นสน,3,1695
16.17.18.,3,1695
เจ้าภาพเฉพาะหน้างานวิชาการการปฏิรูปสุภจำปากสกำเนิด,3,1695
ค่าไฟฟ้าLotus-ElevenCenPayTopsSupermarketFamilyMart,3,1695
"ทบ.เด้ง3,700ขนส่งสินค้า",3,1695
ศาลปกครองกรมธนารักษ์การลงนามเมื่อใด,3,1695
ลำคอของมีคมบาด,3,1695
ผัดผ่อนชำระค่าไฟฟ้าการไฟฟ้านครหลวงเวลาทำการค่าไฟฟ้าประกอบการผ่อนชำระ,3,1695
"ใจจริง135,247รื้อระบอบการชี้แจงโน้มน้าวสมาชิกรัฐสภาประชามติ",3,1695
ChristopherRohdeทูตUSecretService,3,1695
ปากคำการตายฟกช้ำ,3,1695
ผัดผ่อนชำระค่าไฟฟ้าตามเงื่อนไขการไฟฟ้านครหลวงผัดผ่อนชำระeservice,3,1695
ธัญนิตย์ผู้ว่าการ,3,1695
เผิงฉ่วยคนเขียน,3,1695
"ธนบัตร36,000ช่างพิมพ์ขออนุมัติแม็คพระรามแม็คผู้ควบคุม",3,1695
ข.ช.ข.ช.ลัทธพลข.ช.ณัฐกู้ยืมข.ช.วเม่นฉ่ำเจ้าพนักงาน,3,1695
หอการค้าAmericanChamberCommerceAMCHAMคารวะทางไกลหอการค้า,3,1695
หอการค้าAmericanChamberCommerceAMCHAMคารวะทางไกล,3,1695
แพนกาลอชีวเภสัชภัณฑ์BiopharmaceuticalsAZD7442,3,1695
แสดงบทบาทเด่นชัดเป็นเจ้าภาพUNOceanDecadeKickoffConference,3,1695
"สำนักงบประมาณสารสนเทศรายบุคคลสถานศึกษาขั้นพื้นฐานสถานศึกษาสช.3,902",3,1695
ธนาคารอาคารสงเคราะห์ธอส.มีวินัยการผ่อนธอส.ปีใหม่ธอส.พันธกิจ,3,1695
"เจ้าภาพกฐินกฐินรวมทั้งหมด231,702พระนอน",3,1695
นั่นแหละขี้เล่นตรงๆ,3,1695
แนวโน้มเคมีเข้ากัน,3,1695
00.30ผกากมลทางพิเศษมหานครขาเข้านิติเวชถ่าง,3,1695
ตอนเย็นออกงานตอนเย็น,3,1695
EnvironmentalSocialGovernance,3,1695
การกรอกอ่อนไหวปีเกิดน่าเชื่อถือหวังดีโดยมิชอบกระทำผิดกฎหมายกรอก,3,1695
ลอยกระทงงานเทศกาลลอยกระทง,3,1695
MoganMelissaเคารพนับถือรับโทรศัพท์PremiumCargoพัสดุพัสดุ,3,1695
ลอยกระทงโอ่งพระราม,3,1695
ตมวิศาลกรมการขนส่งทางบกคมนาคมกรมการขนส่งทางบกใบอนุญาตขับรถเกิดผลกรมการขนส่งทางบก,3,1695
ริเวอร์โกดังแฟชั่นไอส์แลนด์FashionHallทรูUSSD707,3,1695
กรรณิการ์สิงหะ,3,1695
เหน็บใจแคบพิศุทธ์เตมียเวสหยุดงานพิศุทธ์หยุดงานพิศุทธ์,3,1695
"90,6721,742406",3,1695
"ษฐ์สินธุ135,247",3,1695
CREDITPHOTO]],3,1695
CREDITPHOTO],3,1695
"กฎระเบียบในขั้นต้นกองทัพบก3,700ยานยนต์พลขับกองทัพบกขนส่งสินค้า",3,1695
กองทัพบกจิตต์ผู้บัญชาการทหารบกทหารบกทหารบกยานยนต์ทางทหารขนส่งสินค้า,3,1695
เดินรถขนส่งสินค้าเดินรถเหล่าทัพกองทัพบกจิตต์ผู้บัญชาการทหารบกทหารบก,3,1695
ปิดประชุมเครื่องสำอางเห็นใจฟอกเงินองค์ประชุมกรรมาธิการเครื่องสำอางองค์ประชุม,3,1695
พล.ร.ท.มนธาตุผลินเจ้ากรมพลเรือนทหารเรือกองทัพเรือ,3,1695
เอาจริงผักชีค่ายทหารค่าครองชีพ,3,1695
ษฐ์มาลัยแมกเลียควอตี้เวล็อปเม้น,3,1695
ไล่ล่านักโทษน่าสงสัยผู้ต้องขัง,3,1695
โรงไฟฟ้าพลังงานแสงอาทิตย์เอากำไรเงินลงทุนการซื้อขาย,3,1695
นักโทษน่าสงสัยผู้ต้องขังแหกโพธ,3,1695
ผู้ประกันตนผู้ประกันตนผู้ประกันตน,3,1695
วุฒิสภาจรุงจรุงส.ว.การดำรงตำแหน่งนับแต่ครบวาระสัญญาจ้าง,3,1695
UnitedStatesSecretServiceปลอมแปลงธนบัตรการโกงไซเบอร์,3,1695
รู้ทางสะกดภาษาพูดภาษาท่าทางverbalnonverbalภาษาท่าทางการฟังเสียง,3,1695
โรงเรียนเอกชนด้อยโอกาสนิมิตหมายงกเข้าเป้าสถานศึกษากสผู้ด้อยโอกาส,3,1695
กฤศเมธโห,3,1695
UNOceanDecadeKickoffConferenceWesternPacific,3,1695
"โมโนเรลMonorailข้อสรุปโมโนเรล16.327,5008,000เดินรถ",3,1695
ไกล่เกลี่ยข้อพิพาทstudentloan,3,1695
มหกรรมไกล่เกลี่ยข้อพิพาท,3,1695
พ.ย.)ลอยกระทงลอยกระทง,3,1695
ลอยกระทงวันเพ็ญสิบสอง,3,1695
ข.ช.วเม่นฉ่ำเจ้าพนักงานข.ช.คมกริชโมกข์ข.ช.,3,1695
อาชาแสดงบทบาทเด่นชัดเป็นเจ้าภาพUNOceanDecadeKickoff,3,1695
ตมธำรงช.ภ.,3,1695
โคมลอยดอกไม้เพลิงลอยกระทง,3,1695
กระทงกระทงกระทง,3,1695
ภู่หัวหน้าศูนย์เฉพาะทางภาควิชากุมารเวชศาสตร์แพทยศาสตร์YongPoovorawan,3,1695
ธนาคารพาณิชย์ประกันภัยธปท.ธปท.ธรรมาภิบาลเสนอขายประกันภัยธปท.,3,1695
ษฐ์สินธุRe-Solution,3,1695
ข.ช.พุทธรักษาข.ช.มะลิข.ช.ธาดาข.ช.,3,1695
ตอนเช้าเสี่ยงภัยมวลอากาศ,3,1695
ปรับโครงสร้างApplicationGHBALLผ่อนชำระApplicationGHBALL,3,1695
เพิกถอนกรมการขนส่งทางบกเพิกถอนใบอนุญาตขับรถพฤติรถโดยสารใบอนุญาตขับรถยนต์,2,1695
ทินกรณัฏฐมั่งคั่ง,2,1695
appdtacvaccineindexhtml,2,1695
AstraZenecaPfizerSinovacSinopharmริเวอร์โกดังแฟชั่นไอส์แลนด์Fashion,2,1695
เป็นรองรวิชญ์สนธิสัญญาการต่างประเทศวัทนารีชายา,2,1695
NFTสินทรัพย์เฉพาะตัวงานศิลปะ,2,1695
สถานีรถไฟลำโพงลำโพง,2,1695
กระทงลอยกระทงลอยกระทง,2,1695
ไต่สวนเพิกถอนคำสั่งคดีดำ287,2,1695
"1,933,19990,6721,742406",2,1695
วดีออม562เอกสารสิทธิบิดเบือนปั๊มปตท.กูด,2,1695
ออกอุบายโรงไฟฟ้าพลังงานแสงอาทิตย์เอากำไรเงินลงทุนการซื้อขายบ่ายเบี่ยงพลังงานแสงอาทิตย์,2,1695
นายหน้าแอพค่าตอบแทนนายหน้าพฤติการณ์ลักษณะดังกล่าวข้างต้นนายหน้า,2,1695
เสกสกลอัต,2,1695
กรุงไทยเอสเอ็มอีอัตราดอกเบี้ยสภาพคล่องอัตราดอกเบี้ยผ่อนชำระกรุงไทยเงินหมุนเวียน,2,1695
ESGEnvironmentalSocialGovernance,2,1695
กรอกกระทงการกรอกอ่อนไหวปีเกิดน่าเชื่อถือหวังดีโดยมิชอบ,2,1695
แอพพลิเคชั่นMoganMelissaเคารพนับถือแอพพลิเคชั่นเรื่อยMoganMelissa,2,1695
LINEOfficialAccount,2,1695
ตักบาตรตระพังลอยกระทงตักบาตรอาหารแห้งพระภิกษุสงฆ์รุ่งอรุณบวงสรวง,2,1695
เปือยฉินารายณ์ใบอนุญาตขับขี่ความยินยอมสารเสพติดปัสสาวะสิ่งผิดกฎหมาย,2,1695
ษฐ์สินธุโซลูชั่น,2,1695
พุทธศักราชเว้นแต่เท่าที่จำเป็นกติกาICCPRแทรกแซงโดยพลการชอบด้วยกฎหมาย,2,1695
เท่าที่จำเป็นใบอนุญาตขับขี่ใบอนุญาตขับขี่ใบอนุญาตขับขี่ใบอนุญาตขับขี่การบันทึกภาพใบอนุญาตขับขี่ล่วงล้ำ,2,1695
"ผู้ลักลอบธนบัตรUSDธนบัตร36,000ช่างพิมพ์ขออนุมัติแม็ค",2,1695
2555ธนบัตรโดยส่วนใหญ่ธนบัตร20062006ธนบัตรส่วนน้อย,2,1695
USecretServiceฑูตสถานที่เกิดเหตุธนบัตรธนบัตรธนบัตร,2,1695
ระบายอากาศการเยี่ยมของฝากฝากเงินธนาณัติทําทําจําทํา,2,1695
พสุกระทรวงยุติธรรมNหยวนสตีลอิสเฉินหลิน,2,1695
เคหสถานทำอันตรายกีดกั้นผู้คุ้มครอง,2,1695
อาหารสัตว์ข้าวโพดเลี้ยงสัตว์,2,1695
ภญ.สุธีเตชคุณวุฒิ,2,1695
หมดเปลือกเปิดหัวใจเลิกกันสาวน้อยมหัศจรรย์ตลับขนาดที่เกลียด,2,1695
จำนงช.สตม.เขมหัสการต่างประเทศ,2,1695
ศาลแขวงพระนครเหนือศาลแขวงพระนครเหนือโจทก์ยื่นฟ้องลาดพร้าว,2,1695
