LCS,match,total_match
เสกสกลอัตแรมโบ้แอมเนสตี้,1,1271
ปีใหม่ขบวนรถรถปรับอากาศขบวนรถค่าโดยสาร,1,1271
"5,12,19,9,16,23,",1,1271
เกลาแมร์เคิล,1,1271
น้ำหลากปากอ่าว0.5,1,1271
ผู้เข้าประกวดนางงามลุมพินีช่างภาพ,1,1271
PattayaMusicFestivalละมุง,1,1271
สื่อสารมวลชนกรรมาธิการรศ.ดร.ปิยรศ.ดร.ก้องกีรติรศ.ดร.,1,1271
SpywareสอดแนมNSO,1,1271
ติดหนี้พนันใช้หนี้,1,1271
ชุลมุนสร้อยคอทองคำรูปพรรณ,1,1271
NSOGroupอิสราเอลสอดแนม,1,1271
ควนควนร่อนพิบูลควนร่อนพิบูล,1,1271
แอมเนสตี้อินเตอร์เนชั่นแนลคนธรรมดาความเปลี่ยนแปลงผลกำไรเอ็นจีโอทศวรรษ,1,1271
ลงชื่อกระดาษเสกสกลอัต,1,1271
"2,490ReplicaVersion",1,1271
AmnestyInternationalแอมเนสตี้,1,1271
แทรกแซงจงใจคำตัดสินคำวินิจฉัยศาลรัฐธรรมนูญผูกพัน,1,1271
แอมเนสตี้อินเตอร์เนชั่นแนลแอมเนสตี้อินเตอร์เนชั่นแนล,1,1271
เซ่YGEntertainment,1,1271
อยู่ในเกณฑ์BLACKPINKให้ความร่วมมือระบาดวิทยา,1,1271
Drama-addictแล็บแพนด้า,1,1271
CentralWorldเซ็นทรัลเวิลด์Grooveการคุมขั้นสูงสุดGrooveGrooveออฟฟิศ,1,1271
COVIDFreeตรวจตราพ่อครัวSHASHAเปิดกิจการ,1,1271
อดิวงศายุตเขาใหญ่เขาใหญ่จอมเกล้าพระนครเหนือ,1,1271
"ยาบ้า2,021เม็ดล่อ19,000",1,1271
ครงช่องแคบสุสาน,1,1271
ไหม้โกดังรถดับเพลิงสุรศักดิ์โกดังเพลิงไหม้ไหม้โกดัง,1,1271
--------------------------รอบรู้ทันโลกThaiPBSSciAndTech,1,1271
ชนาธิปสรงธ์,1,1271
เรียกตัวสุริยามุ้ย,1,1271
หอพักกระดาษฮ่า,1,1271
ปรับอากาศราชินีเข้านอนราชินีเหลวมีไข้เหลวเนล,1,1271
การตอกย้ำความผูกพันค่านิยมมหานคร,1,1271
พาสปอร์ต101เดินทางออก,1,1271
นิด้าช่างภาพMUT,1,1271
ฉวยโอกาสปุ้ยวงจร,1,1271
"ปุ้ยปิณ์""",1,1271
ปุ้ยTPNปุ้ย,1,1271
ปุ้ยTPNโปรโมทชิลีเหยียบธงชาติไทยชิลี,1,1271
ชานเที่ยวงานมิวสิคเฟสติวัลงานเทศกาลPattayaMusicFestival,1,1271
มึนสกูตเตอร์ถนนใหญ่แช่อาบน้ำมือใหม่,1,1271
แอลเบเนียแองโกลาแอนติกาบาร์บูดาอาร์เจนตินาอาร์เมเนียออสเตรียบาฮามาส,1,1271
แหลมฉบังท่าเทียบเรือหลักสำคัญอีซีขนส่งสินค้าค่าขนส่งแหลมฉบังเรือโท,1,1271
GPCร่วมทุนกัลฟ์เวลลอปGULFถือหุ้นแทงค์,1,1271
ติดหนี้การพนันเด็กเสิร์ฟ,1,1271
มอเตอร์เอ็กซ์โปLINEOfficialFordbitlyHBxHCe,1,1271
"MotorExpoซื้อหน้าALLNEWMG559,000Hyundai",1,1271
มหกรรมยานยนต์MotorExpoมอเตอร์เอ็กซ์โปอิมแพ็คชาเลนเจอร์,1,1271
MITSUBISHIMIRAGE1.2GLXMT,1,1271
กวางกวางกวางกวางกวางกวางไม่เป็นไรกวาง,1,1271
ไม่เลยแก้ผ้าสู้ตายกวางโลเคชั่นเฟลฝรั่งกวาง,1,1271
หวานใจกวางปิดบังกวางกวางคบกวางกวาง,1,1271
มิลค์HarveyMilkเกย์,1,1271
พิธิวัตต์ขจิต,1,1271
ซูซูกิโพลกิ้ง,1,1271
ธานกองหลังรุ่งเดนมาร์กนักฟุตบอล,1,1271
"วิวาห์คิมเป็นรูปเป็นร่างงั้นให้จังหวะ)""แพลน",1,1271
ต๊ะไต๋โดดโลมาอวน,1,1271
"2,088,32720,5817,218",1,1271
คุณนายสหพันธ์กบง.กบง.น้ำมันดีเซลหมุนเร็วสัดส่วนผสมไบโอดีเซล,1,1271
โพลของจริงก้าวไกลก้าวไกลความเห็นอกเห็นใจขาประจำโพลโพล,1,1271
เกาหลีเหนือประหารชีวิตยิงเป้า,1,1271
มีผลบังคับใช้บัตรเลือกตั้งปาร์ตี้ลิสต์พิมพ์เขียวกรรรอยัลริเวอร์กรุงธน,1,1271
ศฝสะเดาว่านแอบหนีการแอบติดต่อสื่อสารบุคคลภายนอกเห็นควร,1,1271
สำนักงานคดีอาญาโจทก์ยื่นฟ้อง,1,1271
ปล่อยชั่วคราวปล่อยชั่วคราวจำเลยจำเลยความเสื่อมเสียพระมหากษัตริย์เดินทางออกนอกราชอาณาจักร,1,1271
ตมธำรงช.ภ.ศฝ0022.2929รายงานสรุปศฝ,1,1271
4259สลิงผิวจราจร,1,1271
ฝายมอดธุลีฝายทะลายที่ราบริมทะเลสถานที่ราชการ,1,1271
บุฟเฟ่ต์เหมาล้างจาน,1,1271
ภาชนะหัวใจสำคัญบุฟเฟต์ภาชนะการมองหาล้างจาน,1,1271
อัจฉริยภาพบำเพ็ญพระราชกรณียกิจการทหารการต่างประเทศวรรณกรรมอักษรศาสตร์พระราชนิพนธ์,1,1271
สวาแอฟริกาใต้ฮ่องกงการกลายพันธุ์ร์ทตามเรื่องตื่นตระหนกการกลายพันธุ์,1,1271
"สติร์,ลูกเกดเมทินี",1,1271
เศรษฐกิจพอเพียงทฤษฎีใหม่ประยุกต์,1,1271
AmazingSafetyAdministrationSHA,1,1271
พระธรรมเทศนากัณฑ์เครื่องบูชามุกคาถาคาถาประเคนจตุปัจจัย,1,1271
ฝ่ายรัฐบาลญัตติในทำนองเดียวกันตรงกันบ่อนกาสิโนถูกกฎหมายเมืองท่องเที่ยว,1,1271
ลูกเธอเจ้าฟ้าพัชรนทิเทพยวดีกรมหลวงณี,1,1271
ปลาโลมายกขึ้นปลาโลมาฝูงโป๊ะติดแห้งภาสชายฝั่ง,1,1271
VirtualRealityVR,1,1271
PMOCเจิ้งเฟยMrRenZhengfeiผู้ก่อตั้งเว่ยเทคโน,1,1271
สิระจาคะษาอมราก่อนเวลา,1,1271
น้อมรำลึกถึงพระมหากรุณาธิคุณพระบาทสมเด็จพระมงกุฎเกล้าเจ้าอยู่หัว,1,1271
"15.02,759กำไรสุทธิ2,804115.9",1,1271
อนุสัญญาสหประชาชาติCOP,1,1271
ก๊าซคาร์บอนไดออกไซด์ค.ศ.2065,1,1271
ความเป็นกลางค.ศ.2050,1,1271
กำเนิดลูกเสือลูกเสือเนตรนารี,1,1271
(กสวสันต์หลีกลี้ประจำสัปดาห์,1,1271
อลงกรณ์อลงกรณ์ณัฐวุฒิเพ็ชรพรหมศรมีชัยปฏิกระจาน,1,1271
พลเรือน(กบพลเรือนการตรวจวัดก๊าซคาร์บอนไดออกไซด์ICAOอุตสาหการตรวจวัด,1,1271
"กิตติ์ธาราพรรคไทยศรีวิไลย์บ่อนบ่อนบ่อน72,000บ่อน",1,1271
แพทOnSale,1,1271
"20,5817,2181,959,663",1,1271
Squidแฟลชไดรฟ์,1,1271
ตามหลักการบทบัญญัติแถลงการณ์ร่วมกระทำการแบ่งแยกไต้หวัน,1,1271
ไต้หวันแบ่งแยกบรรทัดฐานไต้หวันกฎหมายระหว่างประเทศเว้นแต่,1,1271
ตัดแต่งอวัยวะเพศชายมุกเม็ดกลมอวัยวะเพศ,1,1271
ตุ้มปริญญานักมวย,1,1271
ตลอดกาลแซมมุกมาริ,1,1271
แข็งถี่ๆจอนวีคฉีดยาก่อนกำหนดวีควีค,1,1271
โมเมกระต่ายอดทนอดทนสละเสียสละคุณยายออกงาน,1,1271
กระต่ายที่จริงเซฟเวลาทำงานกระต่ายแสกนคบ,1,1271
กระต่ายกระต่ายผับใช่ไหมที่จริงรอบนอกหรือว่าที่จริง,1,1271
หรือว่าบูลมิถุนากรกฎาทานอาหารแป๊บโล่งคาดฝัน,1,1271
ที่จริงบรรลุนิติภาวะจดทะเบียนสมรสบรรลุนิติภาวะซี่กระต่ายปุ๊บบานปลาย,1,1271
ไอโฟน1112.6,1,1271
18.30ทักษสตึกสตึก,1,1271
ศักย์กรมการค้าภายในกีรติกรมการค้าต่างประเทศมนัสอุปนายกโรงสีข้าวบุญธรรม,1,1271
เบ็กเพราะอะไรยาบ้าเม็ดเบ็กพ่วงข้างรถพ่วงกช,1,1271
ถ้ำนาคาอือ,1,1271
อือถ้ำนาคา,1,1271
อีเมลแอปเปิ้ลไซเบอร์แฮก,1,1271
ขั้นสุดท้ายฉลากบรรจุภัณฑ์ฉลากหีบห่อมั่นใจถึงความเสถียร,1,1271
กระบวนการผลิตกระบวนการผลิตกระบวนการผลิตเพาะเลี้ยงเพาะเลี้ยงเวกเตอร์ดัดแปลงเจ้าบ้าน,1,1271
กระทู้ไทเปไทม์ไต้หวันนิวส์กรมตำรวจไต้หวันเฮโรอีน,1,1271
"เฮโรอีน1,172446",1,1271
รจิตผับคาราโอเกะคาราโอเกะเต้นรำคลุกคลีStopFree,1,1271
ยูงหนองหานศิล,1,1271
เครื่องเสียงสวดมนต์ทำวัตรลองเครื่องเครื่องเสียงซือๆบ่5555,1,1271
การพาณิชย์อาหารสัตว์สุกรอาหารสัตว์สุกรสุกรwin-winกรมการค้าภายใน,1,1271
MoUการพาณิชย์ไชยาสำนักงานปลัดกระทรวงผลสัมฤทธิ์ผู้ประกอบอาชีพสุกรอาหารสัตว์,1,1271
สวรรคตพระบาทสมเด็จพระมงกุฎเกล้าเจ้าอยู่หัววชิราวุธ,1,1271
GooglePlayStore,1,1271
AppStoreGooglePlay,1,1271
ริมฝีปากเล็บเหน็บเชื่องกุศลลุแคระใบหยก,1,1271
ปส.ศช.ปอท.บัญชีชื่อWaruneeWeerasak555555เอาเลย,1,1271
เทวรูปเทวดาทรงเครื่องกษัตริยาธิราช,1,1271
ฝางเสียเวลาฝาง,1,1271
อาหารเย็นคุณตาหมดสติพิงปฐมพยาบาลคุณตาสุทัศน์ป่าตอง,1,1271
ZTECorporationอุปกรณ์โทรคมนาคมSummitlivestreamingทางเทคโนโลยีZTE,1,1271
แมดบานน้ำตาตกในในไส้โฉนดที่ดินยึดทรัพย์ขายทอดตลาดอึ้ง,1,1271
Contact1179กบข.LINEกบข.gpfcommunityMyGPF,1,1271
กัญชาการบ้านซุ่มกัญชากัญชาซุกซ่อนกัญชากัญชา,1,1271
การบ้านท่าข้ามซุกซ่อนกริชภาคภูมิแคมภธ1715,1,1271
นิธิจินตเทียนขาวสปพ.(ธนาคมกริชจ้อยภาคภูมิ,1,1271
โล่เชิดชูยลเป็นเกียรติ,1,1271
ไมตรีโล่เชิดชูยล,1,1271
ริมฝีปากเล็บเหน็บผู้รู้ผู้รู้ลงความเห็นพญาคนเลี้ยง,1,1271
แพทยศาสตร์ศิริราชมหาวิทยาลัยมหิดล,1,1271
ชาวนาข้าวตกชวโรจน์ชาวนาชาวนาสนองความต้องการติดขัด,1,1271
TrueDTACAIS,1,1271
สหประชาชาติUNWomen,1,1271
ร่วมทุนแหลมฉบัง(ทลฉ.)ท่าเทียบเรือการท่าเรือแห่งประเทศไทยกทท.กิจการค้าพีซี,1,1271
ยลคุณธรรมน้อมนำเศรษฐกิจพอเพียงขับเคลื่อนด้วยคุณธรรม,1,1271
วชิราวุธมงกุฎกำเนิดลูกเสือ,1,1271
ลีโอลีโอทรูงค็อกมาสด้าโปลิศพิชญวอร์,1,1271
ผลการแข่งขันระฆังต่อเวลามหาสารคามสามใบเถาต่อเวลาโปลิศพิชญ,1,1271
ธีรราชสวรรคตพระบาทสมเด็จพระมงกุฎเกล้าเจ้าอยู่หัวกำเนิดลูกเสือ,1,1271
ขายทอดตลาดสำลีกรรมสิทธิ์สำลีจำเลยตรงกันเจ้าพนักงานบังคับคดีเพิกถอน,1,1271
ทัศนีย์เปากรมบังคับคดีสหสง่านราธิปนิติกรสำลี,1,1271
ไตรยกระทรวงยุติธรรมพสุเชิงปฏิบัติการข้ามชาติข้างหลังอนุวัตรอนุสัญญา,1,1271
แมสปานบีPhuketMarriottResortSpaMarlin,1,1271
โทรคมนาคมทรูดีแทค,1,1271
กรมการแพทย์คอร์สอรรฆกรมการแพทย์USFDAประมาณการข้อบ่งชี้,1,1271
คลังแสงมหาสารคามกระทู้ถาม,1,1271
สตช.กมกระทู้ถามกมกมประพฤติมิชอบกมสตช.,1,1271
PfizerModernaแต่ละวันAstraZenecaSinovacPfizerAISais,1,1271
ชาวนาได้การพืชผลยางพาราข้าวโพดปาล์มมันสำปะหลังเงินชดเชย,1,1271
กัญชากัญชาประมวลกฎหมายประกาศใช้กัญชากัญชายาเสพติดให้โทษมีผลบังคับใช้,1,1271
พาราไดซ์พาร์คพสุกระทรวงยุติธรรมเปิดงานมหัศจรรย์กระท่อมกัญชา,1,1271
แอมเนสตี้อินเตอร์เนชั่นแนลแอมเนสตี้,1,1271
บิ๊กซีลาดพร้าวลาดพร้าวยโสภัณฑ์หมดอายุไขกินกัน,1,1271
แอปเปิ้ลไซเบอร์แฮกนิติบัญญัติล้วงบทบัญญัติเฉพาะคนโดยสุจริต,1,1271
แอปเปิ้ลไซเบอร์แฮก,1,1271
เวชั่นเวชั่นผลประกอบการเวชั่นเวชั่น39.3sweethome,1,1271
โอกิลวี่กรุ๊ปเยนซี่ผู้รับผิดชอบททท.อิ๊กดททท.,1,1271
ยธนัชอิ๊กดกรุ๊ปYGGเวชั่นLONDONINTERNATIONAL,1,1271
สิทธิ์ขาดสิทธิ์ขาดแอมเนสตี้แอมเนสตี้การทำผิดโต้แย้ง,1,1271
การระงับองค์การเอกชนแอมเนสตี้ช้าๆออกคำสั่งกระทรวงแรงงานและสวัสดิการสังคมองค์การเอกชน,1,1271
มปพยอมเทววิทยาThepmontriLimpaphayormลาก่อนแอมเนสตี้,1,1271
ดับไฟลุกไหม้รถดับเพลิง,1,1271
พนันยรรยงโอสถช.ภ.ชิงทรัพย์กีรติพลาซ่ายรรยง,1,1271
"e-VaccinePassportแพ็กซ์วิด6,3352,081,5727,2181,987,089",1,1271
ร่อนพิบูลควนร่อนพิบูลเป็นอดีตควนควน,1,1271
"ฐีสำนักงานเศรษฐกิจการคลัง26.1527.98172,82087,80885,01267,773.2",1,1271
สสส.กรมสุขภาพจิตธรรมการยาใจปฐมวัยยกกำลังนิทานปฐมวัย,1,1271
เซ็นสัญญาทำมาหากินใจกลางเมืองกรุงความสูญเสียถูกกฎหมายขอร้องสุ่ม,1,1271
ใจกลางเมืองกรุงความสูญเสียถูกกฎหมาย,1,1271
แnhso/.../841001nhsoVaccinCovid19.,1,1271
กุลบุตรตชด.227,1,1271
543129รวมทั้งหมด672มีนบุรีกะปิป้อมปราบศัตรูพ่ายกุ่ม,1,1271
ไบเดนเผชิญหน้าเผด็จการ,1,1271
ตะวันออกกลางอิสราเอลอิรัก,1,1271
CVCPfizerModernaแต่ละวันAstraZenecaSinovac,1,1271
ช้างเผือกช้างเผือกอรัญอภัยช้างเผือกช้างเผือก,1,1271
