LCS,match,total_match
นิโรธเลขาวิป,39,1445
ลมแรงรักษาสุขภาพหนาวเย็น,21,1445
จัดเรียงกระสอบทราย19.30,20,1445
คลับเฮ้าส์toxicเหยียด,20,1445
ตระหนักถึงแยกตัวคลุกคลีมิ้งค์เฟอร์เร่อ๊อตกวาง,15,1445
ขออภัยจัดเรียงกระสอบทราย19.30,14,1445
แพกซ์วิดแพกซ์วิด,12,1445
ประโคนประโคนชนก,12,1445
แพกซ์วิดเม็ดเม็ด,11,1445
มวลอากาศแผ่แผ่ลมแรงรักษาสุขภาพหนาวเย็นตอนเช้าตอนเช้า,10,1445
ทางเลี่ยงเมือง122กลางแดด,10,1445
กรุงธนกรุงธนกรุงธนสิรินธรเลี้ยวจรัญสนิทวงศ์พระรามพระราม,10,1445
ชนกนัดดาตุ้ม,10,1445
เจ๊ม้อยvplus,9,1445
พระรามขาออกวงแหวน,9,1445
ประโคนประโคนชนกนัดดา,9,1445
อาคมพิทยาไพสิฐ,9,1445
สิรินธรเลี้ยวจรัญสนิทวงศ์พระรามพระรามพระนครราชวิถีพระราม,9,1445
ศาลฎีกาคดีอาญาผู้ดำรงตำแหน่งทางการเมือง,8,1445
ยาเสพติดให้โทษยาเสพติดให้โทษ2522,8,1445
พรรคร่วมรัฐบาลวิปวิป,8,1445
Molnupiravirแพกซ์วิดPAXLOVID,8,1445
กลาสว์สกอตแลนด์,7,1445
นรเจ๊กพิรุณ,7,1445
คำสร้อยพิทยาสรรค์,7,1445
การประปานครหลวงกปน.,7,1445
สัตวแพทยศาสตร์จุฬาฯวารสารมีเจ้าของตระหนักถึงแยกตัวคลุกคลีมิ้งค์,7,1445
แพกซ์วิดPAXLOVID,7,1445
พระนครราชวิถีพระรามพระราม,7,1445
รักษาสุขภาพหนาวเย็นตอนเช้าตอนเช้าลมแรง,6,1445
คลับเฮ้าส์toxicเหยียดคอมฯ,6,1445
น้ำทะเลสุขุมวิทรถรางปู่เจ้าสมิงพรายลวดสุขุมวิทน้ำทะเล,6,1445
คลังแสงมหาสารคามวิป,6,1445
ลมแรงเข้าหาชาวเรือเดินเรือ,6,1445
เหยียดคลับเฮ้าส์toxic,6,1445
มีเจ้าของตระหนักถึงแยกตัวคลุกคลีมิ้งค์เฟอร์เร่อ๊อต,6,1445
ร้านเหล้านิวซีแลนด์ปวดหัว,6,1445
น้ำทะเลสถานทูตฯ'พระรามอัมพาต,6,1445
ข่าวลือซุ่มคบ,6,1445
"1,99744180,499,612",5,1445
มวลอากาศแผ่แผ่ลมแรงรักษาสุขภาพหนาวเย็น,5,1445
วุฒิสภาวิชิตวุฒิสภา,5,1445
JairakWetalFirstcasesSARS-CoV-infection,5,1445
มวลอากาศแผ่ลมแรง,5,1445
มดพม.)​,5,1445
วารสารมีเจ้าของตระหนักถึงแยกตัวคลุกคลีมิ้งค์เฟอร์เร่,5,1445
865462429406372295266219,5,1445
แผ่ลมแรงรักษาสุขภาพหนาวเย็นตอนเช้าตอนเช้าลมแรง,5,1445
สุพรรณเกื้อเอียดเพ็ญ,5,1445
สเปกยาเม็ด์ค”,5,1445
สัตวแพทยศาสตร์จุฬาฯวารสารมีเจ้าของ,5,1445
เสื่อมเสียชื่อเสียงลดทอนศักดิ์ศรี,5,1445
วิปวิปร่างกฎหมาย,4,1445
กรุงธนสิรินธรเลี้ยวจรัญสนิทวงศ์พระรามพระรามพระนครราชวิถี,4,1445
ตีตัวออกห่างประชดความดูแลโรงเรียนประจำ,4,1445
วาดกระสอบทรายกระสอบทรายน้ำทะเลฟันหลอ,4,1445
วาดกระสอบทรายกระสอบทรายน้ำทะเลฟันหลอขออภัย,4,1445
ซองผงบดว์ว์ว์ซองซอง,4,1445
วิปวิปวิป,4,1445
มิ้งค์เนเธอร์แลนด์โปแลนด์คลุกคลีหยิบยกแต่ละวันJairakW,4,1445
แขวนคอขื่อผ่อนแรงแขวนส่งเสียงหายใจไม่ออก,4,1445
ไรเดอร์ไรเดอร์ไรเดอร์,4,1445
ล้มเลิกความจริงใจตลอดชีวิต240,4,1445
ธเรศกรัษรวิ,4,1445
นรเจ๊กพิรุณประโคนประโคน,4,1445
คนต่างด้าวการอนุญาตคนต่างด้าว,4,1445
MOUกรมการจัดหางานถูกต้องตามกฎหมาย,4,1445
คำสร้อยพิทยาสรรค์เปิดเรียน,4,1445
วิปวิปพรรคร่วมรัฐบาล,4,1445
103ประโคนประโคน,4,1445
สุพรรณเกื้อเอียดเกื้อ,4,1445
"7,5926,743128711",4,1445
เวสต์แฮมเวสต์แฮม,4,1445
มะเฟืองพุทไธสง,4,1445
865462429406372,4,1445
น้ำทะเล2.30ฟันหลอ,4,1445
คลับเฮ้าส์toxicคลับเฮ้าส์,4,1445
วาดสัมพันธวงศ์น้ำทะเล,4,1445
"หาคู่รูปร่างหน้าตาคุยเก่งขอยืม10,00010,000เรื่อยสู่ขอ",3,1445
6.3ระยะแรก2.43.9อินทรความต่อเนื่องการจำแนกประเภท(ขอ,3,1445
"น่าพอใจน่าพอใจอยู่ในเกณฑ์ททท.สุดท้ายนี้300,000ต่าวด้าว",3,1445
การจำแนกประเภทป่าสงวนแห่งชาติ6.3คทช.การจำแนกกลั่นกรองอนุกรรมการแผนงาน,3,1445
กฤชมะลิเจ้ากรมอุทกศาสตร์,3,1445
PPEเครื่องวัดปลายนิ้ว,3,1445
NGOsการรับรู้คนต่างด้าวความเข้มงวดภาคอุตสาหกรรมถูกกฎหมายคนต่างด้าวการอนุญาต,3,1445
ประโคนประโคนประโคนชนก,3,1445
COPกลาสว์สกอตแลนด์,3,1445
น้ำทะเล2.30ฟันหลอเรียงกระสอบทราย,3,1445
อนุสัญญาสหประชาชาติCOP,3,1445
โกหกแบตไรเดอร์ไรเดอร์ต่อยบ้องหูไรเดอร์ไรเดอร์,3,1445
พระรามให้เช่าหมอนมุ้งหนังสือเรียนชั้นเตรียมอนุบาลเลี้ยงเด็ก,3,1445
ให้เช่าหมอนมุ้งหนังสือเรียนชั้นเตรียมอนุบาลเลี้ยงเด็กพื้นห้อง,3,1445
"2,600,000เข้าบัญชีประโคนนรมอบอำนาจ7,500,000เข้าบัญชีเอาเรื่อง",3,1445
"7,500,000เข้าบัญชีเอาเรื่องจนถึงที่สุดนัดดาคุมขังเห็นใจผ้าห่ม",3,1445
สู่ขอสถานีขนส่งหมอชิตรถทัวร์ถึงที่หมอชิตนัดดาโปรไฟล์,3,1445
มั้งก็ดีเป็นปึกแผ่น,3,1445
"7,5921,946,7287,495",3,1445
วงแหวนทางขึ้นลิ้นจี่,3,1445
โกหกแบตไรเดอร์ไรเดอร์ต่อยบ้องหูไรเดอร์,3,1445
นิด้าโพลชัชชาติตัวเต็ง,3,1445
ประโคนประโคนประโคนประโคนชนก,3,1445
ดิเรกUniversalPeriodicReviewUPRคณะมนตรีสหประชาชาติคำมั่น,3,1445
คำมั่นสหประชาชาติดิเรกUniversalPeriodicReviewUPRคณะมนตรี,3,1445
์คดำเนินชีวิตทำมาหากินพลิกฟื้นหน้าเปิดผู้ประกอบการรายย่อยดำเนินกิจการเหมือนปกติ,3,1445
"80,484,42765.44บลูมเบิร์กSmartEntry""แพกซ์วิดPaxlovid",3,1445
"บลูมเบิร์ก(ณ1847,200บราซิล43,978,81433,950,9252,551,969",3,1445
รวงคลังแสงการแสดงความคิดเห็นข้อสรุปการแสดงความคิดเห็นศักดิ์ศรีความเป็นมนุษย์เท่าเทียมกัน,3,1445
"1,975,59119,7037,495",3,1445
"คนซื้อราคาขาย7,500,000750,000คนซื้อเจ๊กร่วมชีวิตปลง",3,1445
การประปานครหลวงขออภัยความไม่สะดวกข้อขัดข้อง1125อนึ่งกปน.,3,1445
"ขอยืม10,00010,000เรื่อย",3,1445
แพกซ์วิดกรมการแพทย์,3,1445
ทธพลเนาวรัตน์ชนกนัดดา,3,1445
เพิกถอนคดีอาญา108,3,1445
ซองซองผงบดว์ว์ว์ซอง,3,1445
สุทธมนัสปลัดกระทรวงข้อเสนอแนะNGOsการรับรู้คนต่างด้าวความเข้มงวด,3,1445
สุทธมนัสปลัดกระทรวง,3,1445
นรเจ๊กประโคน,3,1445
ธิเบศรอดุลยเดชบพิตร,3,1445
10.20คลังแสงมหาสารคามวิป,3,1445
สิทธิชัยสิขวัตร,3,1445
CREDITPHOTO],3,1445
นิด้าเรียกค่าเสียหายความเสื่อมเสียชื่อเสียงโทษปรับรับฟ้องรับฟ้องออกหมายเรียก,3,1445
Shopee11.11BigSale,3,1445
หึงหวงนอกใจมีเหตุผลตีตัวออกห่างประชดความดูแลโรงเรียนประจำกินนอน,3,1445
ถกสะเดามาเลย์มอเตอร์เวย์นิกรบดีอาคารสำนักงานศุลกากร,3,1445
ให้ยาแพกซ์วิด,3,1445
เภสัชกรภัทผู้ทรงคุณวุฒิ,3,1445
ยาบ้าเม็ดกระท่อมมีดพร้าโดยตั้งใจสุพรรณ,3,1445
"2,5242.100.901.051.80มีนบุรี0.480.90",3,1445
"1,946,7287,4951,830,03798,425",3,1445
ครอบงำครอบงำต่อเติมเสริมแต่งนอกกฎหมาย,3,1445
คำพิพากษาศาลฎีกาคดีอาญาผู้ดำรงตำแหน่งทางการเมือง,3,1445
แพทยศาสตร์สัตวแพทยศาสตร์จุฬาฯวารสารมีเจ้าของตระหนักถึงแยกตัวคลุกคลี,3,1445
อุทกศาสตร์กองทัพเรือจุลจอมเกล้าหว่า05.0005.00น้ำทะเลกองทัพเรือ,3,1445
กลาสว์เรนเจอร์,3,1445
2.100.901.051.80มีนบุรี0.480.900.20,3,1445
ล้มเลิกความจริงใจตลอดชีวิต240สาวิตรี,3,1445
พระรามนนทรียานนาวากระสอบทรายพระรามขาออกวงแหวนทางขึ้น,3,1445
นรเจ๊กพิรุณประโคน,3,1445
05.0005.00น้ำทะเลกองทัพเรือจุลจอมเกล้า,3,1445
น้ำทะเลปากอ่าวมหาชัยกระทุ่มกระทุ่มน้ำท่าผุดท่อระบายน้ำ,3,1445
เวลานัดหมายเวลานัดหมายSocialDistancing,2,1445
สุพรรณเกื้อเอียด,2,1445
เมี้ยกยาบ้าเม็ดกระท่อมมีดพร้าโดยตั้งใจสุพรรณมีดพร้า,2,1445
ชายโครงมีดพร้ามีดพร้าเพ็ญ,2,1445
ขออภัยทุก ๆจัดเรียงกระสอบทราย19.30,2,1445
"10,789ผู้ขับรถแท็กซี่5,921ผู้ขับ4,8687,0173,772",2,1445
์คแพกซ์วิด,2,1445
มีดพร้าสุพรรณเกื้อเอียด,2,1445
"ผลประกอบการ20,995กำไรสุทธิ5,332ผู้เช่าเช่นเคย5,103กำไรสุทธิ",2,1445
ระยะแรกลมแรงรักษาสุขภาพหนาวเย็นชายฝั่งควรระวังลมแรงเข้าหา,2,1445
ธนาคารเพื่อการเกษตรและสหกรณ์การเกษตรธ.ก.ส.ธ.ก.ส.,2,1445
ภาชนะสุกสำรับ,2,1445
ก๊าตห่าCatLinh-HaDong,2,1445
โคลข่าวลือซุ่มคบ,2,1445
CREDITPHOTO]],2,1445
รร.คำสร้อยพิทยาสรรค์,2,1445
ทันตแพทย์อาคมประดิษฐ,2,1445
วลัยธนาคารเพื่อการเกษตรและสหกรณ์การเกษตรธ.ก.ส.,2,1445
เดโชพลอนุกรรมการแนวโน้ม,2,1445
บาดปฐมพยาบาลรถกระเช้าบ้านสวนคนเจ็บณศิคุณธรรมคนเจ็บ,2,1445
สนั่นอังอุบลหอการค้า,2,1445
ยาเม็ดแพกซ์วิด,2,1445
พันธบัตรลเล็ตสบ,2,1445
"ขึ้นอยู่95.093.0ค่อยเป็นค่อยไป2564,การอนุญาตเงี่อนไข",2,1445
คลับเฮ้าส์เหยียดคลับเฮ้าส์toxic,2,1445
HMrAmerishBeraอนุกรรมาธิการแพร่ขยายคารวะ,2,1445
สมพงLPNการรับรู้ตระหนักถึงถูกต้องตามกฎหมายข้ามชาติถูกต้องตามกฎหมายสิทธิประโยชน์,2,1445
โหรดูดวงก็ช่างเยี่ยมเยียนคสช.,2,1445
ไพโรจน์โชติกเสถียรกรมการจัดหางาน,2,1445
เงินหมุนเวียนเท่าที่จำเป็นลดค่าใช้จ่าย,2,1445
กุ้งกุ้งกุ้ง,2,1445
เซียลซองซองผงบดว์ว์ว์,2,1445
KKPResearchคิน,2,1445
ข้อยุติความล่าช้า(กพศูนย์อำนวยการศอ.ข้อสรุปขามสำนักงานการปฏิรูปที่ดินเพื่อเกษตรกรรม,2,1445
"76,492193,2578,310",2,1445
มดผการันปากคำมดพม.)​,2,1445
โรจน์ธนะมด,2,1445
ผการันปากคำมดพม.)​,2,1445
มดผการันปากคำมดพม.,2,1445
แพกซ์วิดPAXLOVIDกรมการแพทย์,2,1445
ผลประกอบการประกอบการอุปสงค์คงทนยานยนต์เครื่องจักรกลคงทนปีใหม่,2,1445
ฟิธัสกรุงไทยInfinitasKrungthai,2,1445
นายทะเบียนแจ้งให้ทราบเนม,2,1445
สติคส์KerryLogisticsNetworkLimitedKLNโลจิสติกส์,2,1445
กังวลใจบอกกล่าวความแตกแยกคลังแสงมหาสารคามศักดิ์ศรีความเป็นมนุษย์ปล่อยปละละเลย,2,1445
"7,5921,975,59119,7037,495",2,1445
ผกาหึงหวงนอกใจมีเหตุผลตีตัวออกห่างประชดความดูแลโรงเรียนประจำ,2,1445
สุขุมวิทขาเข้าขาออกน้ำทะเลช้าๆ,2,1445
พระรามขาออกวงแหวนน้ำทะเลทางซ้ายติดขัด,2,1445
น้ำทะเลพระรามฟุตบาธ,2,1445
ยาบ้าเม็ดกระท่อม,2,1445
"7,4951,830,03798,425",2,1445
"6,743128711",2,1445
น้ำทะเล1.30น้ำค้างทางเหนือลอยกระทงน้ำทะเล1.17,2,1445
กระสอบทรายน้ำทะเลฟันหลอขออภัย,2,1445
เจ้ากรมอุทกศาสตร์น้ำทะเล,2,1445
ตุ๊กตาหมีแขวนผนังห้อง,2,1445
กระทุ่มคันดินกระทุ่มกระทุ่มกระสอบทรายเครื่องสูบน้ำน้ำท่ากระทุ่ม,2,1445
หนักหน่วงกระสอบทรายชั้นเดียวสายน้ำไหลบ่าน้ำท่ามหาชัยโกรกกราก,2,1445
JICAคัลการสาธิตกักเก็บน้ำฝนใต้ดินกักเก็บน้ำฝน,2,1445
กักเก็บน้ำฝนใต้ดินเพิ่มจำนวนกักเก็บPla-kunกุนวัฏจักร,2,1445
ปตท.ปิโตรเลียมปตท.สผ.,2,1445
"30,64528,6411,769",2,1445
ซองมึนเมาคึกคะนอง,2,1445
ประโคนประโคนประโคนชนกฉ้อโกงเงิน,2,1445
"เงินเก็บกังเบี้ยวงานแต่งวดี150,000ม้งจริยา",2,1445
วิดบัติกรมการแพทย์,2,1445
BabyallIneedisyou,2,1445
ร้านเสริมสวยสปานวด,2,1445
ช้ำหมอชิตรักจริง,2,1445
"แล็บแพนด้า2,800",2,1445
นรผ้าห่มพัดลมชนกคุมขังเป่านรนัดดา,2,1445
วงแหวนชิดขวาสัญญาณไฟตำรวจจราจรลิ้นจี่เมื่อใดปริมาณน้ำฝนพระราม,2,1445
"28,40028,500ทองรูปพรรณ27,894.4029,000",2,1445
เพ็ญน้ำอ้อยนอนหงายของมีคม,2,1445
SHAAmazingSafetyAdministration,2,1445
SHASHAสุขลักษณะอุปกรณ์เครื่องใช้,2,1445
"7,5926,881711",2,1445
ป.ป.ส.ซองฉวยโอกาสยาเสพติดให้โทษยาเสพติดให้โทษ2522,2,1445
เดวิดยส์เวสต์แฮม,2,1445
วาดสัมพันธวงศ์น้ำทะเล2.30ฟันหลอเรียงกระสอบทราย,2,1445
"2,5242.100.90",2,1445
"แนวโน้มผู้รักษาร่วมมือร่วมใจบลูมเบิร์ก(ณ1847,200บราซิล",2,1445
บัติกรมการแพทย์แพกซ์วิด,2,1445
"การจำแนก1,648ราชการทหารกรมธนารักษ์การจำแนกประเภท1,6404,685จำแนกประเภท",2,1445
22.30มดป่อเต็กตึ๊งแกะรอยพระราม,2,1445
เม็ดมิลลิกรัมเม็ดมิลลิกรัมเม็ด385ให้ยา377,2,1445
.ปคกวดขันปลอมแปลงท้องตลาดเข้าชุดโกดังกะปิเครื่องมือแพทย์,2,1445
เภสัชกรภัทผู้ทรงคุณวุฒิรองเลขาธิการโกดังกะปิเครื่องมือแพทย์PPE,2,1445
ห้อยคลอรีนไดออกไซด์,2,1445
กระสอบทรายน้ำทะเลฟันหลอขออภัยจัดเรียงกระสอบทราย19.30,2,1445
วิดยับยั้งเอนไซม์เพิ่มจำนวน,2,1445
เฮาส์ความไม่สบายใจบิดเบือนใส่ร้ายมีโทษเฮาส์,1,1445
เจ๊กประโคนประโคน,1,1445
ผีเสื้อไกอิมพีเรียลมรกตผ้าห่ม,1,1445
"นรเจ๊กเงินเก็บกังเบี้ยวงานแต่งวดี150,000",1,1445
ความไม่สบายใจบิดเบือนใส่ร้ายมีโทษ,1,1445
"ให้ความร่วมมือน้ำเกลือหรือว่าหลอดเลือดขัดขืนด่าทอเครื่องวัด75,000",1,1445
เดวิดยส์เวสต์แฮมเวสต์แฮม,1,1445
ควบคุมสติอาละวาดด่าทอเครื่องวัดคนไข้หลบสติรปภ.,1,1445
"ผู้ขับรถแท็กซี่ตามเงื่อนไขกรมการขนส่งทางบก10,789ผู้ขับรถแท็กซี่5,921",1,1445
พุทไธสงเครื่องวัดใช้การไม่ได้พิชฌาเมฆผู้ป่วยนอก19.00,1,1445
ชนกนัดดาต้มตุ๋นเปย์ผ้าห่มพัดลมห้องขัง,1,1445
"""คล็อปป์""โวยหงส์ล์ว",1,1445
"Iamyours...""",1,1445
วัดราษฎร์ศาลเยาวชนและครอบครัวน้ำทะเล,1,1445
พวงมาลัยเปื้อนเมี้ยกยาบ้าเม็ดกระท่อมมีดพร้าโดยตั้งใจ,1,1445
ใบอนุญาตขับรถบัตรประจำตัวผู้ประกันตน2533รถเช่ากรมการขนส่งทางบกให้เช่าตามเงื่อนไข,1,1445
นอนหงายกระเด็นถังน้ำของมีคม,1,1445
ซองมึนเมาคึกคะนองป.ป.ส.ซองฉวยโอกาสยาเสพติดให้โทษยาเสพติดให้โทษ,1,1445
อัลเบิร์ตฟอบราซิลทารก,1,1445
ซองคอนโดมิเนียมอ่อนนุช,1,1445
แพลนน้ำชาหมั้นเดน,1,1445
เซียลTiktokปารตี้ความบันเทิงเม็ดซองตัดต่อ,1,1445
ภัณฑิใจอ่อนโฉมหน้ารุ่นน้อง,1,1445
กางเกงขาสั้นด่าทอขว้างด่าทอ,1,1445
เอ๋เอ๋ใส่ความเสื่อมเสียชื่อเสียง,1,1445
หนักใจเอ๋ทำสัญญาหย่ากันอดทน,1,1445
เวสต์แฮมเวสต์แฮมเวสต์แฮม,1,1445
"7,5921,975,59119,7037,4953,7971,99744180,499,612",1,1445
"531,000สูงกนักวิเคราะห์450,000312,000MSCIผลประกอบการ",1,1445
พรรคเดโมแครตเก็บภาษีมหาเศรษฐี,1,1445
์คคอร์สคอร์ส,1,1445
"แพกซ์วิด180,000คอร์สคอร์ส",1,1445
"แพกซ์วิดPAXLOVID""แพกซ์วิด",1,1445
