LCS,match,total_match
เมล็ดพันธุ์เมล็ดพันธุ์เมล็ดพันธุ์เมล็ดพันธุ์เมล็ดพันธุ์,1,1445
เปี๊ยกพิศาลเศรณี,1,1445
อสูรนางฟ้าอสูร,1,1445
เรตติ้งนางฟ้าอสูร,1,1445
สหมดการแถลง,1,1445
มานพสุคนธ์มด,1,1445
ตั้งโต๊ะกฎหมายอาญา112,1,1445
แขวนคอขื่อผ่อนแรงแขวนส่งเสียงหายใจไม่ออกมด,1,1445
วุฒิสภาวิชิตวุฒิสภาแจ้งให้ทราบพระบรมราชโองการสมาชิกวุฒิสภาโดยตำแหน่งเหล่าทัพ,1,1445
ดวงดาวโหราศาสตร์ดาวพฤหัสราศีมังกรราศีกุมภ์ดาวเสาร์ราศีมังกรดาวเสาร์,1,1445
เมล็ดชาวนาเหน็ดเหนื่อยชั่วชีวิตชาวนาน่าเสียดายวาทกรรมขาดทุน,1,1445
เปิบข้าวทุกคราวสูเป็นอาจิณเหงื่อสูก่อเกิดบทกวี,1,1445
สุธีส.อ.ท.ผลการสำรวจภาคอุตสาหกรรม82.179.0ผลประกอบการประกอบการ,1,1445
อาคมE-MailchangarcomthFacebookchangarcomhttpsARCOM-CHANG-Thairath-Online-,1,1445
