LCS,match,total_match
บุ๋มผู้หลักผู้ใหญ่บุ๋มคาดเดาบุ๋มบุ๋มบุ๋มปนัดดา,1,1271
ลูกชิ้นลูกชิ้นเป็นประวัติการณ์,1,1271
นิ่งเฉยเทคแคร์สัญญาว่าจ้างประจานเสื่อมเสียชื่อเสียงช่างภาพช่างภาพ,1,1271
ขี้เหร่พาดพิงฝึกงานฝึกงานหุ้นส่วนสตูดิโอเจ้าสาวโขนง,1,1271
แหวกอกโตเกียวเนย,1,1271
กฎระเบียบ21.30Grooveออฟฟิศเศสเซ็นทรัลเวิลด์บานเลื่อนชั้น,1,1271
MVสำออยเวอร์ชั่น02.22จ่อคิวเอ็มวีแพททึ่ง,1,1271
YGEntertainmentเซ่,1,1271
มิวสิกเต็มตัวเอ็มวีสำออยเวอร์ชั่นเอ็มวีแพทลงมือทำ,1,1271
ช่วยด้วยกิ๊ฟอาร์ตเมฆเอ็มวีซีนเพ่งเพ่ง,1,1271
ประตูรั้วประตูรั้วกราง,1,1271
ประชุมสุดยอดรับเชิญดาบสองคมคำเชิญกระทืบเท้าทานข้าว,1,1271
การเยือนลับๆ ล่อๆลับๆ ล่อๆโพนทะนาหิวรับบริจาค,1,1271
เหมือนเคยทอล์กทอล์กการต่างประเทศตัวกลางให้ข่าว,1,1271
สุ่มให้ความร่วมมือทำผิดกฎหมายความวิบัติน่าเสียดาย,1,1271
ถก1.1.529แอฟริกาใต้กลายพันธุ์,1,1271
ด่างขึ้นชื่อเวดดิ้งรีทัชดั่งโขนงเจ้าบ่าวดำคล้ำ,1,1271
กคmikthongraya,1,1271
เกาหลีเหนือประหารชีวิตนร.ไฟล์ซีรี่ส์Squid,1,1271
"เฮโรอีนสี่เหลี่ยม1,172เฮโรอีนประทับเครื่องหมายสิงโตเหยียบ",1,1271
ข้าวโพดมันสำปะหลังข้าวโพดมันสำปะหลัง,1,1271
PattayaMusicFestivalสวนสาธารณะนาเกลือส่งท้าย,1,1271
แอมเนสตี้เสกสกล,1,1271
เดิมพันแอมเนสตี้,1,1271
ถึงกันเอ็มวีโปรดักชั่นมิวสิกปัณณแกนกลางโปรเจกต์ยื่นมือ,1,1271
โอมอัชคอนเฟิร์ม,1,1271
นอนหลับตื่นขึ้นน้องสาวเลิกรา,1,1271
เอ็มวีทึ่งฟท์แทบจะเล็กๆ น้อยๆแค่นั้นมิวสิกฟท์,1,1271
ตอนเช้าลุกขึ้นกินน้ำอยู่เลย,1,1271
ไพโรจน์รุจิล้างจาน,1,1271
iQiyiอ้ายฉีอี้,1,1271
โซฟาท่อนเปลือยอืด,1,1271
ปล่อยของเอ็มวีเป็นเรื่องเป็นราวโครงเรื่องทำการบ้านบอร์ดช็อตแคบ,1,1271
การพนันเสื้อยืดนุ่งกางเกงยีนส์กีรติพลาซ่าสร้อย,1,1271
เบรซุสความเข้าใจผิด,1,1271
แพทตรงๆแฟร์แฟร์แพท,1,1271
เคลือบทะเบียนรถขบเคลือบขบวันทำการใช้ใบทะเบียนรถ,1,1271
ข้อกฎหมายข้อกฎหมายเเนะขจัดปัดเป่า,1,1271
การทอดกฐินณิโป๊ะสง่าเก่,1,1271
บลูแคนยอนแชเปียชิพบลูแคนยอนคันทรี,1,1271
…..สมเหตุสมผลตรรกะวิบัติสปายวงราชการก็แล้วไป….,1,1271
ยธนราช่างภาพ,1,1271
ลึกซึ้งช่างภาพข่มขืนลวนลามนางงามคลองห้า,1,1271
การต่างประเทศตำรวจสากลกมตามนั้นคำชี้แจงติดขัด,1,1271
ชิงทรัพย์กระสุนปืนทางสาธารณะยิงปืนโดยใช่เหตุ,1,1271
xn--ocdavplezlya/.../ready-to-work-noลิงค์ทีหลังเวลานัดหมาย,1,1271
"259,699,49782,292234,831,2395,191,76248,969,79234,541,349บราซิล22,043,417",1,1271
นิวเคลียร์เกาหลีเหนืออิหร่าน,1,1271
ประเทศสมาชิกมหาสมุทรมหาสมุทรกว้างใหญ่เป็นที่ตั้งทศวรรษมหาสมุทรDecade,1,1271
UNOceanDecadeKickoffConferenceWesternPacificIts,1,1271
ไชน่าทาวน์เมืองหลวง,1,1271
กัลยเดชาไฮโซแบงค์สุขุมวิทโรคมะเร็ง,1,1271
ผู้ประท้วงไชน่าทาวน์,1,1271
จุดไฟไชน่าทาวน์,1,1271
ผู้ประท้วงบุกเข้าไปโค่นล้ม,1,1271
นิด้าผู้เข้าประกวดช่างภาพ,1,1271
การลงนามผู้ค้นคว้าสดีกรมการแพทย์โครงการวิจัยMOVe-AHEADStudyราชวิถี,1,1271
สำนักเลขาธิการนายกรัฐมนตรีสลน.)2.6ไอโฟน111,1,1271
บ้านเดี่ยวชั้นเดียวข้าวของเครื่องใช้กระจัดกระจายคอร์เลงร์ด,1,1271
มิใช่ความมุ่งหมายความปั่นป่วนกระด้างกระเดื่องล่วงละเมิดกฎหมาย116การปราศรัย,1,1271
ทิเตรียมใจมืดมนกระบวนการยุติธรรมงานเทศกาล112อิทธิสำนักงานคดีอาญา,1,1271
มั่วสุมใช้กำลังประทุษร้ายขู่เข็ญใช้กำลังประทุษร้ายกระทำการอย่างใดสถานทูตสวีเดน,1,1271
สำนักงานอัยการสูงสุดรัชดาภิเษกสำนักงานคดีอาญาเขนเห็นสมควรษฐ์ชีวาเพนกวิน,1,1271
โปรโมชั่นส่วนสูงค่าโดยสารค่าโดยสารStudentCardค่าโดยสารพระภิกษุ,1,1271
BlackpinkYGEntertainment,1,1271
ของรางวัลออสการ์แสดงนำGladiator,1,1271
ไตรรัตน์แกมบิดากิรัติน้องสาวข้อเรียกร้อง,1,1271
คุณนายชาวนาขอบพระคุณที่นาจอกปราโมทย์ชาวนาข้าวตก,1,1271
ข่มขืนผู้เข้าประกวดอนาจารต่อหน้าธารกำนัลที่ลับช่างภาพมีฝีมือการถ่ายภาพ,1,1271
สถานที่เกิดเหตุเก็บตัวเขาใหญ่อนาจารข่มขืน,1,1271
BuriramCastleตากสินWalkInจุฬาภรณ์550,1,1271
"6,3356,0922062,088,3277,2181,987,08980,6571,508",1,1271
"เหมาล้างจาน90,000",1,1271
ประจันประจันเสมอกันประจันเชาวน์วัศจำปานอนหงาย,1,1271
ORANGETHEWORLDความเสมอภาคความหลากหลายLGBTQIA+)งา,1,1271
ซินแสเข่งชนม์ทรรศน์ฤทัยโหราศาสตร์,1,1271
"บุฟเฟ่ต์เหมาล้างจาน90,000",1,1271
"นักขัตฤกษ์ภาชนะ10,000ล้างจานเหมาล้างจาน90,000ภาชนะ",1,1271
เหมาล้างจานในความเป็นจริงล้างจานลูกจ้างประจำลูกจ้างประจำพร้อมๆ กันล้างจาน,1,1271
"ความสงสัยล้างจาน90,000บุฟเฟ่ต์สามแยกกระทุ่มกระทุ่มอนุวัตร",1,1271
ควนร่อนพิบูลร่อนพิบูล,1,1271
พ.ย.)นพดลสิตพสกนิกรเสกสกลอัตแรมโบ้,1,1271
ระดับชาติราบรื่นสหประชาชาติหุ้นส่วนทวิภาคีพหุภาคีการหลุดพ้นหยุดชะงัก,1,1271
"""ปอร์ยูฟ่าแชมเปี้ยนส์",1,1271
bitlyFjonกฆเคลือบทะเบียนรถขบเคลือบ,1,1271
หน่วยเฉพาะกิจกรมทหารราบพันโทสุริยา,1,1271
สนามฟุตบอลเที่ยงคืนสนามฟุตบอลพนักงานรักษาความปลอดภัย,1,1271
แรมโบ้เสกสกล,1,1271
ข้อคิดเห็นตรงกันข้อคิดเห็นข้อสรุป,1,1271
หน่วยเฉพาะกิจกรมทหารราบกองร้อยทหารราบ1413,1,1271
ต้นสังกัดYGentertainmentBlackpink,1,1271
Blackpinkต้นสังกัดYGentertainmentBlackpink,1,1271
ต้นสังกัดYGentertainmentBlackpinkBlackpink,1,1271
ภูมินทร์พุ่มปพ.)สัณฐ์.ปพ.,1,1271
พระราชบัญญัติประกอบรัฐธรรมนูญใช้แล้วAPECสุดแล้วแต่เยอะแยะหารายได้มาตีทับซ้อน,1,1271
CREDITPHOTO]],1,1271
จบเกมยูฟ่าแชมเปี้ยนส์,1,1271
การประชุมสุดยอดSummitDemocracyหยุดยั้งเสื่อมถอยพังทลายฟิลิปปินส์รับเชิญ,1,1271
วนเวียนขว้างปากระเบื้องทวงหนี้ป้ายประกาศเบอร์โทรศัพท์ความบริสุทธิ์ใจ,1,1271
ถ้วยล้าต่อเวลาคนเราเลกแข็งแกร่งเลกเลก,1,1271
0.08แซนด์บ็อกซ์,1,1271
นพดลสิตพสกนิกร,1,1271
"คนมีเงินสถานีวิทยุกระจายเสียงพระมหากษัตริย์สถานีวิทยุกระจายเสียงผ้าป่า36,000สถานีวิทยุ5,000,000",1,1271
ตั้งโต๊ะลงชื่อแอมเนสตี้ผู้ริเริ่มแอมเนสตี้ตอแหล,1,1271
ขับไล่แอมเนสตี้อินเตอร์เนชั่นแนลNGOตั้งโต๊ะลงชื่อ,1,1271
RadioFreeAsiaRFAเกาหลีเหนือ,1,1271
เจ้าพนักงานบังคับคดีเจตนารมณ์กรมบังคับคดีกฎระเบียบเท่าเทียมกันเจ้าหนี้ผู้ทรงคุณวุฒิประเมินราคา,1,1271
การขายทอดตลาดเทวีเจ้าพนักงานบังคับคดีขายทอดตลาดเทวีขายทอดตลาดการขัดขวางการขายทอดตลาด,1,1271
ไกเจ้าพนักงานบังคับคดีท.)ยื่นฟ้องเรียกค่าเสียหายกรมบังคับคดีเจ้าพนักงานบังคับคดีกระทำการ,1,1271
ยื่นฟ้องเจ้าพนักงานบังคับคดีประพฤติมิชอบบทบัญญัติ157ประมวลกฎหมายอาญาเจ้าพนักงานละเว้น,1,1271
กระทู้ถามร่วมวงถกคลังแสงมหาสารคามวิปกระทู้ปรมัตถ์,1,1271
sserผู้ก่อตั้งMBFlyingTAllegra(ฟอิ้งเลก,1,1271
LegacyMachineFlyingTAllegra(เลแมชชีนอิ้งเลก,1,1271
ต้นสังกัดYGentertainment,1,1271
ยื่นคำร้องเข้าเกณฑ์ผู้จัดหาในกรณีนี้จุฬาภรณ์จุฬาภรณ์เสียค่าใช้จ่ายค่าเสียหาย,1,1271
เชื่อได้จุดมุ่งหมายแทรกแซง,1,1271
เซฟปลุกผีบอร์ดสตีฟบรู๊ซ,1,1271
ตัดสัมพันธ์การทูตไต้หวัน,1,1271
ทาวน์เมืองหลวงโซโลมอน,1,1271
ไชน่าทาวน์ลุกไหม้,1,1271
คอมมานโดกรวบช่างภาพหื่น,1,1271
แล็บแพนด้ามุก,1,1271
เมฆครามชาดงาช้างIvoryงาช้างเผือกผสาน,1,1271
Warrixเศวตกุญชรช้างเผือกส่วนสำคัญความสง่างามน่าเกรงขามแข็งแกร่ง,1,1271
ริกVirtualConferenceโพลกิ้งธีมาทันนักฟุตบอล,1,1271
690กองร้อย(ส(ศฝ182,1,1271
เจษฎาโสมนัสศิษฎ์การก่อการร้ายสุริยาประนมการก่อการร้าย,1,1271
ภูริภูมินทร์พุ่มพ.ต.เวทย์สงค์การก่อการร้าย,1,1271
เจ้าหนี้วนเวียนขว้างปา,1,1271
คำวินิจฉัยศาลรัฐธรรมนูญผูกพัน,1,1271
ลงชื่อขับไล่แอม,1,1271
จารุลูกหนี้จดหมายลูกหนี้แอบอ้างเจ้าหนี้ขว้างปา,1,1271
ENJOY!”ASTONMARTINAUDIBMWFORDHAVAL,1,1271
"กรมบังคับคดีขายทอดตลาดเทวีประมูล2,116อินเตอร์อีสคอร์ปอเรชั่น",1,1271
ราดฆ่าเชื้อน้ำยาฟอกขาวไฮเตอร์ฆ่าเชื้อโซเดียมไฮโปคลอไรท์,1,1271
ชั้นแรกฆ่าเชื้อโซเดียมไฮโปคลอไรท์ppmน้ำยาฟอกขาวอัตราส่วน,1,1271
ใช้แล้วKitคัดแยกปนเปื้อนน้ำมูกน้ำลายหลั่งบรรจุภัณฑ์,1,1271
กรมอนามัยถูกวิธีกรมอนามัยตลับหลอดน้ำยาหลอดหยด,1,1271
CGดูดีอันนั้น,1,1271
คนวงในเมาท์กรุบ,1,1271
แซะCGแซะ,1,1271
"ขับไล่แอมเนสตี้""",1,1271
SHA22.45ษา,1,1271
สิระจาคะกมแฉเรียกตัวสิระษาสิระ,1,1271
มหกรรมยานยนต์ชาลIMPACTททบ.TVMotorExpo15.30,1,1271
ASTONMARTINAUDIBMWFORDHAVALHONDAHYUNDAI,1,1271
ตมศฝ0022.2929รายงานสรุปศฝสะเดาแอบหนี,1,1271
พระมหากษัตริย์แอมเนสตี้,1,1271
ณัฎฐธิดามีหวัง,1,1271
พิเคราะห์โจทก์จำเลยจำเลยยื่นคำร้องราคาประเมินมิใช่โจทก์,1,1271
เทวีกรมบังคับคดีขายทอดตลาดเทวี,1,1271
สวนกระแสคนโสดคู่รักคู่รักLGBTQธรรมดาๆพรีเมียมยืนยาว,1,1271
งายวาจาสนองความต้องการแหล่งเงินทุนขาดมือดำเนินกิจการใช้คืน,1,1271
ร่อนพิบูลควน,1,1271
ฟิวเจอร์ลส์แล็บแมกเลีย,1,1271
ลท์กรุ๊ปTHGช่วงชีวิต”(LifetimeGuardianAll,1,1271
มีประสิทธิผลผลการศึกษา762ตามหลังให้ยาผลการศึกษาinterimresult,1,1271
คอร์สรจิตอรรฆกรมการแพทย์แมรฐสดีอุบัติ,1,1271
ประจญญ์กลุ่มก้อนVLAcademyผึ้งสารภีหอพัก,1,1271
ปตท.ปตท.ปิเลียมตลาดเสรีปตท.5.5ผลประกอบการ,1,1271
แอมเนสตี้ฯแอมเนสตี้,1,1271
กฤตยาฝางคนไข้ต่อรถส่งกลับ,1,1271
รามาธิบดีวชิราวุธมงกุฎ,1,1271
แฟลชไดรฟ์เกาหลีเหนือ,1,1271
"นิ้วนางยยยย,เเล้วเ5555",1,1271
อับดุลหะรือเสาะไพโรจน์จริต,1,1271
กู้ยืมปีการศึกษากู้ยืมกู้ยืมปีการศึกษาผูกพันการทำสัญญากู้ยืม,1,1271
ให้เงินกู้ยืมเป็นการสมควรกู้ยืมให้เงินกู้ยืมกู้ยืมกู้ยืม,1,1271
กรุงศรีอยุธยาเงินบาทเช้านี้33.3733.32ค่าเงินบาทแข็งค่าเกินคาด,1,1271
เอาใจผู้รับผิดชอบสตางค์คะแนนเสียงบดบังแก่นแก่นBird,1,1271
หนาลำตัวทับที่หน้าผากหน้าด้านพนักงานรักษาความปลอดภัยสนามฟุตบอลเที่ยงคืน,1,1271
สนามฟุตบอลเที่ยงคืนสนามฟุตบอล,1,1271
เที่ยงคืนสนามฟุตบอลประตูรั้วประตูรั้วกรางล้มทับ04.00สถาบันนิติเวช,1,1271
ตามเวลาษาGROOVEการปล่อยปละละเลยขอเวลาษา​การฝ่าฝืนตรงไปตรงมา,1,1271
ษาอมราGROOVEเซ็นทรัลเวิลด์ศูนย์รวมตามเวลา,1,1271
วิวัฒนาการการฝากGFCการฝากแช่แข็งผลึกVitrificationแช่แข็ง,1,1271
มองการณ์ไกลพร้อมหน้ากรีนอัษฎาพรเอี๊ยดGenesisFertilityGFC,1,1271
เเล้วเ5555❤️❤️คัก,1,1271
"6,3356,3052,059,464",1,1271
ศูนย์อำนวยการศอ.ปส.,1,1271
ไอดอลนุ๊กซี่นุ๊กซี่คีโมเต้านมนุ๊ก,1,1271
สันดานแบล็คเฮดคบนุ๊กนุ๊กซี่เลิกกัน,1,1271
แบล็คเฮดสันดานเต้านมนุ๊กซี่แบล็คเฮด,1,1271
แบล็คเฮดควงหวานใจนุ๊กซี่ทุกซอกทุกมุมอุ่นใจ,1,1271
บังเกิดงกฏ,1,1271
พิมพิศาจิราธิวัฒน์,1,1271
กบง.ลดราคาดีเซล,1,1271
ภู่หัวหน้าศูนย์เฉพาะทาง,1,1271
ดับเบิลยูเอช(ฮู),1,1271
ฉมาดลพรรคพลังธรรมใหม่,1,1271
NFTBitcoinภาษาคน,1,1271
รับเชิญดาบคำเชิญกระทืบเท้าความเสียใจลิงโลดการต่างประเทศมนุษยธรรม,1,1271
ปรมัตถ์คลังแสงมหาสารคามตั้งกระทู้วาจาประชุมสุดยอดSummitDemocracy,1,1271
"28,20028,300ทองรูปพรรณ27,697.3228,800",1,1271
ปฏิบัติภารกิจซุ่มลัดเลาะภูมิประเทศ,1,1271
ภัชย์ชวาลกรมปศุสัตว์,1,1271
ดุลบัญชีเดินสะพัดเกินดุล,1,1271
อีเมลแอปเปิลไอโฟน,1,1271
รอดพ้นหวุดหวิดปลอกกระสุนปลอกมอเตอร์ร่อนพิบูล,1,1271
มือปืนนายกองค์การบริหารส่วนตำบลควนร่อนพิบูลเช้ามืดร่อนพิบูล,1,1271
เคลือบกรมการขนส่งทางบกวันทำการใช้ใบทะเบียนรถพนักงานเจ้าหน้าที่ทะเบียนรถเคลือบ,1,1271
กฆคู่มือทะเบียนรถบัตรประจำตัวประชาชนนิติบุคคลหนังสือรับรองนิติบุคคลหนังสือมอบอำนาจ,1,1271
แอมเนสตี้อินเตอร์เนชั่นแนลAmnestyInternationalพระมหากษัตริย์,1,1271
แอมเนสตี้อินเตอร์เนชั่นแนลAmnestyInternationalพระมหากษัตริย์แอมเนสตี้,1,1271
นพดลสิตพสกนิกรเสกสกลอัตแอมเนสตี้,1,1271
กำโลนลานสกา,1,1271
ปตท.ถือหุ้นถือหุ้นปตท.ดีเซลปตท.5.6เงินปันผล,1,1271
ตรละไบโอดีเซลตรละกลดปาล์มตรละภาษีสรรพสามิต5.99,1,1271
แม็ก์สสวีเดน,1,1271
สตง.กระจกเงาสลนนัทกระจกเงาตามเรื่องพอใช้ได้ผู้ด้อยโอกาส,1,1271
กนง.อัตราดอกเบี้ย0.50,1,1271
09.10คลังแสงมหาสารคามวิป,1,1271
เงินเฟ้อกนง.อัตราดอกเบี้ย,1,1271
พฤกษาณัฎฐธิดา,1,1271
กรมทหารราบมหาดเล็กวัลลภปลดอาวุธศักดินา,1,1271
ลาดตระเวนONLINEPATROLลาดตระเวนทลายสิ้นซากการกู้เงินความขัดสน,1,1271
YGEntertainmentต้นสังกัดBLACKPINKBLACKPINKร่วมวงเซ่ผู้ใกล้ชิด,1,1271
ตามหน้าที่การรายงานผลซ้ำซากครั้งก่อนการฝ่าฝืนสุ่มปราม,1,1271
CorporateExcellenceAward,1,1271
ความเป็นเลิศLeadershipExcellenceความเป็นเลิศ,1,1271
239ดุสิตคามสามเสนทับทิมกรุงธนบิตคาม,1,1271
โล่เชิดชูยลศูนย์รวม(ศปปส.ขับไล่แอม,1,1271
เมล็ดพันธุ์ษตกรปลายน้ำวลัยรดีเมล็ดพันธุ์เมล็ดพันธุ์ประสบผลสำเร็จ,1,1271
รอบคอบผู้รับผิดชอบสิระชั่งน้ำหนักเอาชีวิตความตาย,1,1271
ธาตุนายหน้าธัญนพอุ่ม,1,1271
ช่างภาพอนาจารปุ้ยTPN,1,1271
บุ๋มปนัดดานางงาม,1,1271
MissUniverseช่างภาพ,1,1271
