LCS,match,total_match
"98,4251,997441",1,1445
วัตฟอร์ดยูฟ่าแชมเปี้ยนส์,1,1445
เงินเฟ้อเฟดอัตราดอกเบี้ย,1,1445
ประโคนชนกฉ้อโกงเงินนร,1,1445
นัดดาโปรไฟล์ข้อมือ,1,1445
"80,499,612865462429406372295266",1,1445
สะเทือนคลับเฮ้าส์toxicคลับเฮ้าส์toxicเหยียด,1,1445
มวลอากาศแผ่แผ่ลมแรง,1,1445
2.30ฟันหลอพลัดยานนาวาสัมพันธวงศ์เรียงกระสอบทรายผุด,1,1445
"เจ๊ม้อยvplus""#",1,1445
แขนขาเดินเหินไม้เท้ามัวใช้การได้ความดีใจรับประกัน,1,1445
อุทกศาสตร์กองทัพเรือน้ำทะเล,1,1445
ตั้งเป้าหมายเซ็กซ์ครึ่งทางซุDailystarนินทาธุระกงการ,1,1445
ป.ป.ส.ซองซอง,1,1445
กู้เงินสร้างบ้านธกส.เหียะผู้รับเหมา,1,1445
นายหน้ายุ่งยากเครดิตบูโรนายหน้าแดด,1,1445
เจ็บช้ำน้ำใจจริงใจลวนลามจับมือถือแขนมาเหนือเมฆซอกแซกคนซื้อราคาขาย,1,1445
พุทไธสงปากคำ,1,1445
ปากคำร.ต.เดชาพุทไธสง,1,1445
ThisSpecialdayisveryimportantmecuz,1,1445
"1,99744119,703",1,1445
จัดเรียงกระสอบทรายวาดสัมพันธวงศ์น้ำทะเล,1,1445
วาดสัมพันธวงศ์น้ำทะเล2.30ฟันหลอเรียงกระสอบทรายวาด,1,1445
โหนกรรกำเนิดผู้ดำเนินรายการคืนดี12.35อีสาบ่,1,1445
icucvtหลาว,1,1445
สิ่งผิดกฎหมายยาบ้าเม็ดกัญชาจิตต์ผู้บัญชาการทหารบกเรื่องสำคัญเอาใจใส่,1,1445
ทหารประจำการทหารเกณฑ์115ผลัดมท210เศรษฐกิจพอเพียงกองทัพบก,1,1445
ผู้ชนะประมูลACTLetGetZoomการประมูลACT,1,1445
การประมูลACTDeFansFiผู้ชนะWalletAddressxbef,1,1445
งานศิลปะNFTจับต้องBALENCIAGABBCORPHOODIEMEDIUM,1,1445
"แล็บแพนด้าเนี่ย2,800",1,1445
HMrAmerishBeraอนุกรรมาธิการแพร่ขยายคารวะรับคำ,1,1445
ร่อยอาละวาดโจรกรรมชินตาละมุงวอนขอความเห็นใจล้างบาง,1,1445
ชาตะร้านเสริมสวยโจรกรรมสกุ๊ปปี้3927ร้านเสริมสวยเบาะ,1,1445
เทิ่ลแอ็คเซ็สคอมมูนิเคชั่นดีแทค,1,1445
"ฉินารายณ์ศูนย์อำนวยการ9,4938,959476อภิชัยกลุ่มก้อน",1,1445
แย้นนทพรไอดอล,1,1445
ผวาผีปอบคืนชีพดรธานผวาผีปอบเซียลภาพนิ่ง,1,1445
เงินอุดหนุนการยกเว้นภาษีเงินได้นิติบุคคลภาษีเงินได้บุคคลธรรมดา,1,1445
รอบรู้ทันโลกPBSSciTech,1,1445
ทวีปเอเชียเป็นเจ้าภาพGoldenFlySeriesPhuketFlySwatการจด,1,1445
เมธเมธโมโห,1,1445
คนไข้โรคศิลปะดุลยพินิจการตักเตือนโรคศิลปะ,1,1445
หมายศาลลายเซ็นค้ำประกัน,1,1445
"ขายทอดตลาดประมูล540,000",1,1445
เงินหมุนเวียนเท่าที่จำเป็นลดค่าใช้จ่ายรายเดือนเงินหมุนเวียนสายการบิน,1,1445
วาฬด้าจ๊ะเอ๋,1,1445
SHASHAการกีดกันไซส์จิ๋วหัวใจสำคัญหย่อนSHA,1,1445
วิโรจน์ลักขณาอดิศรSHAกีดกันวิโรจน์ล้มละลายใส่ร้าย,1,1445
เลี่ยนสำนักงานส่งเสริมเศรษฐกิจดิจิทัลดีป้างานหลักพวงมาลัยจริงใจนิทรรศการ,1,1445
พลโทสวราชย์แม่ทัพ,1,1445
ได้ประโยชน์การปฏิรูปกฎระเบียบการปฏิรูปภาคอุตสาหกรรมการกีดกันทางการค้าแข็งแกร่ง,1,1445
นิดนึงบุคคลที่สามคนธรรมดาดูหมิ่นเหยียดหยามดูหมิ่นเหยียดหยามผู้ใด,1,1445
เหยียดแพนแอ็กนต์แพนจกปลาร้าแพน,1,1445
ตามล่าแพนเหยียดแพนมึงเสียดสีเหยียดโดนัท,1,1445
ไมตรีนิโรธเลขาวิป,1,1445
กรุงธนขนาบพลัดอู่ต่อเรือสะพานปลาพระรามพระรามยานนาวา,1,1445
"98,4257,5926,743128711",1,1445
คล้องเสียงร้องหายใจไม่ออกซ้ำไปซ้ำมา14.23,1,1445
นรเจ๊กพิรุณประโคนประโคนประโคน,1,1445
ชนกประโคนชนกนรผ้าห่มพัดลมชนกคุมขัง,1,1445
ทธพลเนาวรัตน์ชนกนัดดาละมุงนรเจ๊ก,1,1445
เรียมลุกเป็นไฟเซ็ทลล์ๆ,1,1445
สาระล่ำซำ,1,1445
คาราโอเกะกันสาดฉีกขาดฉกรรจ์บาดปฐมพยาบาลรถกระเช้าบ้านสวน,1,1445
กฎหมายรัฐธรรมนูญ98คำพิพากษาตำแหน่งหน้าที่ต้องห้ามผู้ใดมิใช่เพิกถอน,1,1445
ขัดต่อพระราชบัญญัติประกอบรัฐธรรมนูญครอบงำ,1,1445
เขมาภิรกระสอบทราย,1,1445
กระสอบทรายเขมาภิร,1,1445
อังร.ต.ต.คายพรรคภูมิใจไทย(ภท.)เดโชโรจน์แนน,1,1445
แพนเหมาโหลแพนแพนคลับเฮ้าส์ให้ความร่วมมือขายตัว,1,1445
วิปวิปวิปทำเนียบฯวิปพร้อมเพรียงวิเชียรชวลิต,1,1445
นิโรธเลขาวิปวิป,1,1445
โภคภัณฑ์CPFญาณิญ์พุดพุดอาหารสดเนื้อหมู,1,1445
กุ้งก้ามกรามกุ้งกุ้ง,1,1445
"กังขาแล็บแพนด้า2,800ศรีริต้าตัดต่ออนาจารเรียกค่าเสียหาย",1,1445
รัชดาภิเษกไต่สวนมูลฟ้องตัดต่ออนาจารลามกอับอายลามกศรีริต้า,1,1445
ศักดิ์ศรีเอาเรื่องตัดต่อรูปหน้าโป๊ต้าศรีริต้าลิงก์,1,1445
ตัดต่ออนาจารเอาเรื่อง,1,1445
แพนเอาจริงเอาจังงมเข็มในมหาสมุทรได้ขนาดอีเมลไม่งั้นชื่อเล่นก็แล้วแต่,1,1445
ก็ดีก็ดีคลับเฮ้าส์ความแตกแยกมีวัฒนธรรมดีงามคลับเฮ้าส์บางท่าน,1,1445
ใช้แล้วความแตกแยกทะเลาะเบาะแว้งบูลเป็นส่วนใหญ่บิดเบือนเฟกนิวส์,1,1445
โคตรเหง้าพวกผมเพาะเชื้อไม่งั้นลัทธิเหยียดผิวการจลาจลเพาะเชื้อ,1,1445
บานปลายแพนเมื่อกี้พูดเล่นเห่าพื้นเพไม่งั้นความภูมิใจ,1,1445
เฮาส์ทอดกฐินขออภัย,1,1445
อิรักกรีนแบกแดดโดรน,1,1445
เนติกุหลาบปค,1,1445
แจ้งให้ทราบใบสมัครมีระเบียบนายทะเบียนแจ้งให้ทราบเนม,1,1445
คนไข้มะเฟืองพุทไธสงมึนเมาลื่นล้มเลือดกำเดาพุ,1,1445
เลี้ยวซ้ายทางบ้านดาวล้อมเดือนรูปพรรณสัณฐานเสื้อแขนยาวกางเกงยีนส์สีเข้ม,1,1445
นิโรธกระทู้ถามองค์ประชุมกระทู้ถามให้ความร่วมมือกระทู้ถามรับปากกระทู้ถาม,1,1445
กระทู้ถามนิโรธเลขาวิปพรรคร่วมรัฐบาลวิปวิปร่างกฎหมาย,1,1445
หลานสาวความตกใจความตกใจลูกเขยกระสุนปืนเกลื่อนเป็นครั้งคราวอุไร,1,1445
มอเตอร์RevoLeagueMeetpressมาสด้า,1,1445
"ธ.ก.ส.ธ.ก.ส.13,225ขาดทุนตกต่ำ",1,1445
ช่องโหว่เจ้าของที่ดินจุดอ่อนน้ำท่ากระทุ่มน้ำทะเลเอ่อหนักหน่วง,1,1445
"865405,55646250,85142919,61840640,435",1,1445
สื่อลามกค่าเสียหายเรียกค่าเสียหายจำเลย,1,1445
เสื่อมเสียชื่อเสียงแล้วด้วยตัดต่อ,1,1445
ศรีริต้าเบิกความคดีอาญาตัดต่อ,1,1445
"ยาเม็ด""แพ็กซ์วิด",1,1445
อวกาศอวกาศอวกาศ,1,1445
มัยอ๊ะหมัด,1,1445
ชกต่อยอ๊ะหมัด,1,1445
อ๊ะหมัดคำรับสารภาพ,1,1445
ธัญกัญชาปัสสาวะ,1,1445
มัธยมปลายเคลมประถมไม่งั้นนึกดูอ่านหนังสืออ่านหนังสือเวลาว่าง,1,1445
อ้อมกาวสองหน้าเหนียวแนบอ่านหนังสือLiveถูกกัน,1,1445
ธนาคารเพื่อการเกษตรและสหกรณ์การเกษตรความผิดปกติปิยะสุทธ,1,1445
ฉิ่งหมัดส.ว.,1,1445
เสียชื่อเสียงดูหมิ่นเกลียดชัง,1,1445
วีรชนช.ภ.เทคโนโลยีสารสนเทศแกะรอยเบอร์โทรศัพท์ง่ายดายสมัยนี้ธุรกรรม,1,1445
"ไลค์ค่าตอบแทนโค้ดที่แจ้งค่าตอบแทน1,800ตอบแทน3,600",1,1445
parttime-กรอกประจำตัวเบอร์โทรศัพท์เจ๊มะลิลิงค์,1,1445
น้ำทะเลพลเรือโทกฤชมะลิเจ้ากรมอุทกศาสตร์น้ำทะเล,1,1445
พารามอเตอร์พาราลนอุลตร้าไลท์โอกาสดีพารา,1,1445
แฉล้มความชื่นชอบพารามอเตอร์เรื่อยยุงฟิลด์ยุง,1,1445
ผู้ประกันตนเงินสมทบเจ็บป่วย,1,1445
แอฟริกาใต้อิหร่านบราซิล,1,1445
ฉ้อโกงเงินนร,1,1445
โหล//กำหมัดจ้ะคลับเฮ้าส์toxicทวิล่ง,1,1445
ชนกนัดดาตุ้ม203โตนดต้มตุ๋น,1,1445
ดาวพฤหัสทศพรราศีเฮงส่งท้ายราศีจัดอันดับราศี,1,1445
429163ดารณีเดลตา,1,1445
ประโคนประโคนประโคนประโคนชนกฉ้อโกงเงิน,1,1445
ชนกนัดดาตุ้ม203โตนด,1,1445
นรเจ๊กพิรุณ103ประโคนประโคนประโคนประโคน,1,1445
"Walk-in7,592529",1,1445
คนซื้อเจ๊กร่วมชีวิตปลง,1,1445
เจ็บช้ำน้ำใจจริงใจลวนลามจับมือถือแขน,1,1445
บัญชีเงินฝากนักข่าว3.9241.39,1,1445
"""𝑩𝒂𝒃𝒚𝒂𝒍𝒍𝑰𝒏𝒆𝒆𝒅𝒊𝒔",1,1445
รันทำทีแขวนคอตื่นตระหนกผกาหึงหวงนอกใจมีเหตุผล,1,1445
น้ำทะเลน้ำทะเลกระสอบทราย,1,1445
มีดพร้าสุพรรณเกื้อ,1,1445
คลับเฮ้าส์toxicคลับเฮ้าส์เหยียด,1,1445
วัตฟอร์ดผลสรุปปืนใหญ่อาร์เซน่อลเฉือนแตนอาละวาดวัตฟอร์ด,1,1445
นักบินอวกาศอวกาศยาน,1,1445
เสินโจวอวกาศ,1,1445
แผ่ลมแรงรักษาสุขภาพหนาวเย็น,1,1445
ฝากขังพรานกระต่าย,1,1445
สุวณีบัณฑิ,1,1445
ให้สีผู้ออกแบบASAVAผ้าไหมผ้าห่มกากะญอภูมิปัญญาชาวบ้าน,1,1445
ฝีหัตถ์ลายพาดกลอนสีน้ำตาลฝันหวานไอศกรีมของโปรดในไม่ช้า,1,1445
มีดพร้ามีดพร้าเพ็ญ,1,1445
Quarantineเจ้าพนักงานหัวหน้าศูนย์ผู้ใดระวางโทษปรับ,1,1445
สตันวิลล่าดีน,1,1445
ผงาดสตันวิลล่า,1,1445
ยธ.กระทรวงยุติธรรมดูแลรักษาผู้ต้องขังให้หาผู้ปฏิบัติงานจากกันปนเปื้อน,1,1445
"711(พบ679ผู้ต้องขัง105กรมราชทัณฑ์5,61887.8",1,1445
พารามอเตอร์พาราลนอุลตร้าไลท์พารามอเตอร์,1,1445
เจ๊กประโคนนัดดา,1,1445
รร.คำสร้อยพิทยาสรรค์เปิดเรียนไซต์,1,1445
สรรพากรสารนิเทศสรรพากร,1,1445
วหาธนาคารเพื่อการเกษตรและสหกรณ์การเกษตรธ.ก.ส.,1,1445
เหมืองแร่ห้วยน้ำขาวบ้านเก่า,1,1445
"2,4652,3341,3761,258906905สวิตเซอร์แลนด์838",1,1445
"7,5927,49598,425",1,1445
เเน่ๆ#เเหม่หมิว,1,1445
วิดกรมการแพทย์ผลวิจัย,1,1445
สปาเก็ตตี้ไรเดอร์,1,1445
ศรีริต้าควงขึ้นศาล,1,1445
"ชักพระทวีวัฒนาทวีวัฒนาตลิ่งชันบางแคพิทยาณ์,ตลิ่งชัน",1,1445
ลพิเม็ดคอร์สแพกซ์วิดกรมการแพทย์ผลวิจัยกรมการแพทย์,1,1445
แพทยศาสตร์รามาธิบดีมหาวิทยาลัยมหิดล,1,1445
ผู้รับเหมาปิยะสุทธ,1,1445
เต็งจุดอ่อนจุดแข็งกองหลังตูเญซแข็งแกร่งคำวิจารณ์,1,1445
ตำรวจจราจรคุณยายเชี่ยวกราก,1,1445
อัลเบิร์ต“แพ็กซ์วิด,1,1445
“แพ็กซ์วิดPaxlovid,1,1445
หม่ำจ๊กมก”นิ่มเหยียดพวกผม,1,1445
โง่ต่อปากต่อคำคนซื่อไม่เป็นไรตามนั้นตามสบาย,1,1445
โต้งอภัยเหยียด,1,1445
โคลข่าวลือซุ่มคบฝึกหัด,1,1445
รอบเดือน9.00AISaisvaccineTRUEUSSD707,1,1445
SinovacSinovacSinopharmSinopharmSinovacSinopharmSinopharmSinovac,1,1445
ไทม์Molnupiravirแพกซ์วิดPAXLOVID,1,1445
ประเทศพัฒนาแล้วModernServicesภาคอุตสาหกรรมตัวอย่างเช่นภาคอุตสาหกรรมมูลค่าเพิ่มสินค้าส่งออก,1,1445
ดีนเซาธ์แฮมป์,1,1445
เหยียดคลับเฮ้าส์toxicพุง,1,1445
แม่ปะทางลงตัวต่อแม่ปะการผลักดันP-NETประพจน์แม่ปะ,1,1445
แม่ปะเขตแดนลวดผู้สังเกตการณ์ผู้บริหารท้องถิ่นแม่ปะเงินอุดหนุนเก็บภาษี,1,1445
แพกซ์วิดPAXLOVIDสเปกยาเม็ด์ค”,1,1445
เก็บภาษีกรมสรรพากรเก็บภาษี,1,1445
สตาร์ทอัพสตาร์ทอัพ,1,1445
ความอาลัยรามาโกร่งความเสียใจรามา,1,1445
ธิติพนธ์กศน.,1,1445
เฮียเชียงของวสันต์หอศิลป์กวางเจาวสันต์งานศิลปะเรือประมง,1,1445
ก่อนเวลาssjnonthaburinontlinkเวลานัดหมายเวลานัดหมายSocialDistancing,1,1445
อวกาศไจ๋จื้อกัง,1,1445
ชันสูตรคืนให้พิธีทางศาสนา,1,1445
กอหญ้าฉ่าโกรก,1,1445
บุตรชายอุปกรณ์การเกษตรSUVคู่ใจ,1,1445
22.30มดป่อเต็กตึ๊งแกะรอยพระรามให้เช่า,1,1445
กักกันข้ามชาติข้ามชาติข้ามชาติข้อแนะนำเครื่องใช้,1,1445
ลำคอคล้องเสียงร้องหายใจไม่ออกซ้ำไปซ้ำมา14.23,1,1445
คู่ผสมป้อเดชาพัวเคราะห์,1,1445
วันข้างหน้ามวลอากาศแผ่ลมแรงข้อควรระวังรักษาสุขภาพหนาวเย็นเสี่ยงภัย,1,1445
ธ.ก.ส.ออฟไลน์ธ.ก.ส.โลตัสธ.ก.ส.โลตัสOnlineBusiness,1,1445
ธ.ก.ส.โลตัสโลตัสโลตัสรามอินทราวลัยธนาคารเพื่อการเกษตรและสหกรณ์การเกษตรธ.ก.ส.,1,1445
ประกอบการSHASHAClinicลานจอดรถสำนักงานใหญ่เทวีวันหยุดราชการ,1,1445
ดิเรกSHAเสียโอกาสเอื้อประโยชน์เท่าเทียมกันสิ่งใดโดยทันทีSHA,1,1445
มหกรรมสินค้านำเข้าCIIE,1,1445
"1287111,975,5917,4951,857,46398,4251,997441",1,1445
อวกาศนักบินอวกาศอวกาศ,1,1445
อวกาศยานอวกาศนักบินอวกาศ,1,1445
วาดกระสอบทรายกระสอบทรายน้ำทะเลฟันหลอขออภัยทุก ๆจัดเรียง,1,1445
เรือบรรทุกเครื่องบินเรือพิฆาตขีปนาวุธนำวิถี,1,1445
"ความตกลงRCEPRCEPภาษีนำเข้า39,36629,891ภาษีศุลกากรFTA",1,1445
"ความตกลงRCEPความตกลงFTAFTAนิวซีแลนด์2,30030.2",1,1445
ความตกลงRCEPรับประโยชน์ความตกลงเกี่ยงข้องการประสานงานกรมศุลกากร,1,1445
มนให้สัตยาบันความตกลงหุ้นส่วนRCEPประเทศสมาชิกRCEPให้สัตยาบัน,1,1445
"สุขศึกษาความรอบรู้ความอนุเคราะห์56,267ทันตแพทย์อาคมประดิษฐเป็นส่วนใหญ่",1,1445
เบรียลซุคทเกลโบราณคดีปอมล้ำค่า,1,1445
วีจิป๊าร๊ากง่า,1,1445
สติคส์เท่าตัวสติคส์KerryLogisticsNetwork,1,1445
เพิ่มขนาดscalableหารายได้Tradeableส่วนสำคัญInnovationModernServices,1,1445
TECHGoodนิสิตนักศึกษาประกาศนียบัตรเว่ยไอซีรู้เชิงหาไม่,1,1445
ประเทศพัฒนาแล้วตัวอย่างเช่นITProfessionalBusinessServicesประเทศกำลังพัฒนาตามหลัง,1,1445
ธรรมะทิณลูกวัดจำปาสีหราชงวยปอบอาตมา,1,1445
กรุงธนน้ำทะเลพระรามฟุตบาธ,1,1445
สิรินธรเลี้ยวจรัญสนิทวงศ์พระรามพระราม,1,1445
กรุงธนสิรินธรเลี้ยวจรัญสนิทวงศ์พระรามพระราม,1,1445
สหประชาชาติกลาสว์,1,1445
"80,484,42765.44บลูมเบิร์กSmartEntry",1,1445
ภัยแล้งล้มตายขาดสารอาหาร,1,1445
ละมุงนรเจ๊กพิรุณ103ประโคนประโคนประโคน,1,1445
09.07น้ำทะเลพระรามขาออกพระรามฟุตการจราจรติดขัดช่องลม,1,1445
ประโคนประโคนประโคนชนกฉ้อโกงเงินประโคนชนก,1,1445
นรเจ๊กพิรุณ103ประโคนประโคนประโคน,1,1445
โอ่งเคลือบสมุทรสงคราม,1,1445
MEAMEABetterCareServiceMEABetterCare,1,1445
ผลวิจัยแพกซ์วิด,1,1445
103ประโคนประโคนเจ๊กนรประโคนนางรองตึกแถว,1,1445
นรพิรุณเจ๊กตะโกประโคนประโคนชนกนัดดา,1,1445
พ่อเลี้ยงตำรวจจราจรชนม์ชนกฤตชนม์4003แมกกาซีน,1,1445
ป้านกาญจนาทหารพรานอยู่กินพ่อเลี้ยงพ่อเลี้ยงบ่าวทางใต้,1,1445
แก้มลำตัวปลอกกระสุนปลอกกาญจนาเปื้อนแท้ๆชนม์,1,1445
บรรจบกุมวิมล107สมภพสวป.ชั้นเดียวคอนกรีต,1,1445
MEABetterCareServicemeaminisitebettercareservice2878,1,1445
497340003626475posts5180172898676472/?dntwittermea,1,1445
วิทยาทานอุทาหรณ์มีสติ,1,1445
