LCS,match,total_match
กลุ่มชาติพันธุ์ชาวเลตื่นตัวหน่วยเลือกตั้งแกน,2,1695
ฉอดเหมือนว่าบอกเลิกปล่อยโฮแต่ละครั้งอึดอัดเป้าสายตา,2,1695
จากนั้นมาอินเตอร์Divaแถวหน้าแขกรับเชิญClubFridayShow,2,1695
ถ้ำนาคีถ้ำนาคานำทาง,2,1695
กัญชากัญชากัญชา,2,1695
การผ่าสถาบันนิติเวชศรีนครินทร์แพทย์ศาสตร์มหาวิทยาลัยขอนแก่นการตายปากคำการตาย,2,1695
กันทรมหาสารคามผูกคอตาย,2,1695
มิใช่ผู้ขับขี่ที่จอดรถที่จอดรถเครื่องหมายหมายความยานยนต์,2,1695
ค่ารักษาพยาบาลเครื่องอุปโภคบริโภคเครื่องครัวดัดแปลงเงินสนับสนุนอนุบาลปริญญาตรีน้ำทะเล,2,1695
ธปท.แบงก์KPI,2,1695
กองทัพอากาศอธิปไตยความคุ้มค่า,2,1695
ธนบัตร20062006ธนบัตร,2,1695
newnormalnextnormalเป็นผลดีวัณโรครู้ทางสะกด,2,1695
สิรพฤกษชาติสำโรงเหนือ2550สวมรอยAccount,2,1695
พญ.มิ่งขวัญษฐโรคผิวหนังกรมการแพทย์เจ็บป่วยผลัดผลัด,2,1695
หมัดส.ว.สําวุฒิสภาส.ว.วุฒิสภาจรุงจรุง,2,1695
2501ศาสนศาสตรบัณฑิตนายร้อยนิติศาสตรบัณฑิตมหาวิทยาลัยรามคำแหงศาสตร,2,1695
อัลบั้มทั้งเมืองอัลบั้มถล่มทลายโหดร้ายเต๋อเกลียดไฟล์,2,1695
MQDCการเข้าสู่Fintechอสังหาฯเวิลด์คลาสฟอสเทียส์,2,1695
น้ำทะเลน้ำทะเลหนังสือรับรอง,2,1695
ลอยกระทงลอยกระทงลอยกระทงลอยกระทง,2,1695
ศีขรขี่ม้าแนะนำตัวสโลแกนเด่นชัดเริ่มใหม่เสียเวลาทำงานต่อ,2,1695
แวแวโอะ,2,1695
ลาภวิไลซิปเม็กMQDCผู้พัฒนาเวิลด์คลาส,2,1695
SelfServiceRepair,2,1695
USDTUnitedStatesDollarTetherดอลลาร์สหรัฐUSDCUnited,2,1695
ผู้รับเหมาเบี่ยงกฎระเบียบแต่ไกลไถลตรงดิ่งหลับในปรี่,2,1695
ห้วงเวลา(กนช.)แผนงานการรับรู้สทนช.แผนงานสำนักงบประมาณสทนช.,2,1695
อัปโหลดแนบผัดผ่อนชำระบุคคลธรรมดาบัตรประจำตัวประชาชนนิติบุคคลหนังสือรับรอง,2,1695
MEAe-Serviceeservicemeaผ่อนชำระค่าไฟฟ้าผัดค่าไฟฟ้า,2,1695
ทองเปลวเป็นเกียรติจอมเกล้าการลงนามการส่งเสริมการเกษตรกรมส่งเสริมการเกษตรการประมงกรมประมง,2,1695
MOUความเปลี่ยนแปลงมูลค่าเพิ่มกระทรวงเกษตรฯAgritechInnovationAICMOU,2,1695
รถเมล์เต๋าเข็มกลัดรับหน้าที่พุฒิKINGSศิษย์เก่าอาชีวะ,2,1695
งานวิชาการการประมงทางวิชาการการประมงโครงการวิจัยการประมงการประมงเพาะเลี้ยงสัตว์น้ำ,2,1695
"ลูกหนี้ลูกหนี้หนี้เสียNPLลูกหนี้22,01168,071เงินต้น",2,1695
การแถลงด้านการบริหารมหาสมุทรประเทศสมาชิกแหล่งเงินทุนมหาสมุทรจตุพรบุรุษ,2,1695
ลูกหนี้ชำระหนี้ค่างวดลูกหนี้ลูกหนี้ปรับโครงสร้างทางไปรษณีย์ลูกหนี้,2,1695
รังแต่มีสติปัญญาใครก็ได้,2,1695
ส.ว.จรุงพล.อ.อ.มนัสขจรเสนาธิการหมัดส.ว.,2,1695
วิปวิปทักท้วงส่งกลับ,2,1695
ความเป็นมนุษย์ศักดิ์ศรีความเป็นมนุษย์ศาลรัฐธรรมนูญ,2,1695
เสี่ยโจ้ประสบอุบัติเหตุ,2,1695
ทางพิเศษมหานครขาเข้า,2,1695
ผู้ต้องขังนักโทษนักโทษ,2,1695
อ้นข.ช.พุทธรักษาข.ช.มะลิข.ช.ธาดาข.ช.,2,1695
โจโฉทรงธรรมปป,2,1695
ข.ช.ข.ช.ลัทธพลข.ช.ณัฐกู้ยืมข.ช.ว,2,1695
คะแนนเสียง473206,2,1695
ติ้งCOVIDFreeครอบจักรวาลUniversalPreventionผู้จัดงานโคมลอย,2,1695
กวดขันอนุบาลขุ่นรถตู้การตรวจวัดรถตู้การสลับ,2,1695
รถตู้รถตู้กวดขันอนุบาลขุ่น,2,1695
ติ้งCOVIDFreeครอบจักรวาลUniversalPreventionลอยกระทงกระทง,2,1695
ธัญนิตย์ผู้ว่าการธปท.ธนาคารพาณิชย์ประกันภัยธปท.ธปท.,2,1695
วิบูลย์แอมททบลู,2,1695
MQDCZipmexสินทรัพย์อสังหาฯเวิลด์คลาสMQDCBTC,2,1695
ผู้สนับสนุนรวมทั้งหมด103สารเสพติด,2,1695
"เจ้าภาพกฐินกฐินรวมทั้งหมด231,702พระนอนความบริสุทธิ์ใจหลวงตา",2,1695
"ประดิษฐ์74หลักเขตกล่าวย้ำเจ้าภาพ131,702กฐิน231,702",2,1695
กฐินเจ้าภาพกฐิน,2,1695
ขนส่งสินค้าสหพันธ์เดินรถลดราคาดีเซล,2,1695
ก่อนอื่นขออภัยกิริยามารยาทจุดยืนใจจริง,2,1695
โจโฉรับคำท้า,2,1695
"1,74240620,254",2,1695
รัชดาภิเษกสหเจียรเสี่ยโจ้น้ำมันเชื้อเพลิงดีเซลเสียภาษี,2,1695
เห็นใจฟอกเงินองค์ประชุมกรรมาธิการเครื่องสำอางองค์ประชุมองค์ประชุมพรรคร่วมรัฐบาล,2,1695
คริสโตเฟอร์UnitedStatesSecretServiceปลอมแปลงธนบัตรการโกง,2,1695
คริสโตเฟอร์ห์ดี้MrChristopherRohdeทูตUSecret,2,1695
หอพักบัวโรยเสาธงเสาธง,2,1695
เนาวรัตน์มณเฑียรพิศาลณว,2,1695
ผลักแสดงออกอัลบั้มหม่าเครื่องเล่นซีดีอัลบั้มหลานชายหม่า,2,1695
ธนบัตรธนบัตรกระดาษธนบัตรของจริงกระดาษธนบัตรเครื่องซักผ้า,2,1695
ธนบัตรธนบัตรของจริงของปลอมเปลี่ยนสีปลอมแปลงของจริงธนบัตร,2,1695
บุ๋มปนัดดาแซะกลิ่นตัว,2,1695
ทางเทคโนโลยีท.)โสภาอธิปพิเชษฐ์ภี.ปอท.เข็มกลัด,1,1695
สกายวอร์สี่แยกราชประสงค์การปราศรัยพาดพิงเสื่อมเสียรับฟังได้,1,1695
"sso2,5001.2",1,1695
ภูริช.กวิศาลศุขรองเลขาธิการพุฒิสถิตย์รองเลขาธิการ,1,1695
พรีเมี่ยมอุตสาหกรรมท่องเที่ยวสายการบินรถเช่าโปรโมชั่น290บูธคูปอง,1,1695
เผื่อนพิภพอุตสาหกรรมท่องเที่ยวนิทรรศการTCEBแบงก์เซาท์อีสต์,1,1695
TTAAมหกรรมพรีเมี่ยมInternationalTravelFairTITFเผื่อน,1,1695
EnergyEnergyชนะเลิศASEANEnergyAwardZeroEnergy,1,1695
Energyโซลาร์ตรอนSOLARอุทัยCMOส่งข่าวอัพเดต,1,1695
ถ้ำนาคาถ้ำนาคีลังกาของเหลวน้ำอบราด,1,1695
ก้มมุดหมดแรงแช่ช่วยชีวิต,1,1695
กองปราบเสี่ยโจ้เจ้าพ่อ,1,1695
NอหยวนอดใจพสุกระทรวงยุติธรรมNหยวน,1,1695
จุฬาภรณ์บุคคลธรรมดาจุฬาภรณ์CATConventionHall,1,1695
ZOOMปราโมทย์ยาใจหม่อนสถาพรอารีกรมพัฒนาที่ดินกสิกรรม,1,1695
บ่วงกปปส.,1,1695
SustainableUrbanAgricultureDevelopmentProjectSUADProjectการธนาคาร,1,1695
ศาลปกครองกรมธนารักษ์การลงนามเมื่อใดกรมธนารักษ์,1,1695
ราชพฤกษ์เรือนกระจกGreenMOUองคาพยพตั้งเป้าหมายสวนครัวอาคารชุด,1,1695
"TambomSustainableAgricultureDevelopmentProjectTAP7,255เทคโนโลยีสมัยใหม่",1,1695
ปัทสมาคมการค้าพืชเศรษฐกิจความน่าสนใจเครื่องสำอางจุดมุ่งหมายการนำพาฮับ,1,1695
ฮับกัญชากระท่อมพลิกัญชากระท่อมศาสตร์ศาสตร์,1,1695
ดีเซลสตางค์ดีเซล,1,1695
ดีเซลพรีเมี่ยมคงเดิม05.00,1,1695
กระจุกตื่นนอนตอนเช้าหมอนเสยติดมือ,1,1695
ทัตไบร์ทภูติกชกรงานแต่งควงสมกัน,1,1695
จิตต์ไพ่กรมสรรพสามิตปรอทไข้เครื่องวัดนิ้วมือกรมสรรพสามิต,1,1695
อภิบาลนอบน้อมชนชาตินอบน้อมเถิด,1,1695
ปลาร้าแพลนเต็มตัว,1,1695
สลากกินแบ่งรัฐบาลประดิษฐ์กระทง,1,1695
สิรินธรWalkInStudentWalkIn,1,1695
ทรูขานรับกสทAstraZenecaPfizerSinovacSinopharmริเวอร์,1,1695
พฤติธุรกรรมธุรกรรมตามเงื่อนไขส่อผู้ต้องสงสัยนายหน้าแอพ,1,1695
"6,4233191442,044,1251,933,19990,6721,742406",1,1695
.ทท.ท่าอากาศยานสุวรรณภูมิณิศาปัญาชื่อเล่นแอมมาติกา,1,1695
"สตช.กวาดล้างโคโรน่ากวดขันช.ทท.,อรัญ์,เศรษฐ์",1,1695
รีเทิร์นPartปวส.โรงเรียนเอกชนบดินทร์ปวส.,1,1695
ยื่นฟ้องศาลปกครองยื่นฟ้องกรมธนารักษ์คล่องตัว,1,1695
โกลบอลTPNGLOBALประกวดนางงามปิศิกพลตำรวจโทกฤษณ์,1,1695
ฎีกาณณะพศศาลยุติธรรมรัชดาภิเษกอนุกรรมการนับคะแนนตุลาการ,1,1695
เรือดำน้ำกองทัพเรือทร.รถถัง,1,1695
กิตติ์เพ็ชร์การบังคับบัญชากิตติ์เพ็ชร์ธัชนายร้อยอิทธิ,1,1695
ศาลแขวงพระนครเหนือศาลแขวงพระนครเหนือโจทก์ยื่นฟ้องลาดพร้าวจาด,1,1695
ปล่อยชั่วคราวจำเลยจำเลย,1,1695
ATMเชื้อเพลิงเต็มกำลังความสุภาพลอยกระทงยึดหลักข้อแนะนำดอกไม้เพลิง,1,1695
รำคาญดอกไม้เพลิงโคมลอยแอบแฝงประทุษร้ายทุก ๆผู้ปฏิบัติการอำนวยความสะดวก,1,1695
กลบเว่ยป๋อ,1,1695
ปรังเผลสังข,1,1695
ซูเปอร์สตาร์มาร์เก็ตติ้งการรับรู้JKNJKNHiShoppingค้าปลีก,1,1695
กรมธนารักษ์ยื่นข้อเสนอบริษัทเอกชนดำเนินกิจการกรมธนารักษ์,1,1695
..)พุทธศักราช....,1,1695
อติรัชตจรูญฝ่าฟันศิคความเอาใจใส่จริงใจSIKARIN,1,1695
เป็นคดีรัฐประหารลาดพร้าวโดยส่วนตัวSCB,1,1695
เจ้าภาพกฐินเจ้าภาพ,1,1695
หลักเขตกฐินเจ้าภาพ,1,1695
ลอยกระทงกรอกกระทงการกรอกอ่อนไหวปีเกิดน่าเชื่อถือหวังดี,1,1695
"ยอดเงินกฐิน231,702",1,1695
"เจ้าภาพกฐิน131,702",1,1695
GovernmentPlatformPDPAComplianceGPPCระดับชาติ2580ประเมินผล,1,1695
กรมธนารักษ์ผู้ชนะEASTWATER,1,1695
ศาลปกครองศาลปกครองกรมธนารักษ์การลงนาม,1,1695
จรุงภุม2501ศาสนศาสตรบัณฑิตนายร้อย,1,1695
มหาบัณฑิตมหาวิทยาลัยธรรมศาสตร์2550รองเลขาธิการการปฏิรูป(สปท.,1,1695
จรุงพล.อ.อ.มนัสขจรเสนาธิการหมัด,1,1695
แอดมินกิตติ์แอดมินพัชรรพีคินวลัญช์เข้าพบ,1,1695
ศิคก้าวหน้าSIKARINWayความใส่ใจความจริงใจสโลแกน“ศิค,1,1695
จัดรูปแบบปีการศึกษาพ.ยความแออัดมัธยมปลายไซต์มัธยมต้นก๋วยเตี๋ยว,1,1695
รศ.ดร.เฉลียววิทูรปกรณ์อีสเทิร์นลีเมอร์กรุ๊ปEPG,1,1695
ก้าวหน้าษฐ์สินธุผู้ก่อตั้งก้าวหน้า,1,1695
"86,890,826819,319301,736462,42955,154",1,1695
HLลทิเนสHealthinessCompanyLimitedถือหุ้นคิดค้นว่าจ้าง,1,1695
159วรรค193193256269270271,1,1695
สมภพบริษัทหลักทรัพย์ฟินันเซียรัสเสนอขายหุ้นสามัญIPOลท์,1,1695
ผู้ต้องขังนักโทษแหกคุกข.ช.ข.ช.ลัทธพลข.ช.ณัฐกู้ยืมข.ช.ว,1,1695
กฎกระทรวงBuildingEnergyCodeBECสถานพยาบาลสถานศึกษาอาคารชุด,1,1695
BuildingAutomationSystemBASน้ำเย็นChillerPlantManagement,1,1695
นิวส์ปั่นป่วนก่อนเที่ยงล้อมสนทนาขอลาครูผู้สอนรับโทรศัพท์,1,1695
โยธินประชามติมุสลิมเบตงภ้ยมุสลิมเบตงPPE,1,1695
โค้งสุดท้ายกระพริบตากระเช้าสีดาถึงกัน,1,1695
ฝังศพพิธีการศาสนาอิสลามสุสานแตตูแงน้ำทิพย์,1,1695
"28,85028,750ทองรูปพรรณ",1,1695
"24,487ตารางเมตรความโปร่งโล่งรังสีดวงอาทิตย์แดดฉนวน",1,1695
โคมเป็งลอยกระทง,1,1695
ณัฏฐ์จริตษีอุกฤษเบรียลอาชีวะพุฒิ,1,1695
โคมชักโคมแขวน,1,1695
คู่ชีวิตวิปวิปทักท้วงส่งกลับกระทรวงยุติธรรมวิปร่างกฎหมาย,1,1695
พฤกษ์อุ่มเม้าอนุกรรมาธิการกลั่นกรองไล่ล่า,1,1695
มอเตอร์เวย์หลักกิโลเมตรขาเข้า,1,1695
....83ร่างรัฐธรรมนูญประกาศใช้,1,1695
"เด็กยากจนด้อยโอกาสด้อยโอกาสสามัญ3,900สถานศึกษาสมรรถนะศตวรรษ",1,1695
สถานศึกษาสช.ความเสมอภาค(กสศธกสด้อยโอกาสด้อยโอกาส,1,1695
(วดุสิตโพลดุสิตลอยกระทง,1,1695
"ษฐ์สินธุ135,257",1,1695
673205รวมทั้งหมด878,1,1695
วิงวอนป.ป.ช.จงใจ,1,1695
เจ้าท่าแพทสเตเดียมแรบบิท19.00เจ้าท่าอู๊ดรวด,1,1695
ระโนดระโนดทะเลสาบคาบสมุทรสทิงพระเครื่องสูบน้ำทะเลสาบเครื่องสูบน้ำ,1,1695
พรรคร่วมรัฐบาลพ.พ.แปรญัตติกรรมาธิการร่างกฎหมายเอกภาพแย้ง,1,1695
ร่างรัฐธรรมนูญ..)พุทธศักราช,1,1695
ขนุนขนุนุทวายหนาขนุนชิมขนุน,1,1695
ราคาขายปลีกดีเซลสตางค์,1,1695
บุ่งขี้เหล็กแวงเขม,1,1695
"45,5473,02144,383เบตง318334,70161.08266,802",1,1695
"เบตงเบตง794,726เนื้องอกไข้พิธีทางศาสนาเบตง",1,1695
สุริยนพัชรครุรองเลขาธิการสำนักงานการปฏิรูปที่ดินเพื่อเกษตรกรรมส.ป.ก.,1,1695
ฉาบฉวยชาวนาได้ประโยชน์หล่นจำนำล้อมความภาคภูมิใจ,1,1695
สุริยนพัชรครุรองเลขาธิการ,1,1695
วิตามินสังกะสีไบโอตินวิตามินมีส่วนช่วยผลัด,1,1695
เสมอภาคศักดิ์ศรีความเป็นมนุษย์ศักดิ์ศรีความเป็นมนุษย์ศาลรัฐธรรมนูญบทบัญญัติก็ต่อเมื่อ,1,1695
เคมีบำบัดให้ยา,1,1695
อีเมลเผิงฉ่วย,1,1695
อีเมล“เผิงฉ่วย”ปฏิเสธข่าวฉาวล่วงละเมิด,1,1695
ยางพาราปาล์มข้าวโพด,1,1695
ลอยกระทงสวนสาธารณะลอยกระทง,1,1695
เปิดไฟ19.0024.00ทัศนียภาพตามเวลาตรวจตราลอยกระทง,1,1695
เบรนร็อด์ส,1,1695
มาดามล่ำซำ,1,1695
โฆษณาชวนเชื่อสถานทูตทุบตีทารุณละแวกปทกคนเข้าเมืองการพา,1,1695
ปรมัตถ์มนุษยธรรมอ่อง,1,1695
ปาล์มได้ราคาตรึงราคาการถม,1,1695
ก๋วยเตี๋ยวไต้หวันก๋วยเตี๋ยว,1,1695
ลอยกระทงข้อห้ามลอยกระทงโทษหนัก,1,1695
แต่ไกลไถลตรงดิ่งหลับใน,1,1695
เสี่ยโจ้แย้งเสี่ยโจ้ฟอกเงินล่องหน,1,1695
กริชธาดาลัทธพลฉ่ำมะลิพุทธรักษาธิปอุทัย,1,1695
ป๋อจางเกา,1,1695
สตีฟม่อนซีอีโอนักเทนนิสWTAอีเมล,1,1695
เสาวลักษณ์วิลัยบลจ.เอ็มเอฟซี,1,1695
เบนซิน39.46แก๊สโซฮอล์32.05แก๊สโซฮอล์,1,1695
รัชดาภิเษกไต่สวนคำร้องขอเพิกถอน,1,1695
จำเลยปล่อยชั่วคราวจำเลยจำเลย,1,1695
"WTA""เผิงฉ่วย""เมลแฉ",1,1695
กรมการแพทย์astrazenecaPfizerastrazenecasinovacริเวอร์โกดัง9.00,1,1695
ซอลต์เบลอนดอน,1,1695
คู่ชีวิตวิปวิปทักท้วงส่งกลับวิปสมัยประชุมประมวลกฎหมายแพ่งและพาณิชย์,1,1695
"บอร์ด""คล็อปป์""ช็อปปอนด์",1,1695
"6,4233191442,015,262",1,1695
น่าสงสัยผู้ต้องขังแหกโพธ,1,1695
สถานีรถไฟลำโพงสถานีรถไฟ,1,1695
“ขอลำโพงฯ”ก่อกำเนิด,1,1695
ร่วมสมัยศูนย์รวมรัตนโกสินทร์เนมสถาปัตยกรรมพิพิธภัณฑ์LifeMuseum,1,1695
มือบอนน้ำอบลังกา,1,1695
SelfServiceRepairแอปเปิล,1,1695
ปล่อยไปหมายค้นวี่แววเสี่ยโจ้ไปนอก,1,1695
เห็นแย้งเสี่ยโจ้,1,1695
บทลงโทษให้อาหารหมูป่า,1,1695
อุษาบู๊พยาบาทพีทีวี,1,1695
ขบวนรถควรค่าลำโพงถึงว่าขบวนรถสถานีรถไฟลำโพงการจราจรติดขัด,1,1695
บิณฑบาตหรอทีหลังอินโดจีนผ้าเหลือง,1,1695
วงจรปิดกางเกงขาสั้นจักรยานยนต์หอพักบัวโรยเสาธงเสาธงหนังสติ๊ก,1,1695
ความต่างกันจูนความหลากหลายระเบียบวินัยกระหายสชั่น,1,1695
ธันย์ชนกแมสก์สักครู่แมสก์ด่าทอการโต้เถียง19.43,1,1695
ฟังเพลงหม่าเทปเลิกเรียนลายเซ็นต์ผลักแสดงออกอัลบั้ม,1,1695
โบว์เต็มปากIG,1,1695
ความหลากหลายตรากฎหมายบทบัญญัติการบีบทางตันประมวลกฎหมายแพ่งและพาณิชย์ธัญวัจน์,1,1695
